이,재,명
"‘경기도 3차 공공기관 이전 추진계획’에 경기 북·동부 도민들 환호이성호 양주시장, “경기북·동부의 실질적인 발전 견인하는 마중물”이재명 경기도지사[헤럴드경제(의정부)=박준환 기자]“특별한 희생엔 특별한 보상.”경기도 북·동부권역 도민들은 이재명 경기도지사 하면 곧바로 이 말을 떠올린다. 그가 성남시장을 거쳐 경기도지사를 하면서부터는 늘 이 말을 입에 달고 다녔기 때문이다.규제, 규제하면 이골이 나 있는 경기도 북·동부권역 도민들, 17일엔 모처럼 크게 웃었다. 2018년 7월 제35대 경기도지사에 취임한 이 지사가 민선 7기 도정 핵심공약으로도 내걸었던 ‘특별한 희생, 합당한 보상’이라는 약속을 거듭 지켰기 때문이다.이날 이 지사는 도청에서 기자회견을 열고 ‘경기도 3차 공공기관 이전 추진계획’을 발표했다. 경기 북·동부권역의 균형발전을 위해 경기연구원, 경기신용보증재단, 경기도경제과학진흥원, 경기농수산진흥원, 경기복지재단, 경기주택도시공사, 경기도여성가족재단 등 7개 기관의 이전을 추진하겠다고 밝힌 것이다.접경지역인 김포, 파주, 양주, 동두천, 연천 등은 군사시설보호구역으로써 강력한 규제를 받고 있다. 광주, 양평, 남양주,구리 등은 2500만 수도권 시민들의 먹는 물 안전을 책임져야하는 까닭에 취수 관련 상수원보호구역, 상수원 특별대책지역, 수변구역 등 규제가 덧씌워져 있다. 경기도 북·동부권 도민들은 수도권정비계획법, 개발제한구역, 자연보전권역, 수질오염총량관리 등 하도 많은 규제가 중첩돼 있어 규제가 규제인지 조차 실감하지 못할 정도로 일상생활은 이미 익숙해 져 있다. ‘옴짝달싹 하지 않으면 되는 것 아닌가’라는 게 몸에 배 있다.“특별한 희생엔 특별하고 합당한 보상이 뒤따라야 공정한 가치에 부합한다.”수차례, 그리고 자주 듣다보니 경기도 북·동부권 도민들은 이게 이재명 지사의 정치적 구호가 아니라 진정성이 담긴 철학임을 알게됐다. 그리고 기다렸다.“앞서 이미 두 차례 공공기관을 이전키로 결정해 더 이상은 없을 것으로 여겼는데 또 큰 선물을 안겨주네요(김요현, 주부·고양시 주교동).실제로 경기도는 2019년 12월 경기관광공사, 경기문화재단, 경기도평생교육진흥원 등을 ‘고양관광문화단지’에 이전키로 했다.또 지난해 9월에는 경기교통공사, 경기도일자리재단, 경기도시장상권진흥원, 경기환경에너지진흥원, 경기도사회서비스원 등을 시·군 공모를 통해 양주시와 동두천시, 양평군, 김포시, 여주시로 각각 이전키로 한 바 있다.“이재명 지사가 왜 대선 주자 선호도 1위인 줄 알았어요. 식언(食言)하지 않는 것, 정치 지도자들이 좀 배웠으면 좋겠어요(김준형, 구리시 체육관로).경기북·동부권역 도민들의 환영이 잇따르는 가운데 이성호 양주시장도 가세했다.이성호 시장은 “이재명 경기도지사의 이번 큰 결정이야말로 양주시민을 포함한 354만 도민이 거주하고 있는 경기북·동부의 실질적인 발전을 견인하는 마중물”이라며 “도정철학인 ‘특별한 희생에 대한 특별한 보상’의 실현이 경기북·동부의 미래 성장과 경기도 균형발전을 통한 경기 새천년의 보다 확실한 미래를 굳건히 하게 될 것”이라고 감사의 뜻을 밝혔다"
"[주장] '조선' 기사에서 제시한 문제점들은 잘못된 지적이거나 섣부른 판단[설진성 기자]        ▲ 2월 15일 자 <조선일보> 1면에 실린 ""혁신학교, 예산 줄이고 확대 정책 폐기하라""            ⓒ 조선일보  2월 15일자 <조선일보> 1면에 실린 ""혁신학교, 예산 줄이고 확대 정책 폐기하라""(박세미 기자)는 지난달 서울교육연구정보원에서 펴낸 '서울혁신교육정책 10년 연구' 보고서를 인용한 기사다. 혁신학교 정책에 대해 특혜정책, 학력 저하, 편의와 방종 등의 용어를 써가며 혁신학교를 비판하고 있다. 그러나 이 기사는 상관관계나 인과관계가 낮은 속성 두 가지를 억지로 연결해 놓거나 표면적인 수준에 머물러 있기 때문에 혁신학교 현황을 호도하고 있다.첫째, 혁신학교에 주는 예산은 특혜가 아니다. 혁신학교 예산은 교육 분야에서 대표적으로 사회를 통합하는 공평한 예산이다. 혁신학교 예산은 지역적으로 낙후된 혁신학교를 보완하는 역할을 한다. 혁신학교가 받는 적은 예산은 사회경제적 지위가 낮은 가족들이 교육을 보충하도록 기회를 제공한다.서울의 아파트값 평균과 서울에 소재한 혁신 중학교 42개 주변의 아파트값 평균을 비교해보았다.한국부동산원에 따르면 서울 아파트 가격이 1제곱미터(m²)당 1100만 원인데 비하여 서울 소재 혁신중학교 42개 주변 아파트의 가격은 1m²당 800만 원밖에 되지 않는다. 99.17m²(30평)을 기준으로 계산하면 무려 2억8000만 원의 가격 차이가 나는 셈이다.심지어 몇몇 혁신학교 주변에는 아파트가 없다. 낙후된 지역에 혁신학교가 세워졌던 10년의 역사 동안 혁신학교 예산은 그 지역에서 부족한 사회적 자본을 보충해 주는 순기능을 하고 있었다. 오히려 혁신학교에 3억에 달하는 특별예산을 주며 더 좋은 교육으로 가르쳐야 하지 않겠는가? 그래야 교육 기회의 공정을 논하지 않겠는가?             ▲ 2020년 서울 혁신학교 주변 아파트 평균과 서울시 아파트 평균 비교(30평형 기준) 2020년 2월부터 2021년 1월까지 한국부동산원에서 제공하는 서울시의 아파트 평균 가격과 혁신학교 주변 아파트 평균 가격을 비교하였다. 30평형(99.17m2)을 기준으로 혁신학교 주변의 아파트 시세는 약 2억 8천만원 정도 낮았다.            ⓒ 설진성  여러 국가에서 온 다문화 가정을 지원하는 것이 사회적 비용을 줄이는 방법이듯, 혁신학교에 예산을 지원하고 학생을 잘 교육하면 미래의 건실한 시민을 키우는 것이 된다. 결국 혁신학교 정책은 우리 사회가 통합되는 방법이요, 사회적 비용을 줄이는 정책이다. 특혜가 아니라 선택적 복지의 실현이다. 따라서 혁신학교 정책은 소극적인 교육 기회의 평등을 넘어 생태 문화적 결핍으로 만들어지는 학습 격차를 해결하는 공정한 정책이다.둘째, 혁신학교가 학력 저하를 일으킨다는 근거가 부실하다. 혁신학교의 학력을 비교하려면 사회경제적 지위가 비슷한 주위의 일반학교와 비교해야 한다. 위에서 보듯 혁신학교 학구는 일반학교에 비하여 사회경제적으로 낙후되어 있을 가능성이 높기 때문이다. 이런 격차를 무시하고 위의 기자는 자료를 단순히 비교하여 ""혁신학교가 기초학력 부진 학생이 많다""라는 단견을 내세웠다.오히려 혁신학교는 기초학력을 보장하는 정책이다. 혁신학교는 협동학습, 문제해결학습, 협력학습 등 학생들 간 상호작용을 촉진하는 수업을 장려한다. 수업안에서 학생들은 동료와 교사에게 모르는 것을 말할 기회를 갖는다. 모르는 것을 모른다고 말할 수 있는 편안함은 매우 중요하다. 아는 체하며 넘어가는 학습자는 교사와 동료에게 배울 기회가 없기 때문이다. 이렇게 혁신학교에서 학생들은 서로 도움을 주며 고차적 사고를 키우는 학습을 하고 있다.과거에 일제식 전국 국가성취도 평가가 있을 때 교사가 학교에서 버젓이 시험 대비 문제집을 풀게 하던 때가 있었다. 학생 간 협력적 상호작용은 보기 어렵고 어려움이 있는 학생은 더욱 포기하게 만드는 상황이었다. 틀린 문제를 일일이 교사가 풀어줄 수도 없으면서도 시험에 대한 압박감을 이용하여 점수를 높이겠다는 시도였다. 거기에 배움은 없었고 느린 학생은 낙오되었다.물론 평가의 가치는 높다. 교사는 평가를 통해 학생들이 공부하는 것이 기쁘고 가치 있는 것이라 여기는 학습문화를 만들 수 있다. 짧지 않은 필자의 교사 경험상 중간층 학생들에게 어느 정도 효과가 있다고 인정한다. 그러나 기성세대가 공부에 대해 착각하듯, 부진 학생을 밀어 부쳐봐야 그들은 배움으로부터 멀어진다. 특히 저학력 학생은 열등감 속에서 도움받을 곳을 찾지 못하거나 포기한다.'시험 치는 문화'는 학생이 경쟁과 압박으로 시험 치는 기계가 되는 문화를 양산해왔다. 시험 대비 수업 행태를 만들었다. 학생도 교사도 정답과 오답의 구분이 분명한 교과서 지식을 선호하게 되었다. 단순히 교사가 지필평가로 내기 쉽기 때문이다. 그러니 학생들도 고차적 문제, 삶과 연계된 문제는 외면해왔다.그렇지 않은 문제, 예를 들어 코로나19의 확산 속도가 시민의 이동량에 따라 선형적인지, 지수함수적인지, 로그 함수적인지 토론하는 것은 하나도 중요하지 않다. 그렇지만 실제로는 삶과 연계되고 가치가 담기며 토론이 요구되는 문제에서 학생들은 진짜로 공부한다. 진짜 고차적 사고와 역량이 습득된다. 따라서 '시험 치는 문화'가 학생의 기본 학력을 키운다는 말은 비약이다.셋째, 혁신학교가 교육과정을 자율적으로 운영하는 것으로 인하여 교사의 편의 및 방종이 늘었다고 하였다. 도대체 어떤 근거로 그런 말을 하는가? 자율이 교사의 편의와 방종으로 이어진다? 책임자인 교장은 주눅 들어 있다?<조선일보> 말대로 혁신학교에서는 학교의 중요한 일을 결정할 때 학생과 교사 및 학부모가 참여하여 결정한다. 공교육을 책임지는 학교는 민주시민을 양성하기에 학교 교육과정을 운영하는 데에도 민주적으로 한다. <조선일보> 말과는 거꾸로 학교가 민주적으로 운영될수록 학교효과성을 높다고 많은 학자들이 말한다.필자가 연구한 바에 의하면 대한민국의 교사들은 학교 풍토가 민주적일수록 교사효능감과 학교만족도가 높다. 교사가 학생을 잘 가르치고 생활교육을 잘 할 수 있으리라 스스로 믿는다는 말이다. 또한 교사는 학교에서 보람을 갖고 근무하게 된다. 학교 풍토가 민주적일수록 교사는 학교를 더욱 신뢰하고 먼저 나서서 협력하려고 노력한다.교사가 주위 동료와 관리자를 신뢰하고 학교 운영을 신뢰하니 당연히 솔선수범하면서 교육과정을 혁신하려고 노력한다는 말이다. 교장과 교감도 교사를 참여적으로 이끌면서 성공감을 경험할 수 있다. 결국 <조선일보>는 한두 사례를 전체인 것처럼 침소봉대한 것이라고 밖엔 볼 수 없다.혁신학교의 민주적 의사결정 풍토는 교사만을 위한 것이 아니다. 학생과 학부모 주체의 민주적 참여와 결정권을 보장하는 것이다. 절대 교사 편의주의가 아니고 오히려 학교 교육과정을 개방적이고 민주적으로 운영하자는 교육신념을 실현하는 것이다. 민주적 의사결정 효과는 혁신학교에 국한되는 것이 아니라 일반학교 안에서도 증명되었다.따라서 혁신학교의 철학은 반드시 그 경계를 넘어 일반학교에도 확대되어야 한다. 공약이 있는 교장을 교사, 학부모, 학생이 선택할 수 있는 권리를 확보한다든지, 중요한 의사결정에 대해 학생, 교사, 학부모의 자치권을 보장하도록 노력해야 한다.<조선일보> 기사에서 제시한 특혜정책, 학력 저하, 방종 등의 문제점들은 잘못된 지적이거나 섣부른 판단이라고 단언할 수 있다. 물론 혁신학교 정책이 가지는 단점이 있을 수 있다. '서울혁신교육정책 10년 연구' 보고서는 그런 점을 언급했을 뿐이지 전체적인 내용은 혁신학교 교육을 발전시키자는 것이었다. 보고서를 쓴 책임연구자도 이미 <오마이뉴스> 기사를 통해 반박한 바 있다. <조선일보> 기자는 책임 있는 기자 정신을 발휘해 주기바란다. (관련 기사 :내가 '혁신학교는 실패한 정책'이라는 보고서를 냈다고?)저작권자(c) 오마이뉴스(시민기자), 무단 전재 및 재배포 금지▶오마이뉴스 '시리즈'에서 연재하세요!▶이재명 경기도지사 추천 《이재명과 기본소득》▶오마이뉴스 취재 후원하기"
"지난 설 연휴에도 비상근무를 하며 2차 경기도 재난기본소득의 원활한 접수 및 처리에 혼신의 힘을 쏟은 경기도청 전산부서에 이재명 지사가 피자 한판씩을 나눠주며 깜짝 격려했다.  사진=뉴스1""가뭄 때문에 풀밭이 다 말라 죽어도 지금 당장 토끼나 사자는 아무 상관이 없다. 사자는 풀이 없어도 토끼를 잡아먹으면 된다. 하지만 궁극적으로 토끼도 죽고 사자도 죽게 될 것이다. 이 지점을 인식해야 한다. 그래서 풀밭에 물은 주고 살자는 것이다.풀밭은 유지하면서 그 안에서 경쟁을 하자는 것이다. 풀밭이 사라지는 방식으로 경쟁이 계속되면 어떻게 되겠는가. 그래서 풀밭을 유지하는 비용을 내자는 게 기본소득이다. '기본소득은 우리 모두에게 도움이 된다'는 공감이 더욱 필요할 때다.""최근 출간된 '이재명과 기본소득(최경준)'에서 이재명 경기지사가 기본소득을 설명하며 든 비유다. 한국 최초로 기본소득을 도입한 이 지사의 철학과 행보를 통해 기본소득의 실체와 가능성, 방향 등을 분석한 해당 저서에서 이 지사는 ""기본소득을 통해 새로운 삶의 방식이 가능하다는 것을 보여주고 싶었다""고 밝혔다.아울러 이 지사는 코로나19 시대의 경기도 재난기본소득이 지역경제 회복의 일시적 효과에 그치는 것 아니냐는 우려에 대해서도 정확한 상황인식을 보여주고 있었다. 예의 그 명쾌한 화법으로 ""당연하다"", ""감기약과 같다""는 답을 내놨다.코로나19 불황 속 설 명절을 앞두고 모처럼 활기 찾은 수원 못골시장.  사진=머니S실제적으로 명절을 앞두고 본격적으로 풀린 재난지원금은 수원 남문지역 9개 전통시장 가운데 한 곳인 못골시장은 골목 전체가 장을 보러 나온 시민들로 북적였다.방문객과 상인 모두 마스크를 착용했다는 점 말고는 코로나19 위기 상황임을 인식할 수 없을 정도로 인파가 몰렸다.이러한 효과는 보이지 않는 곳에서 완벽하게 업무지원하는 공직자들의 노력과 각시군 공직자분들의 노력도 포함한 성과다.지난 설 연휴에도 비상근무를 하며 2차 경기도 재난기본소득의 원활한 접수 및 처리에 혼신의 힘을 쏟은 경기도청 전산부서에 이재명 지사가 피자 한판씩을 나눠주며 깜짝 격려했다.'이재명과 기본소득'.  사진=오마이북17일 경기도에 따르면 도 정보기획담당관실 직원 15명과 각 카드사 13명 등 28명은 지난 11~14일 설 연휴 기간 동안 2차 재난기본소득 비상근무를 하면서 64만2000여명의 신청접수를 처리했다. 1일 평균 16만652명의 접수를 처리한 셈이다.재난기본소득 접수시간은 오전 8시30분부터 오후 11시까지다.그러나 사전준비, 마감 후 집계, 일일결산, 보고서 작성을 감안하면 이들은 아침 7시부터 그 다음날 오전 1시까지 무려 18시간 가까이 일한 셈이다.특히 재난기본소득 신청 접수 등 프로그램 운영, 상담, 등 준비를 위해 정보기획담당관실 직원 23명은 재난기본소득 첫 신청이 시작된 지난 1일부터 현재까지 휴식 없이 매일 근무 중이다.아울러 재난기본소득 지급이 완료된 후에는 특별휴가라는 포상휴식도 약속했다.전산 주요업무를 추진하고 있는 윤동섭 주무관은 “이재명표 피자한판 격려에 반복되는 업무로 지친피로가 한방에 풀린 듯하다”면서 “더욱 매진하여 신청율 100%까지 긴장으로 접수불편 제로로 원하는 시기에 재난기본소득이 지급될 수 있도록 더욱 매진하겠다”고 말하며 활짝 웃었다.지난 1~16일 2차 재난기본소득을 신청 받은 결과, 전체 지급대상자(1343만8238명)의 16일 오후 11시 현재 총 947만840명(지급금액 9681억원)이 신청한 것으로 집계됐으며, 1조에 욱박하고 있다.  자료제공=경기도이러한 경기도의 노력은 실적으로 증명되고 있다. 지난 1~16일 2차 재난기본소득을 신청 받은 결과, 전체 지급대상자(1343만8238명)의 16일 오후 11시 현재 총 947만840명(지급금액 9681억원)이 신청한 것으로 집계됐으며, 1조에 욱박하고 있다.총 지급규모는 1조4237억원(경기도 1조3914억원(1인당 10만원)+포천시 323억원(1인당 20만원))이다.경기=김동우 기자"
[서울=뉴시스]경기사진공동취재단 = 이재명 경기도지사가 17일 오전 경기도 수원시 경기도청에서 경기도 공공기관 3차 이전 추진 기자회견을 위해 브리핑룸으로 이동하고 있다. 2021.02.17.
"울산 대곡천 암각화군, 잠정목록 10년만에... ""2025년 세계유산 등재 목표""[박석철 기자]        ▲ 2019년 1월 25일 정재숙 문화재청장이 울산 울주군 반구대암각화 고래그림을 보고 손짓하고 있다.             ⓒ 울산시 제공  선사시대 우리 선조들이 각종 동물과 사람의 모습을 표현한 그림 200여 점을 새긴 울산울주군 언양읍 대곡리의반구대 암각화(국보 제285호)는 국내 문화재 중 최고 가치를 인정받은 바 있다.지난 2009년 문화재청 설문조사(전국 20세 이상 남녀 5900명 대상)에서 4926억 원 최고 가치를 부여 받았던 것(관련 기사 :5천억원짜리 그림, 이렇게 망가뜨려도 되나).또한 반구대 암각화는 세계사적으로도 큰 의미를 지녔지만 1971년 발견되기 전 이미 인근에 댐이 생겨 장마철에는 암각화가 물에 잠기는 등 난제가 있어 유네스코 세계문화유산 등재를 못 하고 있다.하지만 2021년 2월 16일, 발견된 지 50주년을 맞는 반구대 암각화가 유네스코 세계유산 우선등재 대상에 선정됐다.16일 열린 문화재청 문화재위원회 세계유산분과위원회 심의에서 통과한 우선등재 대상지는 울산 대곡리 암각화(국보 제285호)와 인근 천전리 암각화(국보 제147호)를 아우르는 반구대 일대의 계곡이다.심의에서는 이날 ""해당 지역의 암각화는 신석기 시대 인류 최초의 포경(고래잡이)활동을 보여주는 독보적 증거이자 현존하는 동아시아 문화유산 중 가장 이른 시기의 것""이라며 높은 평가를 부여했다.앞서지난 2010년 울산 대곡천 암각화군은 유네스코 세계문화유산 잠정 목록에 등재된 바 있다. 결국 10여 년 만에 우선등재 대상지로 선정됐다.오는 2025년 세계유산 등재를 목표로 한다.이번 우선목록 등재에 앞서 지난해 10월 울산시와 문화재청이 공동으로 반구대암각화 세계유산 등재 추진위원회를 구성했다. 이어 관련 조례 제정, 유네스코 등재 울산시민단 발족, 관계기관과의 업무협약 등 울산에서는 민관협력을 바탕으로 한 다양한 노력을 펼쳤다.따라서 오는 2025년 세계유산 등재를 목표로 반구대 암각화에 대한한 다양한 학술연구와 국내외 비교연구, 체계적인 보존과 관리를 위한 스마트 관리체계 구축, 시민과 방문객 편의를 위한 각종 정비사업 등이 추진된다.송철호 울산시장은 반구대 암각화의 우선등재대상 선정 소식이 나온 후 ""울산이 세계유산도시에 한 걸음 가까이 다가서게 되었다""면서 ""인류 최초의 기록유산이자 울산의 가장 큰 문화적 자랑인 반구대 암각화가 제대로 가치를 인정받아 세계유산으로 등재되는 그날까지 노력을 멈추지 않을 것""이라고 밝혔다.저작권자(c) 오마이뉴스(시민기자), 무단 전재 및 재배포 금지▶오마이뉴스 '시리즈'에서 연재하세요!▶이재명 경기도지사 추천 《이재명과 기본소득》▶오마이뉴스 취재 후원하기"
