이,재,명
"이재명 지사는 17일 도청서 3차 7개 공공기관 이전 계획을 발표했다. 제공=경기도[수원=스포츠서울 좌승훈 기자]이재명 경기도지사는 17일 도청서 경기 북·동부지역의 균형발전을 위해 경기연구원, 경기신용보증재단, 경기도경제과학진흥원, 경기농수산진흥원, 경기복지재단, 경기주택도시공사, 경기도여성가족재단 등 7개 공공기관 이전이 담긴 3차 계획을 발표했다.이 지사는 이날  “경기북·동부 지역의 발전이 더딘 이유는 수도권정비계획법을 비롯해 군사안보나 수자원 관리 등 중첩규제로 인해 오랜 기간 지역 발전에 제한이 있었기 때문”이라며 “사람이든 지역이든 공동체를 위한 특별한 희생을 하고 있다면 이에 합당한 보상을 하는 것이 공정의 가치에 부합하고, 이것이 균형발전을 위한 길이라 믿는다”고 했다.이어 “두 차례에 걸친 공공기관 이전 결정 역시 그런 노력의 일환이었다”며 “보다 실질적인 효과를 발휘하기 위해 규모가 더 큰 기관의 이전이 필요하다고 판단해 추가 이전을 추진하기로 했다”고 배경을 설명했다.경기도의 공공기관 이전은 이번이 세 번째다. 앞서 도는 2019년 12월 고양시와 업무협약을 맺고 2025년까지 경기관광공사와 경기문화재단, 경기도평생교육진흥원 등 3곳의 공공기관을 ‘고양관광문화단지’에 이전하기로 했다.지난해 9월에는 경기교통공사와 경기도일자리재단, 경기도시장상권진흥원, 경기환경에너지진흥원, 경기도사회서비스원 등 5개 공공기관의 주사무소를 시·군 공모를 통해 선정하고 양주시와 동두천시, 양평군, 김포시, 여주시로 각각 이전 중이다. 세번째로 이전이 추진될 7개 기관은 도민의 요구와 기관 특성 등을 종합적으로 고려해 선정됐다. 7개 기관의 근무자수는 총 1100여 명으로, 지난 1·2차 이전 기관의 근무자수를 전부 합친 규모와 비슷하다. 이전 대상지역은 경기 북·동부의 접경지역과 자연보전권역 가운데 중복 지역을 제외한 17개 시·군을 대상으로 공모를 통해 선정한다. 이번 달부터 공모계획을 수립해 기관별 공모를 추진하고 4월에 심사를 거쳐서 5월경에 이전 선정 대상 시·군을 발표할 계획이다. 도는 공정하고 투명하게 심사가 이뤄질 수 있도록 외부전문가로 심사위원회를 구성하고, 균형발전과 사업 연관성, 접근성과 도정협력도 등을 종합적으로 고려해 이전지역을 선정할 방침이다. 시군 간 과열 경쟁 방지와 재정 규모 차이에 따른 불이익이 없도록 시·군의 재정부담 부문은 심사기준에서 제외한다.이재명 지사는 “경기도는 모두의 이익을 위한 일정한 규제가 불가피하더라도 전체를 위해 특정 지역이 일방적으로 희생하는 일이 없도록 앞으로도 세심하게 살피고 각별히 배려하겠다”고 말했다.좌승훈기자"
[서울=뉴시스]경기사진공동취재단 = 이재명 경기도지사가 17일 오전 경기도 수원시 경기도청에서 경기도 공공기관 3차 이전 추진 기자회견을 하고 있다. 2021.02.17.
[서울=뉴시스]경기사진공동취재단 = 이재명 경기도지사가 17일 오전 경기도 수원시 경기도청에서 경기도 공공기관 3차 이전 추진 기자회견을 하고 있다. 2021.02.17.
(수원=연합뉴스) 홍기원 기자 = 이재명 경기도지사가 17일 오전 경기도 수원시 경기도청에서 경기도 공공기관 3차 이전 추진 기자회견을 하고 있다. 2021.2.17
"신종 코로나바이러스 감염증(코로나19) 신규 확진자가 621명 발생한 17일 오전 서울 용산구 서울역광장에 마련된 임시선별진료소를 찾은 시민들이 검체검사를 받고 있다. 질병관리청 중앙방역대책본부에 따르면 이날 0시 기준 코로나19 누적 확진자는 621명 증가한 8만4946명으로 나타났다. 2021.2.17뉴스1 © News1 이재명 기자(서울=뉴스1) 김진희 기자 = 서울 관악구에서 신종 코로나바이러스 감염증(코로나19) 확진자 18명이 쏟아졌다.17일 관악구에 따르면 전날부터 이날까지 이틀간 주민 18명이 코로나19 양성 판정을 받았다. 지역 내 확진자는 총 1309명으로 늘어났다.신규 확진자 18명 중 5명은 전날, 13명은 이날 확진됐다. 가족 간 감염 9명, 지역 내 감염 2명, 타 지역 확진자의 접촉자 2명, 감염경로 조사 중 환자 5명 등이다.  관악구는 이들 확진자에 대해 국가지정병원 이송조치 및 역학조사를 진행 중이다. 확진자 주거지 등에도 방역소독할 예정이다"
"교육부, 2025년 고교학점제 발표에 “먼저 대입부터 개편해야” 목소리[윤근혁 기자]             ▲ 17일 오전 유은혜 교육부장관이 경기 구리시 갈매고에서 고교학점제 추진계획을 발표하고 있다.             ⓒ 교육부  유은혜 교육부장관은 ""고교학점제가 아이들을 자기주도적인 인재로 키울 것""이라고 말했지만, 일반고 교사 66%는 ""학점제가 시행되면 대입에 유리한 과목을 선택하게 될 것""이라고 우려했다. 교원단체들은 ""먼저 대입제도부터 바꾸라""고 요구했다.고교학점제 계획만 있고, 대입개혁 내용은 없어17일, 유은혜 교육부장관은 고교학점제 종합추진계획을 발표하면서 ""오는 2025년부터 적용될 고교학점제는 학생이 자신의 진로와 적성에 따라 과목을 선택하고, 학점을 취득하여 졸업하는 제도""라면서 ""고교학점제는 우리 아이들이 자기주도적인 인재로 성장하도록 돕는 촉매제가 될 것""이라고 기대를 나타냈다.이날 교육부는 경기 구리시 갈매고에서 연 기자회견에서 현재 초등학교 6학년 학생이 고등학교 1학년이 되는 2025년부터 학생들이 교육과정을 구성하는 고교학점제를 전면 시행한다고 발표했다. 이렇게 될 경우 교육부는 ""경쟁과 선발 중심에서 학생 개개인의 교육 수요에 부응하는 수평적 다양화 작업이 구현될 것""이라면서 ""학생들의 수요를 존중하여 개별화된 교육을 구현하게 된다""고 설명했다.이를 위해 교육부는 2025년부터 성취평가제를 전체 선택과목으로 확대키로 했다. 성취평가제는 서열 위주의 기존 평가체제에서 벗어나 성취도에 따라 5단계로 평가하는 제도다. 학교 공간도 그린스마트 미래학교 사업과 연계해 바꿀 예정이다.하지만, 이날 교육부는 정작 고교학점제에 앞서 추진해야 될 대입제도 개편 내용에 대해서는 입을 다물었다. 교육부는 올해(2021)부터 미래형 대입 논의에 착수해서, 학점제 시행 직전 해인 2024년에야 2028학년도 대입방향을 발표하려는 계획을 갖고 있다.다만, 이날 유 장관은 ""2025년 고교교육의 변화는 2028학년도 대입 변화로까지 이어질 것""이라면서 ""오지선다 수능 문제로 상징되는 획일적인 교육과 경쟁 중심의 교육에서 탈피하게 될 것""이라고 말했다. 유 장관은 2019년 11월에는 수능 관련 과목 경쟁과 집중을 부추기는 수능 확대 방안을 내놓은 바 있다.대입 개편 없는 추진, 교과교실제 악몽 되풀이?상황이 이렇다보니 교육계에서는 2009년 교육과정 개정 당시에 교육부가 추진했던 교과교실제 악몽이 되풀이되는 것 아니냐는 우려 목소리도 나온다. 당시 교육부는 '학생과 과목 중심 수업'으로 개혁한다면서 학생이 교과목별로 마련된 교실을 찾아다니는 교과교실제를 2014년까지 전면 확대한다고 발표한 바 있다. 하지만 수능 위주의 대입제도에 막혀 현재는 흐지부지된 상태다.실제로 일반고 교사들의 66%는 '고교학점제가 시행되어도 학생들이 대입에 유리한 과목을 선택하게 될 것'('대학 진학에 도움 되는 과목' 37.2%, '내신이나 수능에 유리한 과목' 28.8%)으로 판단하고 있는 것으로 나타났다. 정작 '학생 본인의 적성과 흥미에 따른 과목'을 선택할 것이라는 응답은 23.3%에 그쳤다. 한국교총이 일반고 교원 1662명을 대상으로 설문조사를 벌여 17일 발표한 결과다.이런 결과에 대해 한국교총은 ""고교학점제로 학생선택권이 강화되더라도 대입 등 각종 이해관계가 뒤얽힌 교육제도를 종합적으로 고려해야 한다""면서 ""그렇지 않으면 학생의 적성과 관심사를 중심으로 고교학점제가 운영되기는 어렵다는 것을 반증하는 결과""라고 설명했다.정소영 전교조 대변인도 ""정시를 확대하는 기존의 대입제도를 개선하지 않고 고교학점제 계획부터 발표하는 것은 어불성설""이라면서 ""대입제도 개편 등 선결과제들을 뒤로 미룬 채 '대책은 나중에 차차 마련하겠다'는 식의 고교학점제 전면 도입 계획은 재검토해야 한다""고 요구했다.저작권자(c) 오마이뉴스(시민기자), 무단 전재 및 재배포 금지▶오마이뉴스 '시리즈'에서 연재하세요!▶이재명 경기도지사 추천 《이재명과 기본소득》▶오마이뉴스 취재 후원하기"
"11대 1의 높은 경쟁률 뚫고 선발된 청년연수단원 7명 위촉[윤성효 기자]        ▲ 17일 오후 경남문화예술회관에서 열린 경남도립극단 제1기 청년연수단원 위촉식.            ⓒ 경남도청  김경수 경남도지사은 '경남도립극단 제1기 청년연수단원'을 격려하면서 ""새로운 길 가는 사람들이 성공해야 한다""며 ""지원에 최선 다할 것""이라고 했다.김 지사는 17일 경남문화예술회관에서 진행된 위촉식에 참석해 이같이 밝혔다. 이날 위촉식에는 강동옥 경남도립예술단 부단장, 도립극단 박장렬 예술감독과 청년연수단원 등 20여 명이 참석했다.행사는 거리두기 지침에 따른 방역수칙을 준수하며 ▲청년단원 소개 ▲위촉장 수여 ▲청년단원에게 보내는 희망글 작성 ▲청년단원과의 대화 순으로 진행됐다.지난해 2월 창단된 도립극단은 박경리 작가의 소설 <토지>를 국내 최초로 연극으로 각색해 무대에 올려 호평을 받았고, 올해 연극 <토지Ⅱ>를 준비하고 있다.경남도와 도립극단은 연극의 미래를 책임질 젊은 인재를 육성하고, 나아가 '청년특별도 경남'을 만들어 나가기 위해 '청년연수단원제'를 추진했다.지난 1월 진행된 청년연수단원 공개모집에는 경남뿐만 아니라 서울과 경기, 부산 등 전국에서 77명이 지원했고, 동영상 심사와 실기·면접전형을 거쳐 7명이 선발됐다.이번에 위촉된 청년연수단원들은 오는 12월까지 도립극단에 상근하면서 연기와 보컬, 무용 등 연수 프로그램을 통해 역량을 강화하고, 도립극단 정기 및 순회공연 등 다양한 작품에 참여하게 된다.경남도는 단원들의 주거문제 해결을 위해 예술단원 숙소를 운영하며, 체류 수당도 별도로 지급하기로 했다.김 지사는 위촉장 수여 후 가진 청년단원과의 대화에서 먼저 ""치열한 경쟁을 뚫고 선발되신 것을 축하드린다""며 인사를 건넸다.김 지사는 ""지역 연극인, 청년 연극인들이 활동할 수 있는 공간과 무대, 그리고 마음놓고 활동할 수 있는 여건이 어떻게 만들어지느냐가 제일 중요하다""고 했다.김 지사는 ""작년에 도립극단 만든 이후에 박장렬 감독님 중심으로 지역 연극계에 새로운 모델을 만들어가는 과정에 있다. 그중에 하나 새로운 길을 여러분이 시작하시는 것""이라고 했다.그러면서 김 지사는 ""여러분이 성공하셔야 그 뒤에 오는 청년들이 여러분이 걸어간 발자국을 따라올 것""이라며 ""우리 도에서는 여러분이 반드시 성공할 수 있도록 지원하는 데 최선을 다하겠다""는 약속을 전했다.또한 김 지사는 청년연수단원들에게 위촉장과 함께 꽃다발도 전달하며 경남도가 추진 중인 '꽃 소비 캠페인'에 동참했다.             ▲ 17일 오후 경남문화예술회관에서 열린 경남도립극단 제1기 청년연수단원 위촉식.            ⓒ 경남도청               ▲ 17일 오후 경남문화예술회관에서 열린 경남도립극단 제1기 청년연수단원 위촉식.            ⓒ 경남도청               ▲ 17일 오후 경남문화예술회관에서 열린 경남도립극단 제1기 청년연수단원 위촉식.            ⓒ 경남도청               ▲ 17일 오후 경남문화예술회관에서 열린 경남도립극단 제1기 청년연수단원 위촉식.            ⓒ 경남도청               ▲ 17일 오후 경남문화예술회관에서 열린 경남도립극단 제1기 청년연수단원 위촉식.            ⓒ 경남도청  저작권자(c) 오마이뉴스(시민기자), 무단 전재 및 재배포 금지▶오마이뉴스 '시리즈'에서 연재하세요!▶이재명 경기도지사 추천 《이재명과 기본소득》▶오마이뉴스 취재 후원하기"
"[경기 별곡] 김포 3편 경기도의 31개 도시 하나 하나를 새롭게 조명하고 여행의 매력을 새롭게 알아가보자 합니다. 김포를 시작으로 파주, 연천, 고양, 강화도, 시흥, 안산, 부천, 의정부, 양주 지역을 현재 취재 중입니다. <기자말>[운민 기자]        ▲ 문수산을 따라 뻗어있는 문수산성날이 좋으면 북한의 개성땅 까지 훤히 들여다 보인다.            ⓒ 운민  어느덧 건너편 산자락에서 돌로 된 성문이 우뚝 솟아 나를 맞아준다. 드디어 문수산성에 도착한 것이다. 문수산이라는 이름은 사실 흔하다. 아마 불교의 문수보살(文殊菩薩)에서 유래되었을 터인데 김포뿐만 아니라 내가 예전에 살던 울산에도 있고, 용인에도 문수산이란 지명이 있다고 하니 흔하디흔한 산 이름이지만 이 산이 특별한 이유는 바로 문수산성이란 성곽 때문이다.국방을 중시한 조선 숙종에 의해 1694년에 지어졌으며, 특히 병인양요 당시 프랑스군과 엄청난 격전지였다고 한다. 이때의 격전으로 해안 쪽 성벽과 문루가 파괴되고, 성내가 크게 유린되었다. 지금은 해안 쪽 성벽과 문루가 없어지고 마을이 들어섰으며, 문수산 등성이를 연결한 성곽만 남아 있다.내가 보고 있는 이 성문은 남문으로 2002년에 복원이 완료된 복제품에 불과하지만, 상상으로만 여겨졌던 산성의 위용이 피부로 와 닿는다. 하지만 문수산성의 진면목을 알려면 문수산을 두 시간 반가량 등산해야 하기에 머뭇거림이 있었다. 여기까지 온 게 너무나 아쉬워 품속에 아껴둔 초콜릿을 한입 베어 물며 첫발을 내디뎠다.어렸을 땐 등산을 무척 싫어했었다. 힘들게 오르는 게 쓸데없는 고생을 자처하는 것만 같아 이해하지 못했다. 특히 산에는 모기와 벌, 파리 같은 벌레도 득실거리고 바닥은 돌이나 진흙으로 뒤덮여서 신발이 성할 수 없었다. 또, 기껏 힘들게 올라와서는 올라온 만큼 힘들게 내려가야 한다는 사실이 나를 더 불편하게 만들었다.하지만 나이가 조금 드니 약간 이해가 되기 시작한다. 사회생활을 시작하면서 고개를 들일 보다 숙일 일이 많다는 사실, 항상 누군가로 인해 마치 나를 위에서 내려다보는 듯한 평가를 항상 받아야 한다는 점, 항상 감시당하는 듯한 느낌... 산에서 우리는 하나의 자연이 되어 호쾌하게 위에서 밑으로 내려다보며 그 순간만큼은 권력자의 감성을 누리는지도 모르겠다.             ▲ 문수산 정상에 서있는 장대의 풍경문수산 정상에 있는 장대에서 문수산성 전체를 총괄하는 지휘관이 지휘를 하기도 했었다 숱한 침입을 겪었던 역사의 현장이다            ⓒ 운민  산 중턱에 올라보니 어느새 시야를 가렸던 나무숲은 사라지고, 김포 땅과 강화도가 한눈에 내려다보이기 시작한다. 김포 땅이 생각보다 넓어서 그런지 아무리 신도시가 개발되었다고는 하지만 넓은 산과 들판이 남아있다. 도시와 농촌이 공존하는 김포만의 매력이지 않을까 싶다. 북쪽 방향으로 고개를 드니 산 능선을 따라 나지막한 성벽이 정상을 향해 뻗어있어서 등산의 길잡이 노릇을 하고 있었다. 큰 숨을 들이쉬고는 정상을 향해 발걸음을 옮겨본다.비록 376m의 낮은 산이지만 꽤 경사가 급하고 능선도 길어서 오르기가 수월치 않았지만 돌을 손에 메고 산에 올랐던 민초들을 생각하며 한 발 한 발 내디뎌 본다. 성벽의 높이는 생각보다 높지 않다. 하지만 천연 성벽인 이 산에 의지하여 수많은 외세의 침입을 이겨냈었고, 지금까지 굳건히 김포의 산하(山河)를 내려다보고 있다.성벽과 나란히 걸으면서 조선시대로 돌아가는 상상을 해본다. 그 당시의 장군과 병졸이 되어 적군을 맞이하는 상황을 맞이해보니, 병졸들의 이마, 손, 발에서 흘렸을 긴장과 땀, 장군들의 복잡하고 혼란스러웠을 심정, 마을을 버리고 성벽으로 도망쳐 숨어 지내던 백성들의 두려움과 원망 그 모든 것들이 나의 머리끝에서 발끝까지 고스란히 전해져 온다. 어느덧 산 정상이 보이고, 둥그런 성벽으로 둘러싸인 장대(將臺)의 위용이 어서 오라고 손짓하고 있었다.산 정상에 위치한 장대(將臺)는 전시에 장군들의 지휘소로 사용되었다. 병인양요 당시 프랑스가 강화도를 쑥대밭으로 만들고는 2척의 함정과 해전 육전대원들로 한성근과 지홍관이 150명의 병사들로 지키던 문수산성을 공격하기 시작했다. 결국 3명의 전사자와 2명의 부상자만 남기고 철수하게 된다. 이후 프랑스 해군의 손아귀에 넘어가자, 산 부근의 일부 성벽만 남고 해안가를 비롯한 성벽 시설물들이 무너지거나 불에 타 흔적만 남기고 사라져 버렸다.장대 위에 서서 북쪽을 바라다본다. 손에 잡힐 듯 잡히지 않는 북한 땅이 눈에 아른거린다. 저 앞에 보이는 개성 땅에는 또 다른 수많은 이야기가 남겨져 있을 것이다. 미완의 여로로 남기고 아쉬움을 뒤로한 채 산을 내려간다.저작권자(c) 오마이뉴스(시민기자), 무단 전재 및 재배포 금지▶오마이뉴스 '시리즈'에서 연재하세요!▶이재명 경기도지사 추천 《이재명과 기본소득》▶오마이뉴스 취재 후원하기"
"이성호 양주시장.  사진제공=양주시이성호 양주시장과 정하영 김포시장이17일이재명 경기지사가 추진하고 있는 공공기관 북부권, 접경지역 이전 조치에 대해 적극 환영한다는 뜻을 밝혔다.브리핑에 따르면 이번 3차 이전 대상 기관은 경기 수원시에 위치한 경기연구원, 경기도여성가족재단, 경기복지재단, 경기농수산진흥원, 경기신용보증재단, 경기도경제과학진흥원, 경기주택도시공사 등 총 7개 기관이다총근무자 수는 1100여 명으로 지난 1·2차 이전 기관의 근무자 수를 합친 규모와 비슷하다.이전 지역은 경기 북·동부의 접경지역과 자연보전권역 가운데 중복 지역을 제외한 17개 시·군을 대상으로 공모를 통해 선정할 계획으로 기관별 공모에 따른 4월 심사를 거쳐 5월경에 이전 선정 대상 시·군을 발표할 예정이다.이성호 양주시장은 “이재명 경기도지사의 이번 큰 결정이야말로 양주시민을 포함한 354만 도민이 거주하고 있는 경기북부의 실질적인 발전을 견인하는 마중물”이라며 “도정철학인 ‘특별한 희생에 대한 특별한 보상’의 실현이 경기북부의 미래 성장과 경기도 균형발전을 통한 경기 새천년의 보다 확실한 미래를 굳건히 하게 될 것”이라고 감사의 뜻을 밝혔다.정하영 김포시장.  사진제공=김포시정하영 시장도 이날 성명서를 발표하고 “균형발전을 위해 경기연구원 등 공공기관의 경기 북ㆍ동부, 접경지역 이전을 결정한 이재명 경기지사의 단호하고 실질적인 조치에 대해 적극 환영한다”며 “이번 7개 기관 북ㆍ동부 지역 추가 이전 결정으로 경기 북부권과 접경지역 주민들의 70여 년간의 시름이 조금이나마 덜어지길 기대한다”고 전했다.정 시장은 “경기 북부권과 접경지역 시ㆍ군들은 안보를 이유로 또 수도권이라는 이유로 군사시설보호법, 수도권정비계획법, 개발제한구역, 상수원보호구역 등 삼중사중의 중첩규제에 시달리고 있다”며 “경기도의 이번 조치는 사람과 돈, 일자리와 기업이 집중되고 있는 남부권에 비해 발전의 단초를 찾지 못하고 있는 경기 북부권과 접경지역에 새로운 활력이 된다”고 의미를 부여했다.한편, 이성호 양주시장을 포함한 경기북부 10개 시군 시장‧군수는 지난해 12월 뜻을 모아 ‘경기주택도시공사’, ‘경기도경제과학진흥원’, ‘경기신용보증재단’ 등 경기북부 추가 이전을 위한 공동건의문을 발표했으며, 양주시의회에서도 1월 전체 의원 명의의 건의문을 통해 공공기관 이전을 요청한 바 있다.양주·김포=김동우 기자"
(서울=뉴스1) 이재명 기자 = 신종 코로나바이러스 감염증(코로나19) 신규 확진자가 621명 발생한 17일 오전 서울 용산구 서울역광장에 마련된 임시선별진료소를 찾은 시민들이 검체검사를 받고 있다.질병관리청 중앙방역대책본부에 따르면 이날 0시 기준 코로나19 누적 확진자는 621명 증가한 8만4946명으로 나타났다. 2021.2.17뉴스
"[수원=뉴시스]염태영 경기 수원시장.(수원시 제공)[수원=뉴시스]천의현 기자 = 염태영 수원시장이 17일 이재명 경기도지사에게 도 공공기관 이전으로 경기 남부권 행정서비스 역차별이 발생하지 않도록 대안을 마련해 달라고 요구했다.염 시장은 이날 자신의 페이스북을 통해 “경기 남부권 도민의 행정서비스 접근권을 위한 대안 마련도 기대한다”고 밝혔다.염 시장의 이 같은 요구는 이날 오전 이 지사가 ‘경기도 공공기관 3차 이전’을 발표한 데 따른 것이다.이 지사는 수원지역에 위치한 경기신용보증재단과, 경기주택도시공사, 경기연구원 등 7개 기관을 이전을 통해 경기 북·동부 지역 균형발전을 도모하겠다고 밝혔다.염 시장은 “균형발전 관점에서 경기도 공공기관을 소외지역으로 분산 배치한다는 취지에 대해 이해한다”며 “다만, 구체적인 추진방법에 대해서는 수원시, 그리고 도의회와 긴밀히 협의해 주시기를 기대한다”고 말했다.이어 “경기도 공공기관의 경기 북부 이전으로 경기 남부권 도민의 행정서비스 접근권이 제한받지 않기를 바란다”며 “이를 해소하기 위한 대안도 함께 마련될 것으로 믿는다”고 했다.염 시장은 “현재 경기도 북·동부는 이중 삼중의 규제로 고통받고 있다”며 “이에 대한 해결책으로 합리적인 규제완화를 이끌어내기 위한 노력도 함께 이뤄져야 할 것”이라고 말했다.☞공감언론 뉴시스"
