이,재,명
"2010년 민주당 대표 시절 공천해 당선…대권 경쟁자로 성장21대 총선서 이낙연에 지역구 물려줘 ""인재 많아야 미래있다""정세균 국무총리와 이재명 경기도지사. 2020.12.9뉴스1 © News1 경기사진공동취재단(서울=뉴스1) 박주평 기자 = 정세균 국무총리는 17일 지난 2010년 민주당 대표 시절 치른 지방선거에서 이재명 성남시장을 공천해 당선시킨 데 대해 ""제가 이재명 경기도지사를 픽업(pick up)했다. 제 안목이 얼마나 빛납니까""라고 말했다. 정 총리는 이날 오후 KTV '최일구의 정말'에 출연해 '2010년 선거에서 공천한 이 지사가 엄청난 경쟁자로 성장했는데 후회하지 않나'라는 질문에 ""정당에는 인재가 넘쳐야 미래가 있다""며 이같이 답변했다.  정 총리는 당시 민주당 대표로서 제5회 지방선거를 진두지휘해 여당이던 한나라당(현 국민의힘)을 상대로 승리를 거둔 바 있다. 이 지사는 성남시장에 출마해 당선됐고, 2014년 재선에 성공한 뒤 2017년 대선 경선에 참여하기도 했다. 이후 2018년 지방선거에서 경기도지사에 당선됐고, 현재 차기 대권주자 중 선호도 1위를 달리고 있다. 여권의 '잠룡' 중 한 명인 정 총리로서는 가장 강력한 경쟁자인 셈이다. 정 총리는 또 이낙연 민주당 대표에게 국회의원 시절 지역구인 종로구를 물려준 것을 후회하지 않냐는 질문도 받았다. 정 총리는 15대 총선에서 전북 무주·진안·장수 지역구에서 내리 4선을 했고, 이후 19대와 20대 국회에서는 종로구에서 당선됐다. 21대 총선에 불출마 한 정 총리는 자신의 지역구를 이 대표에게 물려줬고, 이 대표는 선거에서 황교안 전 자유한국당(현 국민의힘) 대표와 맞붙어 승리했다. 정 총리는 ""이 대표가 제 후임으로 종로구민의 선택을 받으셨지 않나. 그 두 분 말고도 민주당에 많은 인재가 있다""면서 ""그게 민주당의 자산이고, 민주당이 여당 아닌가. 그래야 대한민국의 미래가 있다. 민주당에서 인재들이 크는 데 제가 조금이라도 기여했다면 굉장히 자랑스러운 일""이라고 밝혔다. 정 총리는 6선 국회의원, 산업부 장관, 당 대표, 국회의장 등을 지내며 차기 대권주자 중 가장 화려한 경력을 자랑하지만, 아직 대중적 지지는 이 지사나 이 대표에 미치지 못하고 있다. 다소 민감할 수 있는 이같은 질문들을 특유의 넉살로 대응한 것이다. 손실보상제, 재난지원금 등을 두고 기획재정부와 마찰을 빚은 데 대해서도 그는 ""마찰이 있다. 그게 정상""이라며 ""기재부는 재정건전성을 유지하는 게 책무고, 저희나 당에서는 국민 어려움을 파악해서 해소하는 노력을 해야 한다""고 말했다. 이어 ""다름을 서로 이야기할 수 있어야 건강한 것인데, 싸움만 하고 해결책을 못 찾으면 한심한 것""이라며 ""토론, 논쟁하다가 합의하고 공감대를 형성해서 국민을 잘 섬기는 방안을 찾으면 건강하고 바람직한것이다. 지금까지는 그렇게 잘해왔다""고 자평했다. 손실보상제에 반대 의견을 표명하는 기재부를 두고 '여기가 기재부의 나라냐'라고 호통을 쳤다는 언론 보도에 대해서도 ""근본적인 문제가 있던 건 아니고 의견이 달랐을 뿐이다. 그렇게 과격하게 이야기는 안 하고 그런 취지의 이야기를 했는데 보도된 것""이라고 설명했다. 이어 ""기재부와 저도 협력하는 관계고, 당하고도 4차 지원금을 두고 이견을 조정하는 과정이다. 조정 끝에 국민들에게 조금이라도 힘이 되면 역할을 다하는 것""이라고 설명했다. 정 총리는 ""손실보상제 입법은 조만간 되지만, 시행령을 만드는 기간이 최소 3~4개월 걸린다""며 ""그 이전에는 지금까지 한 것처럼 재난지원금으로 자영업자 어려움을 덜어드리겠다는 것""이라고 말했다"
"'기본소득' 모토로 민주당 대권주자 이재명 지지모임 첫발 ◇기본소득국민운동 강원본부 출범식이 16일 강원도의회 세미나실에서 김기석 상임대표, 곽도영 도의장 등이 참석한 가운데 열렸다.   박승선기자 도의회서 공식 출범식 이 지사 영상으로 축사 더불어민주당의 차기 대권주자 이재명 경기도지사를 지지하는 강원도 조직이 공식 출범했다.이재명 지사가 핵심 정책으로 내세운 '기본소득'을 주제로 한 '기본소득 국민운동 강원본부'(이하 강원본부)는 16일 오후 도의회 세미나실에서 출범식을 갖고 강원도 내 기본소득 의제 확산에 나섰다. 이날 출범식에는 상임대표로 김기석 강원대 교수가 선출됐다. 공동대표로는 전상규 민주당 도당 예결위원장, 김형원(동해) 도의회 경제건설위원장, 원태경(춘천) 도의원, 나일주(정선) 도의원, 정유선(비례) 도의원, 신선익 속초시의장, 길종수 화천군의장, 곽태섭 전 강원도 사회갈등조정위원회 상임위원, 김종수 전 민노총 강원지역본부장, 구인호 전 도의원 등이 이름을 올렸다. 운영위원장에는 김준섭(속초) 도의원, 사무국장으로는 조형연(인제) 도의원이 각각 임명됐다.  이들은 도내에서 재산, 소득, 고용 여부 및 노동 의지에 상관없이 모든 국민에게 동일한 최소 생활비를 지급하는 기본소득 도입의 확산을 목표로 한다고 밝혔지만, 지역정가에서는 사실상 이 지사의 민주당 대선 출마를 위한 조직으로 보고 있다.김기석 상임대표는 “기본소득 제도의 안착을 위해서는 비전 제시와 함께 이를 실현시킬 리더십, 그리고 국민의 공감이 필요하다”며 “최소한 후대에서는 먹고사는 걱정을 안 할 수 있도록 기본소득 국민운동에 대한 많은 관심을 당부 드린다”고 말했다.영상으로 축사를 보낸 이재명 지사는 “기본소득은 4차 산업혁명 시대를 대비하고 지속 가능한 미래를 보장할 유일한 방안”이라면서 “강원도에서도 기본소득에 대한 공감대가 널리 확산될 수 있기를 기대한다”고 말했다.김기석 상임대표의 진행으로 열린 2부 행사는 김세준 국민대 교수와 노민호 경기도 기본소득위원회 위원이 함께하는 토크콘서트가 진행됐다. 한편 지난해 11월 국회에서 기본소득 국민운동본부가 출범한 이후 경남·대전·전북·광주·인천본부 등 전국 광역 단위로 조직 구성이 이뤄지고 있다.  이하늘기자 ▶ 네이버에서 강원일보 구독하기▶ 강원일보 네이버TV 바로가기ⓒ 강원일보 - www.kwnews.co.kr"
"[머니투데이 김지영 기자] 경기도가 경기 북·동부지역의 균형발전 차원에서 경기주택도시공사 등 산하 공공기관 7곳을 이전하기로 결정했다.이재명 지사는 17일 오전 경기도청에서 기자회견을 열고 이 같은 내용을 담은 경기도 공공기관 3차 이전 추진계획을 발표했다.이전 대상 기관은 △경기주택도시공사 △경기신용보증재단 △경기도경제과학진흥원 △경기연구원 △경기농수산진흥원 △경기복지재단 △경기도여성가족재단이다.이 지사는 ""경기북·동 지역의 발전이 더딘 이유는 수도권정비계획법을 비롯해 군사안보나 수자원 관리 등 중첩규제로 인해 오랜 기간 지역 발전에 제한이 있었기 때문""이라고 말했다. 이어 ""사람이든 지역이든 공동체를 위한 특별한 희생을 하고 있다면 이에 합당한 보상을 하는 것이 공정의 가치에 부합하고, 이것이 균형발전을 위한 길""이라며 ""두 차례에 걸친 공공기관 이전 결정은 그런 노력의 일환이었고, 규모가 더 큰 기관의 이전이 필요하다고 판단해 추가 이전을 추진하기로 했다""고 밝혔다.이 지사는 ""도는 모두의 이익을 위한 일정한 규제가 불가피하더라도 전체를 위해 특정 지역이 일방적으로 희생하는 일이 없도록 앞으로도 세심하게 살피고 각별히 배려하겠다""고 강조했다.앞서 경기도는 지난 2019년 12월 고양시와 업무협약을 맺고 2025년까지 △경기관광공사 △경기문화재단 △경기도평생교육진흥원 등 3곳의 공공기관을 ‘고양관광문화단지’에 이전하기로 했다.이어 지난해 9월부터 △경기교통공사 △경기도일자리재단 △경기도시장상권진흥원 △경기환경에너지진흥원 △경기도사회서비스원 등 5개 공공기관의 주사무소를 시·군 공모를 통해 선정하고 양주시와 동두천시, 양평군, 김포시, 여주시로 각각 이전 중이다.이번에 이전 결정된 7개 기관은 도민의 요구와 기관 특성 등을 종합적으로 고려해 선정됐다. 7개 기관의 근무자수는 총 1100여명으로, 지난 1차·2차 이전 기관의 근무자수를 전부 합친 규모와 비슷하다.이전 대상 지역은 경기북·동부 접경지역과 자연보전권역 중 17개 시·군을 대상으로 공모를 통해 선정한다.김지영 기자"
"이재명 경기도지사가 17일 경기도청 브리핑룸에서 `경기도 공공기관 3차 이전 추진계획`을 발표하고 있다. [사진 제공 = 경기도] 지역 균형 발전 차원에서 공공기관 분산 정책을 시행중인 경기도가 추가로 7개 산하 공공기관을 경기 동북부 지역으로 분산·이전하기로 했다.  이재명 경기도지사는 17일 기자회견을 열어 경기도 공공기관 3차 이전 추진계획을 발표했다.  이 지사는 ""경기북동부 지역은 수도권정비계획법, 군사안보, 수자원 관리 등 중첩규제로 인해 오랜 기간 지역 발전에 제한이 있었다""면서 ""특별한 희생에 대한 합당한 보상 차원에서 추가 공공기관 이전을 추진하기로 했다""고 말했다.  수원에 위치한 경기연구원, 경기신용보증재단, 경기도경제과학진흥원, 경기농수산진흥원, 경기복지재단, 경기주택도시공사, 경기도여성가족재단  등 7곳이 이전 대상이다. 이들 7개 기관 근무자는 1100여명으로 지난 1·2차 이전 기관 근무자수를 모두 합친 규모와 비슷하다.  경기도는 북동부 접경지역과 자연보전권역 가운데 중복 지역을 제외한 17개 시·군을 대상으로 공모해 5월께 이전 지역을 선정할 예정이다.  이전 지역 선정은 외부 전문가로 구성된 심사위원회에 맡기되, 시·군간 과열 경쟁, 재정 규모에 따른 불이익을 막기 위해 시·군의 재정부담 부문은 심사기준에서 제외하기로 했다. 경기도는 ""균형발전과 사업 연관성, 접근성, 도정협력도 등을 종합적으로 고려해 이전 지역을 선정하겠다""고 밝혔다. 앞서 경기도는 이 지사 취임이후 2차례 산하 공공기관 이전 계획을 발표했다.  경기관광공사, 경기문화재단, 경기도평생교육진흥원 등 3곳은 2019년 12월 고양관광문화단지로 이전하기로 결정됐다. 지난해 9월엔 경기교통공사, 경기도일자리재단, 경기도시장상권진흥원, 경기환경에너지진흥원, 경기도사회서비스원을 양주시, 동두천시, 양평군, 김포시, 여주시로 각 각 이전하기로 했다.  1차 이전 대상은 2025년까지, 2차 이전 기관은 올해(경기일자리재단은 2023년)까지 모두 이전할 계획이다. [지홍구 기자]▶ '경제 1위' 매일경제, 네이버에서 구독하세요▶ 이 제품은 '이렇게 만들죠' 영상으로 만나요▶ 부동산의 모든것 '매부리TV'가 펼칩니다[ⓒ 매일경제 & mk.co.kr, 무단전재 및 재배포 금지]"
[서울=뉴시스]경기사진공동취재단 = 이재명 경기도지사가 17일 오전 경기도 수원시 경기도청에서 경기도 공공기관 3차 이전 추진 기자회견을 하고 있다. 2021.02.17.
(서울=뉴스1) 이재명 기자 = 신종 코로나바이러스 감염증(코로나19) 신규 확진자가 621명 발생한 17일 오전 서울 용산구 서울역광장에 마련된 임시선별진료소를 찾은 시민들이 문진표를 작성하고 있다.질병관리청 중앙방역대책본부에 따르면 이날 0시 기준 코로나19 누적 확진자는 621명 증가한 8만4946명으로 나타났다. 2021.2.17뉴스
"클럽하우스에서 연 대화 자리 '북적'... 한국에서도 꿈틀거리는 난민 이슈[유지영 기자]        ▲ 지난 16일 '클럽하우스'에서 '이제는 K추방인가? 개정 난민법의 모든 것'이라는 주제의 대화가 이뤄졌다.             ⓒ 오마이뉴스  0.4%, 1000명 중 4명.지난 2019년 난민으로 인정받아 법무부 출입국 외국인청에서 1차 심사에 통과한 난민 비율이다. 2019년 기준으로 심사가 종료된 이들이 9286명인데 그 중 한국에서 난민으로 인정받은 사람은 42명밖에 되지 않는다. 난민에 대한 뜬소문 같은 이야기는 많지만 정작 한국에 난민이 많지 않고 만나볼 수 있는 기회도 희박해 한국인은 난민을 이해하는데 어려움을 겪고 있다.난민에 대한 이해의 폭을 넓히기 위해지난 16일 오후 10시 음성 기반 소셜네트워크서비스(SNS)인 '클럽하우스'에 대화 자리를 마련했다.모더레이터, 스피커, 리스너라는 클럽하우스만의 기능적 구분에 따라 내가 모더레이터를 맡았고 스피커는 공익법센터 어필의 이일 변호사였다.  지난 8일까지 8차례에 걸쳐 <오마이뉴스>에 연재한 '이제는 K-추방인가?' 시리즈의 담당 편집기자였던 나는 이 연재를 기획한 이일 변호사와함께 난민법 개정안의 위험성에 대한 공개적인 대화 자리를 갖기로 의기투합했다. 늦은 시간임에도 100명이 넘는 리스너들이 클럽하우스 대화방에 들어와 난민과 난민법에 대한 이야기를 들었다.""가짜 난민이라는 개념, 굉장히 위험""매년 한국을 찾는 난민은 늘어나지만 난민으로 인정되는 사람 수는 그에 비례해서 늘어나지 않아 난민 인정률은 곤두박질치고 있다. 이일 변호사는 이를 다음과 같이 설명한다.""한국에서 난민으로 인정되기는 결코 쉽지 않다. 한국을 비롯한 동북아시아 국가는 모두 그런 경향이 있다. 소위 '진짜 난민' 혹은 '가짜 난민'이라는 식으로 가려내는 말은 굉장히 위험하다. 양심적 병역거부자를 두고 '진정한' 양심인지를 끝까지 물어서 감정한다든지, 기초생활수급자가 도움을 어디서도 받지 못하는 사람인지를 증명하라는 식이다.난민 제도의 원 목적은 난민을 찾아서 보호하라는 것이다. 한국은 '혹시 난민이 아니면 보호받아서는 안 된다'라는 시각으로 심사가 계속 이뤄진다. 미국의 경우 엄혹한 트럼프 정권에서도 30~40%의 난민 인정률을 보인다. 이는 한국의 난민 심사가 너무 가혹하고 대체로 난민이 보호되지 않는다는 걸 보여준다.""그 와중에 2020년 12월 법무부를 통해 나온 난민법 개정안이 등장했다. 이 변호사에 따르면 이번 난민법 개정안의 핵심적인 부분은 더 빠르게 난민을 심사해 추방하겠다는 것이다. <오마이뉴스> 연재의 제목이 '이제는 K-추방인가?'인 이유다.""한국은 그간 난민으로 인정된 사람이 거의 없고 난민의 지위나 인권보호가 전혀 되지 않고 있다. 한국은 소수자 인권이 보호가 되지 않는 나라인데 이번 난민법 개정안으로 오히려 '명백히 이유가 없는 난민 신청은 불허'라는 조항을 두고 난민 심사를 더 간단하게 만들었다. 쉽게 말했을 때 법무부에서 난민이 아니라고 보이는 사람은 난민 심사나 인터뷰 기회를 얻지 못하게 하고 내보내겠다는 것이다.문제는 이미 99.6%나 되는 사람을 난민이 아닌 것 같다고 결정하면서도 더 엄격하게 만들겠다는 건데, 99.6%가 난민으로 인정되지 않는 건 한국에 난민이 없어서가 아니라 제도를 이용해 난민을 추방하고 있기 때문이다.""11시 넘어서도 질의응답 계속 이어져             ▲ 난민인권네트워크가 <오마이뉴스>에 연재한 '이제는 K-추방인가?'            ⓒ 오마이뉴스  한 참여자는 '왜 우리가 난민을 허용해야 해?'라는 질문을 받을 때 어떻게 답변할 수 있을지를 물었다. 이일 변호사는 ""난민을 사람으로 생각하기보다는 국가 정책과 같은 커다란 일로 생각하기 때문에 '왜 받아들여야 하느냐'라고 묻게 되는 것 같다. 그보다는 '이미 한국에 온 난민을 우리가 왜 추방해야 하느냐, 우리에게 그런 권리가 있는가'로 바꿔서 묻는 게 더 좋을 것""이라고 조언했다.이어 ""한국이 난민을 추방하게 되면 그들은 자국에서 심각한 인권침해를 입게 되고 자칫 전쟁터 한복판으로 끌려가 죽을 수밖에 없는 삶에 처하기도 한다. 난민에 대해 어떤 의견이든 가질 수 있지만 '공동체에서 추방해야 한다'라는 건 용인될 수 없는 생각이라고 본다""라고 말했다.난민 인권 활동가들과 현직 언론계 종사자들도 이날 클럽하우스를 찾았다. 약 80명의 참여자들은 행사가 끝나기로 예정된 시간을 넘겨서 방에 머물렀다. 질의응답이 11시 넘어서까지 계속 이어졌다. 이일 변호사는 ""난민이라는 생소할 수 있는 이야기를 밤늦게 들어주셔서 감사하다. 난민법 이슈가 이제 깃발을 들고 밖으로 나가서 막아야 할 정도로 엄중한 상황에 처했다""라면서 관심을 당부했다.""실제로 난민의 수는 엄청나게 적다. 하지만 엄연히 한국 사회에서 살아가고 있다. 다만 만나서 이야기할 수 있는 기회가 없는 것이다. 낯선 친구가 전학을 오면 같이 놀기 전까지는 소문이 나지만 같이 놀면서 축구도 잘하는구나, 나와 비슷한 성격이 있구나 라고 느낀다.만날 수 있는 기회가 있으면 좋은데 역설적으로 난민이 한국 사회에 많지 않아서 낯섦을 해소하기 쉽지 않다. 난민은 그저 인간이다. 똑같은 인간인데 다른 곳에서 온 사람일 뿐이고 같은 인간으로서 공통점을 발견할 기회가 없으니 어색한 것이다.""이일 변호사는 ""2018년 예멘 난민들이 한국에 들어왔을 때도 난민을 추방해야 한다는 여론 때문에 힘들었다. 그럼에도 다양한 분야의 시민들이 난민과 연대하고 난민을 혐오하는 것이 옳지 않다는 목소리도 나올 수 있는 계기도 됐다고 생각한다""라고 긍정적인 전망을 덧붙였다.[관련 연재] 이제는 K-추방인가?http:omn.kr1rulo저작권자(c) 오마이뉴스(시민기자), 무단 전재 및 재배포 금지▶오마이뉴스 '시리즈'에서 연재하세요!▶이재명 경기도지사 추천 《이재명과 기본소득》▶오마이뉴스 취재 후원하기"
"포용국가 설계한 김연명 前수석이재명 기본소득 겨냥 ""비생산적""노인요양 등 사회 보호체계 먼저중산층 삶의 불안 해소도 과제로李지사는 재난기본소득 드라이브 이낙연 민주당 대표, 이재명 경기지사 이재명 경기도지사의 '기본소득'에 이낙연 더불어민주당 대표가 '신복지제도' 정책으로 맞불을 놓는 등 여당 잠룡 대결에 사실상 본격적인 시동이 걸리고 있다.   여당 내 유력 대권주자들의 정책 브랜드가 구체화되면서, 내달 초 당대표직에서 물러나기 전 이낙연 대표 진영은 지지율 반등을 위한 승부수 띄우기에 나섰다.   이에 대한 일환으로 이 대표의 신복지제도 설계를 맡은 김연명 전 청와대 사회수석이 17일 이재명 지사의 기본소득에 대해 ""과연 지금 한국사회에서 완벽한 의미의 기본소득을 할 필요가 있는지에 대해선 회의적""이라고 저격, 잠룡 투톱간 정책이 정면 충돌하고 있다. 아울러 김 전 수석은 '중산층 정도의 삶의 질'을 보장하는 사회보험체계를 구축하는 신복지제도를 2030년까지 만들겠다는 목표를 제시했다.   ■전직 靑 수석, 기본소득에 ""비생산적""   청와대 사회수석으로 문재인정부의 혁신적 포용국가의 이론적 틀을 만들었던 김 전 수석은 이날 서울 영등포구 여의도 이룸센터에서 열린 '혁신적 포용국가 미래비전 초청 강연'에서 ""여러 사회적 보호체계 특징과 기본소득 도입을 연계한다면 성찰할게 많지만, 이런 얘기를 빼고 기본소득만 얘기하는 것은 비생산적""이라고 지적했다.   김 전 수석은 ""지금 더 급한 것을 예를 들자면, 노인요양문제의 경우 전부 민간요양병원이다. 공공요양시설은 100개 중 2개도 안된다""며 ""어느 정도 사회 서비스나 교육도 마찬가지다. 퍼블릭(공공) 기능이 어느정도 있는 상태에서 기본소득이 들어오는 것과 우리처럼 퍼블릭이 없는 상태서 기본소득이 들어오는 것은 임팩트(효과)가 다르다""고 강조했다.   아직 여러 복지 분야에서 공공기능이 미흡한 상태에서 기본소득만 무리하게 추진할 경우 효과가 없다는 것이 김 전 수석의 주장이다.   김 전 수석은 보편적 기본소득에 대해 ""저 개인적으로는 민주당이 너무 방어적, 부정적이었다. 보편적 기본소득이 왜 나왔는지 문제의식을 충분히 수용할 필요가 있다""면서도 ""기본소득만 되면 다 해결되는 것 아니냐고 하지만 절대 아니다. 기본소득은 만병통치약이 아니다""라고 단언했다.   보편주의와 선별주의의 적절한 혼합 필요성을 언급, ""현대사회는 리스크가 복합적이라 소득 외 의료 주거 돌봄 환경 이런 것들을 종합적으로 포괄해야 한다""며 ""보편주의가 필요한 영역이 있고 선별주의가 필요한 영역이 있다. 융통성 있게 접근해야 한다""고 당부했다.   그러나 이재명 지사는 기본소득에 대한 전방위 공세에도 전 도민에 10만원씩 지급하는 경기도 2차 재난기본소득 지급에 박차를 가하고 있다.   전날 저녁 이 지사는 비상근무에 돌입한 재난기본소득 관련 전산부서 공무원들에게 깜짝 간식을 보내 위로하는 등 기본소득 행보를 이어가겠다는 의지를 내비쳤다. 경기도 재난기본소득 누적 신청자는 950만명에 육박, 전체 대상자의 70% 이상이 신청했다.   ■""중산층도 불안 느끼지 않도록""   신복지제도 도입을 제시한 김 전 수석은 ""교육 주거 노동 돌봄 행정 부분의 최저기준을 일괄적으로 올리고 그 다음엔 중산층이 삶의 불안 느끼지 않을 정도로 삶의 기준을 높이는 적정기준을 도입하자""고 말했다.   신복지제도 도입 이유로 예상보다 빠른 경제사회구조의 변화 속도를 지적한 김 전 수석은 ""여기서 취약계층이 많아져 이들을 보호하는 시스템을 만들자는 것이 핵심""이라고 설명했다.   '보편적 사회보험체계'에 대해 김 전 수석은 ""우리나라는 그동안 정치적, 경제적 수준이 선진국에 근접했지만, 사회 부분이 가장 취약하다""며 ""사회복지를 둘러싼 시장주의자와 친복지주의자간 합의를 통해 만든 것이 보편적 사회보호 체계다""라고 말했다.   이를 위해 △아동기 성년기 노동기 등 전생애 최소한의 소득안정 △각 단계마다 필수적 보건의료 보장 △기초적 교육돌봄 등을 김 전 수석은 제시했다."
