이,재,명
"""빌 게이츠, 마크 저커버그, 일론 머스크 등도 '기본소득' 주장""""기업성장주도·낙수효과로는 기업도 살아남을 수 없기 때문""""기본소득, 더 이상 낯설거나 새로운 정책 아냐""[수원=뉴시스] 이재명 경기도지사.[수원=뉴시스]박상욱 기자 = 이재명 경기도지사는 9일 ""교황께서도 이 시대 새로운 가치로 기본소득을 제안했다""며 ""보다 구체적인 세부 논의로 들어가야 할 때""라고 밝혔다.이 지사는 이날 자신의 페이스북을 통해 ""급진적이라 지탄받던 '뉴딜정책'은 미국의 부흥을 이끌어냈고 반대당인 공화당조차 정치 이념의 발판으로 삼을 만큼 보편적인 철학이 됐다""며 이같이 말했다.그는 ""미국에서 가장 사랑받는 대통령 중 한 사람인 프랭클린 루즈벨트는 소수의 개인과 대기업의 횡포에 맞서 정부의 권위를 세워 분배의 정의를 실현하고 미국 복지의 토대를 마련했다. 그런데 그의 어머니는 전에 없던 새로운 정책을 펼치는 아들을 보며 사회주의자가 되었다고 깊이 상심했다고 한다""고 전했다.이어 ""지금 이 시각에도 많은 국가들이 옛날에는 상상도 할 수 없었던 정책을 쓰고 있다. 시장주의의 선봉에 섰던 영국은 코로나19 사태로 직원을 자르지 않으면 정부에서 직원 임금의 80%까지 보존해주는 정책을 내놓았고 자영업자에게도 지난 3년 소득 기준 80%를 지원하기로 했다""면서 ""우리는 이제 자본주의를 새롭게 바라봐야 한다""고 조언했다.또 ""2008년 금융위기 이후로 오래도록 이어진 저금리 기조에 실물경제와 괴리된 채로 자산 가격만 올라가고 있다""며 ""자동화, 글로벌화, 감세 등으로 노동비용이 감소하면서 기업의 이익은 커지는 반면 매출대비 직원 급여의 비율은 눈에 띠게 줄고 있다""고 지적했다. 실리콘밸리 주요 인사 기본소득 발언. *재판매 및 DB 금지이 지사는 ""빌게이츠, 마크 저커버그, 일론 머스크 등 이 시대 자본주의 최첨단에 위치한 기업인들이 '기본소득'을 주장하는 이유가 있다""면서 ""기존의 기업성장주도, 낙수효과와 같은 방식으로는 기업도 살아남을 수 없기 때문이다""라고 강조했다. 그러면서 ""교황께서도 기본소득을 지지하며 '기술관료 패러다임이 이번 위기나 인류에게 영향을 미치는 다른 거대한 문제들에 대응하는데 있어 충분치 못하다는 점을 정부들이 이해했으면 한다'고 말씀하셨다""고 덧붙였다. 이 지사는 ""기본소득은 더 이상 낯설거나 새로운 정책이 아니다""라며 ""이제는 보다 구체적인 세부 논의로 들어가야 할 때이다""라고 밝혔다.☞공감언론 뉴시스"
"""저소득층과 고소득층에 똑같이 지급하는 것은 공정과 정의 반한다""유승민 국민의힘 전 의원이 9일 코로나 경제 위기 대응 차원에서 '기본소득'을 주장해 온 이재명 경기도 지사에게 토론을 제안했다. 유 전 의원은 이날 페이스북에 'K양극화 이후 K복지 구상에 대하여'라는 글을 올리고 ""기본소득을 포함해 K복지 논쟁이 우리 정치권 전체의 건설적이고 생산적인 토론이 되기를 기대한다""며 ""K양극화를 해소하고 우리 경제를 다시 살리는 방법에 대한 토론이라면, 이 지사를 포함해 누구와도 토론할 용의가 있다""고 했다.유승민 국민의힘 전 의원(왼쪽)과 이재명 경기도 지사. JTBC캡처유 전 의원은 ""코로나 이후의 소득격차와 빈부격차는 K자형(고학력·고소득자는 빠르게 회복하는 반면 저학력·저소득자는 침체가 더 심화되는 형태)으로 전개된다""며""대면 서비스업, 자영업자와 소상공인, 저임금노동자, 청년실업자, 여성 등이 가장 큰 피해를 입고있다""고 했다. 유 의원은 ""지금은 K양극화에 대처하는 복지정책, 즉 'K-복지'를 새로 설계하고 정책으로 만들 때""라며 ""기본소득을 둘러싼 지금의 논쟁은 하루빨리 결론을 내려야 한다""고 했다. 그러면서 ""기본소득은 K양극화 해소에 아무 도움이 되지 않는다. 월소득 100만원인 저소득층과 1000만원인 고소득층에게 똑같은 기본소득을 지급하는 것은 공정과 정의에 반하며 소비 촉진효과도 부족하다""고 했다. 유 전 의원은 이 지사를 향해 ""기본소득 구상을 접고 K복지 구상을 내실 있게 설계하는데 동참하기 바란다""며 ""이 지사가 내가 오랫동안 주창해온 '중부담 중복지'를 말한 점은 환영하지만 중부담 중복지를 하더라도 그 정책 방향은 K양극화를 해소하는 K복지의 원칙에 부합해야 한다""고 했다.유 전 의원은 ""K복지의 원칙은 '어떤 국민도 뒤쳐지지 않도록(No people left behind)' 사회안전망의 사각지대를 없애고 복지와 일자리의 안전망을 튼튼하게 만드는 일""이라며 ""이렇게 해야 고통받는 국민께서 삶을 포기하지 않고 희망을 가질 수 있다""고 했다. [양범수 기자"
"[서울경제] 에너지 솔루션 전문회사 이에스티가 2021년식 전기화물차용 냉장·냉동 탑차(사진)를 출시했다고 9일 밝혔다신규 출시된 탑차는 별도의 배터리 없이도 최대 32시간까지 저온을 유지하는 게 특징이다. 이에스티의 상변화물질(PCM)이 냉기를 공급한다. 냉동(영하 18도)과 냉장(영상 3~8도) 온도를 동시에 유지하며 배송할 수 있다. 저녁 8시부터 다음날 오전 6시까지 심야전력으로 PCM모듈에 냉기를 축적하면 낮 동안에 별도의 에너지 공급 없이 일정한 냉동·냉장 온도를 유지할 수 있는 게 장점이다. 또한, 경량 샌드위치 패널과 허니컴 도어를 적용해 기존 축랭 시스템(610kg)에 비해 무게를 약 26% 줄였고 PCM모듈 중량도 약 30kg 감소했다.한편 정부의 친환경 정책에 따라 1톤 사이즈 소형 전기화물차 공급이 확대되는 가운데 이에스티의 냉장·냉동 탑차는 기존 트럭에 간편히 시공할 수 있다. 지난해 포터 일렉트릭(EV)과 봉고 EV 판매량은 각각 9,037대, 5,357대로 총 1만 4,394대가 팔려 테슬라의 전체 판매량(1만 1,826대)을 웃돌았다.이정근 이에스티 대표는 “축랭시스템은 사전에 충분한 에너지를 저장하는 방식으로 디젤 차량의 엔진을 꺼도 일정한 온도가 유지되듯 전기화물차에는 냉동기용 배터리 추가 장착 없이 적용할 수 있다”며 ""전기 화물차를 구매하면 신규 허가가 제한된 화물운수사업자 면허가 나오기 때문에 올해 전기화물차 판매량은 더욱 늘어날 것""이라고 말했다.이재명 기자"
"[경향신문] 이재명 경기도지사가 9일 “제 사전에 탈당은 없다”며 일각에서 제기된 더불어민주당 탈당설에 재차 선을 그었다. 이 지사는 이날 페이스북에서 “그 눈물겨운 헌신을 배신하는 탈당이란, 저로서는 상상할 수 없는 일”이라며 “정치입문 이래 단 한 번도 탈당한 일이 없다”고 밝혔다.그는 “우리 민주당은 김대중, 노무현 대통령님 두 거인께서 혼신을 다해 가꾸어 온 정당이자, 촛불혁명을 거쳐 문재인 대통령님을 탄생시키고 뿌리 깊은 기득권 적폐 세력에 맞선 정당”이라며 “선거 때나 그렇지 않을 때나, 당이 잘할 때나 못할 때나, 그래도 우리가 지켜야 할 소중한 당이라며 온몸을 던져온 당원들이 있다”고 했다.이 지사는 “실수도 있었고 국민의 엄중한 회초리를 맞을 때도 있었으나 끝끝내 지키고자 했던 가치를 외면하지 않고, 시대의 요구에 응답하고자 애써왔던 정당”이라며 “‘사람이 먼저인, 사람 사는 대동세상’을 이루고 싶은 제 꿈은 민주당이라는 든든한 울타리와 열정적인 우리 당원들 없이는 결코 이룰 수 없는 가치”라고 강조했다. 이 지사는 “돈에 종속되지 않고 행복한 일 하며 사람답게 살 수 있도록 최소한의 삶을 보장하는 ‘기본소득’, 돈이 생명의 가치를 흔들지 못하도록 최저한의 금융소비자 권리를 보장하는 ‘기본대출’, 집 때문에 더 불안하지 않도록 주거권을 보장하는 ‘기본주택’. 민주당 외에 어느 정당에서 실현 가능하겠냐”고 되물었다.그러면서 “여러 이유로 저의 탈당을 바라는 분이 계신 것 잘 알고 있으며 그분들께서 말씀하시는 제 잘못과 부족한 점은 온전히 귀담아듣고 고쳐 나가겠다”며 “민주당이 없으면 이재명도 없다. 이재명의 염원도 없다”고 덧붙였다. 이 지사는 전날 한 방송사 인터뷰에서 “민주당 지지자와 문재인 대통령님 지지자들이 압도적으로 응원하는 데 제가 왜 나가느냐”며 탈당설을 일축한 바 있다.경태영 기자"
"[주장] 국회의원이 국민의 대표임을 자부하려면[소준섭 기자]        ▲ 국회 자료사진            ⓒ 공동취재사진  조선일보가 소환한 '국회 전문위원 검토보고서'최근 조선일보는 <국회 전문위원 ""여당 언론 관련법, 헌법상 과잉금지 위반"">이란 제목의 기사를 게재하였다.언론 보도에 대한 징벌적 손해배상제를 명시한 민주당 000 의원안(案)에 대해, 국회 과학기술정보방송통신위 수석전문위원은 검토 보고서에서 ""민법상 손해배상 제도나 형법상 형사처벌 제도와 중첩되어 헌법상 과잉 금지 원칙에 위반될 소지가 있다""고 했다. 또 ...... ""징벌적 손해배상은 그 필요성에 대한 사회적 공감대가 충분히 형성된 경우에 도입하는 것이 타당하다""고 했다.오늘날 국회 전문위원의 '검토보고서'는 단지 '검토'의 차원을 훨씬 넘어선 것이다. 지엄한 '선언'이요 '판결문' 혹은 '결정문'과도 같은 위상을 점한 지 이미 오래다. 세계 의회사상 그 유례를 찾아볼 수 없는 국회공무원, 즉 입법관료에 의한 법안 검토 시스템이다. 그리고 아무도 주목하지 않는 가운데 입법관료의 영향력은 막강해졌다.얼마 전 참여연대는 ""국회법상 전문위원은 국정감사를 지원하고, 법안에 대한 조사 등을 통해 검토보고서를 제출한다. 국회는 법안 심사 시, 첫 단계로 해당 법안에 대한 전문위원의 검토보고를 의무적으로 들어야 하고, 전문위원의 검토보고가 국회의원들의 법안 심사에 영향을 미치는 사례는 비일비재""하다며 ""국회의원의 입법권을 훼손하는 전문위원 검토보고제도 폐지가 필요하다""고 강력히 주장했다.행정, 입법 그리고 사법 관료주의, 우리 사회는 3중의 관료지배 구조사실 관료집단의 영향력은 세계적으로 공히 결코 과소평가될 수 없을 정도로 크다. 하지만 그 관료주의가 아무리 강력하다고 해도, 그 범주는 일반적으로 행정부 내라는 범주에 머물게 된다. 그러나 우리나라는 위에서 언급한 것처럼 입법부에도 이미 관행화되어 일상화되어있고, 더구나 사법부까지도 관료화되어 있다. 우리 사법부는 세계 사법부 사상 찾아보기 힘든 '법원행정처'라는 '사법관료 기구'를 통해 철저하게 관료화가 관철되고 있다. 김명수 대법원장은 취임 일성으로 법원행정처 폐지를 '공언'했지만, 말 그대로 ""빌 공(空)자"", 공언(空言)이 되고 있다.이렇게 하여 우리 사회에서 행정관료, 입법관료 그리고 사법관료들은 이질적인 차단막과 견제장치 없이 동질적인 속성으로 동맹하여 결속한다. 마침내 3중 장치의 관료지배 시스템이 굳건하게 완성되었다.관료주의는 검찰조직이 여실히 잘 보여주었듯 자신들의 조직이기주의를 본능적으로 지향하며, 본질적으로 변화를 거부하면서 기득권을 옹호하게 된다. 시대와 대중의 요구가 아니라 자신들의 조직과 이익에 충실하다. 그리해 관료지배 사회는 결국 대다수 국민들의 이익에 반하며, 사회의 건강하고 공정한 전진에 장애를 형성한다.해결의 열쇠쥔 국회, 먼저 입법부 내 관료주의부터 개선해내야그렇다면 어떻게 우리 사회의 관료지배 구조를 개선할 수 있을 것인가?본래 관료집단을 견제할 수 있는 집단하면, 단연 가장 먼저 국회가 떠오르게 된다. 왜냐하면 국회란 국민의 의사를 대표하여 선출된 국민의 대표이기 때문이다. 하지만 오늘날 국회는 ""입법관료들의 하부 구조""라는 비아냥조차 있을 정도로 자기 위상을 정립해내지 못하고 있다.진리를 찾는 것은 사물의 구분, 또는 분별에 대한 인식으로부터 비롯된다. 인간의 판단과 인식이란 '분별해내는' 구분으로부터 비롯되는 것이다. 어린 아기의 사물에 대한 최초의 인식 과정 역시 사물에 대한 구분과 분별로부터 시작된다.지위와 위상이란 맡은 바 직무로부터 비롯된다. 어느 특정한 지위와 위상을 지닌 사람에게 부여된 직무를 다른 사람이 대신 해서는 안 된다. 주지하는 바와 같이, 국회는 국민으로부터 입법권을 부여받았다. 그러므로 국회의원과 국회 공무원은 그 하는 일이 달라야 한다. 맡은 바 그 직무가 분명하게 구분되어야 한다는 의미다. 국민들이 부여해준 입법권을 스스로 수행하지 않고 다른 사람에게 맡기게 되면, 결국 내가 아니라 그 다른 사람이 '국회의원'이 되는 것이다.국회는 마땅히 그 본업을 '회복'해야 한다. 그렇지 못하다면, 스스로 국회의원이라 자부하기 어렵다. 국회가 바로 서야 비로소 우리 사회가 바로 설 수 있다.저작권자(c) 오마이뉴스(시민기자), 무단 전재 및 재배포 금지▶오마이뉴스 '시리즈'에서 연재하세요!▶이재명 경기도지사 추천 《이재명과 기본소득》▶오마이뉴스 취재 후원하기"
"사진=연합뉴스여당의 유력 대권 후보 가운데 한 명인 이재명 경기도 지사가 보편 복지인 전 국민 기본소득을 자신의 간판 복지 정책으로 밀어붙이면서 이 문제가 여당 대선 경선의 핫 이슈로 떠오를 전망입니다.이 지사는 그제(7일) 페이스북에 자신이 구상하는 기본소득과 관련, 개념과 지급액, 재원 조달 방안, 기대 효과, 시행 시기 등의 청사진을 구체화했습니다. 이 지사가 그간 일관되게 기본소득을 주장했으나 이처럼 구상의 전모를 소상하게 밝힌 것은 처음입니다.일시 지원금인 4차 재난지원금의 선별 또는 보편 지급 여부를 결정해야 하는 정부와 여당으로서는 차원이 다른 기본소득 공론화에 당장 나서긴 쉽지 않은 상황입니다. 하지만 대선일이 가까워질수록 이 문제는 정치권은 물론 국민들 사이에서도 큰 폭발력을 가질 수밖에 없습니다.보편적 기본소득은 재난 등에 따른 일회성 지원이 아니라 모든 국민에게 차별 없이 정기적으로 꼬박꼬박 지급하는 일종의 국가 배당금입니다. 이는 전통적 재정 문법과는 완전히 다른 개념으로 국가의 재정 설계를 근본부터 다시 짜야 하는 엄청난 일이기에 정치적, 사회적 논의를 충분히 거칠 필요가 있습니다.◇ 이재명이 쏘아 올린 기본소득이 지사는 한국형 기본소득의 단기 계획으로 국민 1인당 연간 50만원, 중기 계획으로는 1인당 100만원을 일단 염두에 두고 있는 것으로 보입니다. 그는 ""1인당 연간 100만원(분기별 25만원) 기본소득은 결단만 하면 수년 내 얼마든지 시행할 수 있다""고 했습니다.1인당 50만원(25만원씩 연 2회 지급)씩을 전 국민에게 주려면 연간 26조원, 100만원씩을 주려면 52조원의 예산이 필요합니다. 이 지사는 이 가운데 26조원은 일반 예산 절감으로, 추가 26조원은 연간 50조∼60조원 수준인 조세감면을 절반 정도로 축소하면 조달 가능하다고 봤습니다.이 이상으로 기본소득을 늘리기 위해선 장기적으로 증세가 불가피하며, 기본소득목적세나 기후 위기 극복을 위한 기본소득환경세, 데이터 주권 확보를 위한 기본소득데이터세, 노동을 대체하는 로봇에 부과하는 기본소득로봇세, 불로소득에 물리는 기본소득토지세 등을 도입해 충당할 수 있다고 했습니다.이 지사는 증세를 통한 기본소득 증액은 10년 이상의 장기 목표 아래 기초생계비 수준인 국민 1인당 월 50만원(연간 600만원)이 될 때까지 국민 합의를 거쳐 서서히 늘려가면 된다고 했습니다.이 지사는 전액 지역화폐로 지급될 기본소득은 가계소득을 지원하는 복지제도인 동시에 경제 활성화와 수요확대로 지속 성장을 가능하게 하는 4차산업혁명 시대의 획기적 경제정책이라고 규정했습니다.이승윤 중앙대 사회복지학과 교수는 ""불평등이 심화하고 있는 데다 우리나라의 경우 자영업자가 많아 플랫폼 노동 등 비정형 노동이 더 확산할 가능성이 유럽보다도 더 높기에 이에 대한 보호를 위해 기본소득이 상당히 시급하다""고 했습니다. 그는 또 ""고용보험이 취업자의 50%도 채 포괄하지 못하고 있는 만큼 분배와 재분배가 모두 적신호""라면서 ""기본소득이 정치권에서만 논의될 게 아니라 시민사회에서 폭넓게 공론화 과정을 꼭 거쳐야 한다""고 강조했습니다.말콤 토리(영국 런던 정경대 선임연구원) 기본소득지구네크워크 단장은 작년 9월 경기도가 온라인으로 주최한 기본소득 토론회에 참석해 ""얼마나 실효성 있는 기본소득을 도입하는지가 중요하다""면서 ""현대 자본주의의 문제인 자본 또는 부의 소유 편중으로 인한 불평등을 완화할 수 있는 방향으로 제도를 시행해야 한다""고 밝힌 바 있습니다.◇ 문제는 재원…넘어야 할 산 첩첩산중하지만 문제는 재정입니다. 당장 대선 경쟁자이기도 한 이낙연 더불어민주당 대표나 정세균 총리가 보편적 기본소득은 시기상조라고 반대합니다. 이 대표는 ""알래스카 빼고는 그것을 하는 곳이 없다. 기존 복지제도의 대체재가 될 수는 없다""고 했고, 정 총리는 ""지구상에서 기본소득제도를 성공리에 운영한 나라가 없다""며 현 여건상 적절치 않은 제도라고 지적했습니다.나라 곳간을 책임진 기획재정부는 당연히 반대입니다. ""기본소득이 취약계층 우선 지원이라는 복지원칙을 흔들 수 있고, 대규모 재원이 소요돼 부작용이 발생할 수 있다는 점 등을 고려할 때 도입은 바람직하지 않으며 해외 복지선진국에서도 아직 도입한 사례가 없다""는 것입니다.이 지사는 결단만 하면 예산 절감과 세 감면 축소로 초기 재원을 얼마든지 조달할 수 있다고 하지만 실제 예산 편성 경험이 있는 관료들의 얘기는 다릅니다. 역대 정권들이 대부분 공약 사업 등을 위해 예산 절감이나 조세 감면 축소 등을 들고나왔으나 성공하지 못했다는 것입니다. 익명을 요구한 한 예산 관료 출신은 ""예산이라는 게 전체로 보면 덩치가 커서 잘라낼 부분이 있어 보이지만 실제 하려고 들면 용처가 정해져 있기 때문에 1조∼2조원도 손보기가 벅차다""고 했습니다. 결국 기본소득을 지급하기 위해선 국채나 증세에 의존할 수밖에 없을 것으로 봅니다.정세은 충남대 경제학과 교수는 ""꼭 필요한 사람한테 주는 것이 오히려 정의로운 것이지 모든 사람한테 다 준다고 해서 보편복지로 포장할 수 있는 것은 아니다""라면서 ""경기부양 측면에서도 상위 10%에게 주는 것보다는 하위 10%에게 더 두텁게 주는 것이 효과적이다""고 했습니다.경제개혁연대 소장인 김우찬 고려대 교수는 ""사회적 약자를 위한 복지 확대 차원에서 증세하거나 세금을 누진적으로 더 걷어야 한다는 데는 찬성하지만, 양극화를 줄이기 위해 노력해야 하는 상황에서 부자들에게까지 기본소득을 준다는 것이 맞는 방향인지는 의문이다""고 했습니다.안동현 서울대 경제학과 교수는 ""현재 세금 감면은 국가경쟁력을 높이기 위한 연구개발(R&D) 투자나 중소기업 저소득층에 집중돼 있는데 이를 깎아낸다는 게 쉽지 않으며 글로벌 스탠더드와 비교해 기업에 대한 세 부담을 늘리면 누가 투자를 하겠느냐""고 했습니다.[디지털뉴스부]▶ 네이버에서 'MBN뉴스'를 구독하세요!▶ 김주하 앵커 'MBN 종합뉴스' 저녁 7시 20분 진행▶ MBN Y포럼 사전등록 GO! GO!< Copyright ⓒ MBN(www.mbn.co.kr) 무단전재 및 재배포 금지 >"
(서울=뉴스1) 이재명 기자 = 민족 대명절 설을 앞둔 9일 오전 서울 송파우체국에서 집배원 등 직원들이 택배를 분류하고 있다. 2021.2.9뉴스
"법조계 “허위사실 공표죄 유명무실”TV토론회에서의 ‘사실과 다른 답변’을 무죄로 판단한 대법원의 ‘이재명 판례’가 공직선거법상 허위사실 공표 혐의가 쟁점인 사건들에서 자주 등장하고 있다. 검찰의 나경원 전 국민의힘 의원 불기소 처분 과정에서도, 최강욱 열린민주당 대표의 첫 공판에서도 이재명 경기도지사의 무죄가 언급됐다. 표현의 자유를 넓히고 처벌 범위를 줄인 획기적 판례라서 벌어지는 현상이지만 법조계 일각에서는 허위사실 공표죄가 유명무실해진 측면이 생겼다는 지적도 나온다.8일 국민일보 취재를 종합하면 서울중앙지검 형사7부(부장검사 이병석)는 지난해 10월 나 전 의원을 불기소 처분할 때 이 지사의 대법원 판례를 인용했다. 나 전 의원은 안진걸 민생경제연구소장을 지칭해 “무려 10차례나 저를 고발한 시민단체 대표는 그 공로를 인정받아 민주당 공천관리위원이 됐다”는 문자메시지를 주민들에게 발송했다가 고발됐다. 안 소장은 “공천관리위원이 된 것은 고발과 무관하다”며 나 전 의원의 문자메시지 발송이 허위사실 공표라고 주장했다.하지만 검찰은 이 지사의 판례를 소개하며 나 전 의원의 행위에 대해서도 “허위사실 공표에 해당하지 않는다”고 했다. 제기된 의혹을 부인하는 과정에서 정치적인 표현을 한 것이며, 안 소장에 대한 사실을 적극적으로 널리 드러내려 하진 않았다는 판단이었다. 검찰 관계자는 “고소인이 명예훼손 혐의로 맞고소된 상태였기 때문에 문자메시지 내용의 허위성 여부는 판단하지 않았다”고 말했다.총선 기간 팟캐스트에 출연해 “조국 전 법무부 장관의 아들이 실제 인턴 활동을 했다”고 발언했다가 재판에 넘겨진 최 대표도 지난달 법정에서 이 지사의 판례를 언급했다. 발언은 의견 표명에 불과하며, 이를 처벌한다면 표현의 자유와 선거운동의 자유를 심각하게 제약할 것이라는 주장이었다. 검찰은 최 대표의 발언이 구체적으로 특정된 허위사실에 해당하며, 팟캐스트에서의 언급은 ‘공표’ 적극성이 인정된다고 맞선다.공직선거법상 허위사실 공표죄는 법률가들 사이에서도 “구성요건이 생각보다 까다롭다” “법리적 판단이 어렵다”는 평을 받는다. 단순히 허위사실을 전했다고 해서 처벌하는 것이 아니라 허위라는 인식과 당선·낙선 의도까지도 확인돼야 한다는 것이다. 이런 상황에서 이 지사의 판결이 선거사범들의 방어논리가 됐다는 지적도 나온다. 공안사건 수사 경험이 많은 한 변호사는 “앞으로 근거 없는 의혹 제기나 부주의한 발언이 많이 오갈 수도 있게 됐다”고 말했다.윤해성 한국형사정책연구원 선임연구위원은 “발언자의 신분과 의혹 해명의 내용, 공표가 이뤄진 상황 등을 종합적으로 고려해서 판단하는데, 공직선거법은 뚜렷한 잣대가 없어서 굉장히 판단하기 어렵고 대법원 판례를 따라가는 성향이 크다”고 말했다. 장영수 고려대 로스쿨 교수는 “거짓말을 본인이 퍼뜨릴 때는 안되고, 의혹 제기에 대한 해명은 괜찮다는 식의 선례를 남겼을 수 있다”고 했다.구승은 기자"
