이,재,명
"'인문학을 권함 : 역사편'... 3월 24일과 4월 7일 공동저자 홍현성·김동건 박사 강연[이한기 기자]고양시(시장 이재준) 화정도서관에서는 연중 테마강좌 '인문학을 권함: 역사편'으로 역사 분야 베스트셀러 <조선잡사> 저자 특강을 개최한다. 이번 특강은 오는 24일과 4월 7일 이틀 동안 실시간 온라인(ZOOM) 방식으로 진행된다. <조선잡사> 공동 저자인 홍현성, 김동건 박사 두 사람이 강사로 나선다.'조선시대 사농 말고 공상으로 보는 조선시대 직업의 모든 것'이란 부제가 달린 <조선잡사>는 조선시대 평민들이 먹고 살았던 67가지 방법을 이야기한다. 웃음과 감동으로 읽는 밥벌이 역사라는 재미있는 표현과 함께 양반이 아닌 보통 사람의 관점에서 바라본 직업사를 인문학적으로 접근했다.3월 24일에 열리는 첫 강좌는 홍현성 박사가 강연을 맡는다. <조선잡사>를 쓰는 과정을 시작으로 삵바느질, 염모, 회자수, 착호갑사, 활술사 등의 직업에 대해 설명한다. 4월 7일에 열리는 두 번째 강좌에서는 김동건 박사가 방직기, 백정, 월천꾼, 매골승 등 여러 직업을 살펴보고 조선시대 보통 직업인들의 삶의 애환을 알아본다.고양시 화정도서관 관계자는 ""'인문학을 권함: 역사편'의 이번 <조선잡사> 저자 특강을 통해 조선시대 서민의 일상을 물론 조선시대 직업에 대해 알아본다""면서 ""당시 직업과 삶의 모습을 통해 현재를 돌아보고 미래 직업을 점쳐보는 흥미로운 시간이 될 것""이라고 말했다.특강 신청은 오는 8일 오전 10시부터 고양시도서관센터 홈페이지(www.goyanglib.or.kr)에서 할 수 있다. 궁금한 점은 고양시 화정도서관(☎ 031-8075-9205)으로 문의하면 된다.             ▲ 고양시 화정도서관에서는 3월 24일과 4월 7일 연중 테마강좌 '인문학을 권함: 역사편'으로 역사 분야 베스트셀러 <조선잡사> 저자 특강을 개최한다.            ⓒ 고양 화정도서관  저작권자(c) 오마이뉴스(시민기자), 무단 전재 및 재배포 금지▶오마이뉴스 '시리즈'에서 연재하세요!▶이재명 경기도지사 추천 《이재명과 기본소득》▶오마이뉴스 취재 후원하기"
"[지구를 구하는 가계부] 망사형 다회용 면주머니 사용이 가정 경제에 미치는 영향코로나19를 겪으면서 살던 대로 살면 안 될 것 같다는 걸 직감 했습니다. 지구가 망하지 않도록, 건강한 지구에 살고 싶어 생활 양식을 바꾸려 노력 중입니다. 기후 위기에 대응하는 소비 패턴의 변화를 연재합니다. <기자말>[이준수 기자]        ▲ 우리 집에서는 일상인 비닐 씻어 말리기            ⓒ 이준수  우리 집은 언젠가부터 새 비닐을 거의 사용하지 않게 되었다. 다회용 용기를 사용하는 버릇이 들다 보니 새 비닐을 뜯을 일이 없었다. 다만 싱크대 수납함에 산더미처럼 쌓여 있는 기존 비닐봉지가 골칫거리였다. 일부러 모으려고 한 건 절대로 아니었다.콩나물 봉지 따위를 버리기 아까워 아내가 씻어 말린 다음 쟁여두었는데 수량이 기하급수적으로 늘었다. 한 번이라도 더 비닐을 재사용하겠다는 의도였지만, 매일 같이 빨래 건조대에 널린 비닐을 보고 있자니 썩 기분이 좋지 않았다. 그래서 최근에는 리유즈백(Reuse bag, 망사형 다회용 면주머니)을 들고 있다.쌓이는 비닐, 이대로는 안 된다리유즈백은 비닐을 대신하여 사용할 수 있는 천가방이다. 그물처럼 촘촘한 구멍이 뚫려있어 통풍이 잘 되고, 질기다. 보통 마트에서 야채나 과일을 담을 때 사용한다. 사용방법은 간단하다. 구입을 희망하는 당근, 감자 등을 담고 점원 분께 무게를 달아달라고 하면 된다.             ▲ 리유즈백은 비닐을 대신하여 사용할 수 있는 천가방이다. 그물처럼 촘촘한 구멍이 뚫려있어 통풍이 잘 되고, 질기다.             ⓒ elements.envato  안이 잘 안 보일 수 있으니 입구 부분을 벌려 내용물을 확인시켜 드리면 좋다. 본인이 직접 무게를 달아 가격 스티커를 붙여도 되지만, 내용물이 보이지 않아 불필요한 오해를 살 수도 있으므로 나는 가급적 부탁을 드리는 편이다.난관도 있다. 천 가방 사용을 거절당할 수도 있다. 이건 리유즈백을 처음 샀을 때는 전혀 예상치 못한 부분이었다. 나는 첫 사용부터 순조롭지 않았다. 아내의 성공담에 자극받아 나 홀로 마트로 향한 어느 날이었다.장바구니에는 두 개의 천가방이 들어있었고, 왠지 모르게 두근두근 긴장되었다. 사실 아무도 신경 쓰지 않지만 괜히 튀는 짓을 한다는 인상을 풍기고 싶지 않았다. 주목받는 느낌이 조금이라도 들면 몹시 부담스럽기 때문이다.'자연스럽게, 최대한 부드러운 동작으로 쓱 사고 나오는 거야.'나는 '카레라이스 재료 사기'라는 원래의 목적에 따라 야채 매대로 갔다. 비닐 랩으로 포장된 중국산 세척 당근을 가볍게 지나쳤다. 내가 도착한 곳은 터프하게 쌓여있는 국내산 흙당근 코너. 다른 손님이 롤 형태로 비치된 비닐백을 뜯는 동안 나는 리유즈백을 꺼냈다. 잠재적 비닐 쓰레기 하나가 사라지는 순간이었다. '흐음, 리유즈백은 이 맛에 쓰는 것이군' 하면서 룰루랄라 집게를 들었는데 사소한 사고를 쳤다.피라미드 형태로 배치되어 있던 당근 구조물(?)의 중간 부분을 건드린 게 화근이었다. 나는 그저 그 당근이 튼실하게 보여서 집었을 뿐이었다. 하지만 물리학의 세계에서는 상부의 하중을 지탱하고 있는 핵심 기둥을 제거한 결과를 초래하였고 산사태, 아니 당근 사태가 벌어졌다.우두두두. 둥글둥글한 당근이 위에서부터 무너져 내렸다. 주목받기 싫어하는 나는 양손과 팔뚝, 집게를 이용해 인간 콘크리트 옹벽을 급히 쳤다. 하지만 허술한 빈틈으로 당근 하나가 빠져나왔고, 나는 2초 간 저글링 비슷한 짓을 하여 무릎 언저리에서 당근을 잡았다.아마 그때부터 야채 코너 점원 분은 나를 마음에 들어하지 않으셨을지도 모른다. 덩치 큰 남자가 이상한 가방을 꺼내더니 주의를 끌기 위해 서커스를 하고 소중한 상품에 위협을 가한다 - 이것이 대략적인 나의 인상이지 않았을까. 짐짓 아무렇지 않은 듯 안색을 바로 하고, 문제의 저글링 당근과 피라미드 꼭대기에 있는 당근을 집어 리유즈백에 담았다. 그리고는 나를 의식하고 계시는 점원분께 다가갔다. 묘한 경계감이 느껴졌다.""당근 무게 좀 부탁드립니다.""""여기에 담으시면 안 돼요. 저거 쓰세요.""단호한 말투. 저거는 당연히 비닐백을 의미했고, 그것이 이 세계의 규칙인 듯했다. 하지만 나도 나름 다회용 포장용기 사용으로 단련된 몸이다. 아이스크림 가게에서 스테인리스 볼에 패밀리 사이즈를 받아오는 사람으로서 침착하게 리유즈백 사용 의도를 말씀드리면 된다. 그러나 어쩐지 어버버 하면서 입이 떨어지지 않았다. 아무래도 피라미드 당근 해프팅의 여파가 심리에 영향을 미쳐 이 분께 더 이상 폐를 끼쳐서는 안 된다, 같은 생각이 커진 탓이었다.일단 물러났다. 그렇다고 당근을 다시 빼낼 수도 없었다. 내가 리유즈백을 왜 샀는가, 용기내 캠페인 참여를 하면서 비슷한 상황을 여럿 겪지 않았는가. 쑥스럽다고 해서 포기한다면 앞으로 마주하게 될 유사 상황에서 의기소침하게 대응할 것만 같았다. 다시 한번 용기를 냈다. 점원 분은 내가 다시 접근하자(저거를 사용하지 않은 채로) 흠칫 놀라셨다. 할 말을 신중히 골랐다.""죄송합니다만, 환경을 생각해서 이 가방 쓰는 건데 당근 무게를 달아주시면 안 될까요? 저번에 아내도 이렇게 했거든요.""환경을 생각한다는 명분이 점원 분의 마음을 조금 누그러뜨린 걸까. 점원 분은 잠시 뜸을 들이더니, 리유즈백을 받았다.""무게가 더 많이 나갈지도 모르는데 괜찮아요?""""네, 괜찮습니다. 고맙습니다.""가방 무게로 50원 정도 가격이 오른 스티커를 받았다. 행복한 추가 지출이다. 우리 집은 비닐을 아예 사용하지 않을 수는 없지만, 대량의 비닐이 발생하는 생활에 적극적으로 가담하지 않겠다는 살림 운영 원칙을 지키고자 노력하고 있다. 가령 온라인으로 감바스(내가 너무 좋아해서 특별한 날에 먹는 음식) 밀키트를 배송해 먹으면 맛나고 편하겠지만 사지 않는다.포기할 수 없는 이 즐거움텀블러나 밀폐용기, 리유즈백이 준비되지 않으면 카페도, 배달음식도, 마트도 가기가 꺼려진다. 이런 생활이 몸을 불편하게 만들기도 하지만 번외 선물에 가까운 이득도 있다. 당근이나 대파, 부추, 버섯 같은 원재료를 사용해서 집밥으로 요리하다 보니 건강해지고 가계 경제가 개선되었다.외부 음식은 값이 비쌀 뿐 아니라 포장 때문이라도 플라스틱이나 비닐을 많이 사용한다. 불필요한 포장 용기 사용을 줄이려 소비를 가려가며 하였을 뿐이데, 2020년 12월 우리 집 식비(4인 가구)는 531,570원이었다.코로나로 재택근무를 하고, 아이들을 가정 보육으로 대체하느라 하루 세 끼 집밥을 먹었다는 걸 감안하면 꽤 선방한 축이다. 이러니 장바구니에 리유즈백을 담아 마트로 향하는 길이 즐거울 수밖에.             ▲ 천 가방은 사용하기도 간단하고, 보관도 쉽다.            ⓒ 이준수  리유즈백을 지참한 친환경 장보기는 시간이 부족한 분들도 비교적 부담없이 참여할 수 있다. 천가방을 우리처럼 가게에서 사지 않고(재주가 부족하여), 집에서 만들어도 좋다. 솜씨가 뛰어난 분들은 남는 천을 이용하여 개인의 특성을 반영한 가방을 충분히 만드실 수 있을 것 같다. 계산대에서 결제를 마치고 나오는 길에 계산원 분이 지나가듯 한 마디 툭 던졌다.""요새 저런 가방 많이 쓰네. 비닐 안 쓰고 좋지 뭐.""나를 특정해 말하지는 않았지만 따뜻하게 지지받는 기분이 들었다. 저런 가방(리유즈백)이 좋다는 느낌은 중요하다. '저거(비닐백)'의 사용이 기본 전제인 세상에 균열을 내려면, 기쁨이 필요하다. 나는 생태계 붕괴의 공포를 자극해 환경 캠페인에 동참하게 만드는 것도 필요하지만, 비닐 한 장 줄이면서 얻는 소소한 보람과 행복이 지속성이 있다고 생각한다.리유즈백 그물 구멍 사이로 당근의 흙이 떨어져 나온다. 손가락으로 비비니 지문에 거뭇한 자국이 남는다. 흙에서 캐 온 작물을 사면서 그간 손에 검댕 한 줌 묻히지 않았다는 사실이 무척 어색하게 느껴진다.저작권자(c) 오마이뉴스(시민기자), 무단 전재 및 재배포 금지▶오마이뉴스 '시리즈'에서 연재하세요!▶이재명 경기도지사 추천 《이재명과 기본소득》▶오마이뉴스 취재 후원하기"
"이재명 경기도지사가 19일 오전 경기도 수원시 팔달구 경기도청에서 열린 국회 행정안전위원회의 경기도에 대한 국정감사에서 업무보고를 하고 있다. [사진=사진공동취재단][아이뉴스24 한상연 기자] 이재명 경기도지사가 신문사들의 부수 조작은 범죄 행위라고 지적했다.이 지사는 지난 1일 자신의 SNS에 신문사 부수 조작과 관련해 강제수사를 통해 책임을 물어야 한다고 주장했다.이 지사는 ""ABC협회가 공표하는 부수는 수백, 수천억에 이르는 각종 정부 보조금과 광고집행의 기준이 된다""며 ""부수조작은 언론시장 질서 왜곡은 물론 국민혈세를 훔치는 범죄""라고 비판했다.그러면서 ""ABC협회 개혁을 위해 문제부의 관리 감독을 강화하고 신문사 관계자가 압도적 다수인 이사회 구조를 바꿔야 한다""며 ""여의치 않다면 강제수사를 통해서라도 협회 신문사 간 공모여부를 밝혀 책임을 물어야 한다""고 강조했다.이 지사는 ""언론은 헌법에 따라 민주적 기본질서를 지켜내고 국민기본권을 보호하는 공기""라며 ""보호받는 만큼 정론직필의 공적책임을 다해야 한다""고 당부했다.한상연기자"
"오학동~여주여중(세종고)~여주중~세종초·중~여주고(여주대)~여주역 등 1일 9회 운행예정[박정훈 기자]        ▲ 경기 여주시가 주민 교통편의 욕구 해소 및 대중교통 문제 해결을 위해 오는  8일부터 시지원 공영버스 1대를 증차해 신설노선 운행에 들어간다.             ⓒ 박정훈   경기 여주시가 주민 교통편의 욕구 해소 및 대중교통 문제 해결을 위해 오는 8일부터 시지원 공영버스 1대를 증차해 신설노선 운행에 들어간다.2일 여주시에 따르면 오학동 개발사업 등 주변 여건 변화에 따른 주민의 대중교통체계 개선 요구에 맞추어 오학동~여주시내 소재 학교를 경유하는 운행노선을 신설한다.시는 시내버스 노선 신설을 통해 학교와 경강선 전철역과 시내 주요 거점지를 연계함으로써 시민의 교통 불편 해소를 기대하고 있다.시는 올해 대중교통 이용 시민의 편의 증진을 위해 대중교통 기본계획 수립 용역 등을 통한 관련 계획을 수립할 계획이다.신설노선은 노선번호가 910번으로 오학동~여주여중(세종고)~여주중~세종초·중~여주고(여주대)~여주역 등 여주시내 소재 학교를 순회하는 노선으로 1일 9회 운행할 예정이다.저작권자(c) 오마이뉴스(시민기자), 무단 전재 및 재배포 금지▶오마이뉴스 '시리즈'에서 연재하세요!▶이재명 경기도지사 추천 《이재명과 기본소득》▶오마이뉴스 취재 후원하기"
"만기 유지·연장 등 상환 방법 선택... ""연체 없는 정상기업 영업력 보존이 핵심""[조선혜 기자]             ▲ 금융위원회            ⓒ 금융위원회  코로나19 피해 중소기업·소상공인을 대상으로 한 대출 원금상환 만기연장, 이자상환 유예 조치가 오는 9월 30일까지 6개월 연장된다. 정부는 대출자가 개별 상황을 고려해 다양한 장기·분할상환 방법을 선택할 수 있도록 할 계획이다.2일 금융위원회와 금융감독원은 은행·보험 등 금융권 협회, 산업은행 등 정책금융기관과 함께 사회적 거리두기 지속에 따른 중기·소상공인의 어려움을 고려해 이같이 결정했다고 밝혔다.지난 1월 31일까지 금융권은 만기연장 121조원(37만1000건), 원금상환 유예 9조원(5만7000건), 이자상환 유예 1637억원(1만3000건) 등 모두 130조4000억원(44만2000건)을 지원했다. 이 가운데 이자상환 유예의 경우 규모도 크지 않고, 대부분 자발적으로 상환하고 있으며 지난해 4월 이후 유예금액도 감소하는 추세라는 것이 당국 쪽 설명이다.이러한 이자상환 유예 실적에 따라 금융권 부담이 크지 않다는 점 등을 고려해 대출 만기연장 등 조치를 연장하기로 결정했다.5월까지 연장 받았다면, 11월까지 연장 가능이에 따라 기존에 만기연장·상환유예를 신청했던 중기·소상공인도 연장기한 내 대출만기가 돌아오거나 유예기간이 종료하는 경우 연장 재신청이 가능해졌다. 예를 들어 지난해 11월 말 만기도래 대출자가 오는 5월 말까지 만기를 연장 받은 경우, 5월에 연장을 재신청하면 최소한 오는 11월 말까지 대출을 연장할 수 있다는 얘기다.산업은행과 기업은행 등 정책금융기관도 오는 9월 30일 내 만기가 돌아오는 중소·소상공인의 대출· 보증에 대해 대출자가 신청하면 만기연장·이자상환 유예를 실시한다. 더불어 그동안 대출·보증 만기연장을 지원해 온 중견기업에 대해서도 오는 9월 30일 내 만기도래분에 한해 동일하게 연장을 지원한다.이와 함께 14개 시중·지방은행에서는 지난해 4월부터 12월까지 시행했던 소상공인 이차보전 대출 프로그램의 만기를 1년 연장한다.중기·소상공인 가운데 '만기연장·상환유예 가이드라인'의 지원 요건에 해당하는 이들은 오는 9월 30일까지 만기연장·상환유예를 신청할 수 있다. 코로나19로 직·간접적 피해가 발생한 중기·소상공인으로서 원리금 연체, 자본잠식, 폐업 등 부실이 없는 경우에만 해당한다.금융회사는 대출연장을 신청한 대출자에 대해 유예기간 종료 뒤 대출자가 상환 가능한 최적의 방법을 선택할 수 있도록 사전 컨설팅을 제공할 예정이다. 개별 대출자의 상황을 고려해 다양한 장기·분할 상환방법을 선택할 수 있도록 하겠다는 것이다.만기 유지, 연장 등 상환방법 선택할 수 있다상환방법 예시는 크게 6가지다. 우선 만기를 유지하는 경우 기존 월상환금액의 2배씩 갚는 식이다. 대출금 6000만원, 고정금리 5%, 잔존 만기 1년으로 대출을 받은 소상공인이 이자상환을 6개월 유예 받은 경우, 유예 종료 뒤 6개월동안 기존 이자액에 유예이자를 합한 50만원씩을 매월 갚으면 된다.유예기간 만큼 만기를 연장하는 경우에는 기존 월상환금액의 1.5배씩 상환 가능하다. 위 사례에서 이자상환을 6개월 유예 받았다면, 원금일시상환 만기를 6개월 연장해 유예기간 종료 뒤 1년 동안 매월 37만5000원씩 상환하면 된다.세 번째는 유예기간보다 장기로 만기를 연장하는 경우다. 대출금 6000만원, 고정금리 5%, 잔존만기 1년으로 대출을 받은 소상공인이 원금일시상환 만기를 2년 연장하면 유예기간 종료 이후 2년6개월동안 매월 30만원씩 갚으면 된다.또 초기에는 기존 월상환금액을 갚고, 이후 1.5배씩 상환하는 식으로 거치기간을 둘 수도 있다. 위 사례와 같은 조건에서 이자상환을 6개월 유예받은 경우 원금일시상환 만기를 1년 연장하고, 6개월간 매월 기존 상환금액(25만원)만 갚다가 이후 1년 동안 매월 37만5000씩 갚는 식이다.기존 월상환금액과 비슷한 금액으로 원금과 이자를 분할상환하거나 기존 월상환금액의 절반 수준으로 원리금을 분할상환하는 방법도 있다.""해외서도 이자·원금 유예, 국내 금융회사 건전성 양호""앞으로 당국은 상환유예 대출에 대해 이상 징후 등을 지속 모니터링할 계획이다. 금융회사는 휴·폐업, 상거래 연체, 카드 사용액 등 대출자의 상환능력 변화를 밀착 모니터링하고, 상환 곤란 징후를 파악하면 대출자에 도움이 되는 지원방안을 권고할 예정이다.더불어 금융회사가 부실에 빠지지 않도록 선제적 충당금 적립 등을 유도해 건전성 관리도 지속 추진하겠다는 것이 당국 쪽 설명이다.권대영 금융위 금융산업국장은 ""대출연장 등 지원 대상 기업들은 코로나19로 인해 직·간접적 피해를 봤지만 연체 등이 없는 정상적인 회사""라며 ""코로나19가 진정돼 정상적인 경제상황으로 복귀하면 천천히 이자나 원금을 충분히 갚을 수 있는 기업의 영업력을 보존하는 것이 이번 대책의 핵심""이라고 밝혔다.이어 ""외국의 경우에도 대부분 원금뿐 아니라 이자까지 상환을 유예하고 있다""며 ""홍콩 외에는 대부분의 나라들이 이자와 원금을 한꺼번에 유예했다""고 덧붙였다.그러면서 ""경기부진이 장기화하면 대출연장 등 정책이 금융권 부실로 이어질 수 있다는 우려가 있는데, 다행히 현재 국내 금융회사의 건전성 지표는 굉장히 양호하다""며 ""금융권 부실 문제가 발생하지 않도록 최선의 노력을 다하고 있다""고 부연했다.저작권자(c) 오마이뉴스(시민기자), 무단 전재 및 재배포 금지▶오마이뉴스 '시리즈'에서 연재하세요!▶이재명 경기도지사 추천 《이재명과 기본소득》▶오마이뉴스 취재 후원하기"
