이,재,명
"이재명 경기도지사 페이스북 캡처이재명 경기도지사가 9일 일각에서 제기된 더불어민주당 탈당설에 대해 ""저로서는 상상할 수 없는 일""이라며 ""제 사전에 탈당은 없다""고 말했다.이 지사는 이날 자신의 페이스북 계정을 통해 ""정치입문 이래 단 한번도 탈당한 일이 없다""며 이같이 말했다.그는 ""'사람이 먼저인, 사람 사는 대동세상'을 이루고 싶은 것이 제 꿈""이라며 ""민주당이라는 든든한 울타리와 열정적인 우리 당원들 없이는 결코 이룰 수 없는 가치""라고 말했다.이어 ""돈에 종속되지 않고 행복한 일하며 사람답게 살 수 있도록 최소한의 삶을 보장하는 '기본소득', 돈이 생명의 가치를 흔들지 못하도록 최저한의 금융소비자 권리를 보장하는 '기본대출', 집 때문에 더 이상 불안하지 않도록 주거권을 보장하는 '기본주택'. 민주당 외에는 어느 정당에서 실현 가능하겠냐""고 반문했다.그러면서 이 지시는 ""탈당을 바라는 분이 계신 것 잘 안다""면서도 ""그 분들께서 말씀하시는 제 잘못과 부족한 점은 온전히 귀담아 듣고 고쳐 나가겠다. 민주당이 없으며 이재명도 없다. 이재명의 염원도 없다""고 강조했다.다음은 이 지사 글 전문이다.<제 사전에 탈당은 없습니다>우리 민주당은 이 땅의 민주주의와 평화 그리고 더불어 사는 사회를 위해 뚜벅뚜벅 걸어온 정당입니다. 김대중, 노무현 대통령님 두 거인께서 혼신을 다해 가꾸어 온 정당이자, 촛불혁명을 거쳐 문재인 대통령님을 탄생시키고 뿌리깊은 기득권 적폐세력에 맞서온 정당입니다.실수도 있었고 국민의 엄중한 회초리를 맞을 때도 있었습니다. 그럼에도 끝끝내 지키고자 했던 가치를 외면하지 않고, 시대의 요구에 응답하고자 애써왔던 정당입니다.무엇보다 민주당은 자랑스런 민주당원들의 정당입니다. 선거 때나 그렇지 않을 때나, 당이 잘할 때나 못할 때나, 그래도 우리가 지켜야할 소중한 당이라며 온몸을 던져온 당원들이 있습니다.뿌리깊은 정치불신의 따가운 시선을 한몸에 받으면서도, 때로 조롱과 모욕을 감내하면서도, 휴가내서 선거운동하고 주변에 한표 부탁하고, 동네 선술집에서 동창회에서 친구모임에서 온라인 상에서 주저없이 당을 지키고 받쳐왔던 당원들이 있습니다. 그 눈물겨운 헌신을 배신하는 탈당이란, 저로서는 상상할 수 없는 일입니다. 정치입문 이래 단 한 번도 탈당한 일이 없습니다.'사람이 먼저인, 사람 사는 대동세상'을 이루고 싶은 것이 제 꿈입니다. 민주당이라는 든든한 울타리와 열정적인 우리 당원들 없이는 결코 이룰 수 없는 가치입니다. 돈에 종속되지 않고 행복한 일 하며 사람답게 살 수 있도록 최소한의 삶을 보장하는 '기본소득', 돈이 생명의 가치를 흔들지 못하도록 최저한의 금융소비자 권리를 보장하는 '기본대출', 집 때문에 더이상 불안하지 않도록 주거권을 보장하는 '기본주택'. 민주당 외에 어느 정당에서 실현 가능하겠습니까.여러 이유로 저의 탈당을 바라는 분이 계신 것 잘 압니다. 그 분들께서 말씀하시는 제 잘못과 부족한 점은 온전히 귀담아 듣고 고쳐 나가겠습니다. 오해가 있다면 진심을 다해 풀도록 노력하겠습니다. 다만 다시 말씀 드리건대 제 사전에 탈당은 없습니다. 민주당이 없으면 이재명도 없습니다. 이재명의 염원도 없습니다.장혜진 부산닷컴 기자"
"'보호종료아동 위한 사회적기업' 혼자서 깜짝 방문... ""열여덟살의 홀로서기, 사회가 보듬어야""[최경준 기자]             ▲ 이재명 경기도지사가 5일 오후 보호종료아동(보육원 퇴소청소년) 창업 (예비)사회적기업 브라더스키퍼 사무실을 방문해 김성민 대표와 직원들을 격려하고 있다. (사진출처 - 김성민 페이스북)            ⓒ 김성민  ""혹시 도움될 만한 것이 있으면 요청하세요.""""(이재명 경기도지사가) 계신 것만으로도 큰 도움이 됩니다.""이재명 지사는 김성민 브라더스키퍼 대표와 직원들의 손을 차례로 잡아주며 ""힘내라""고 격려했다. 김성민 대표와 직원들도 이 지사에게 ""감사하다""며 인사를 건넸다.이재명 지사가 보호종료아동(보육원 퇴소청소년) 창업 (예비)사회적기업 브라더스키퍼 사무실을 방문한 것은 지난 5일 오후였다. 이날 경기 안양시 동안구에 있는 사무실 문을 열고 들어선 이 지사는 수행비서도 없이 혼자였다. 예상치 못한 이 지사의 갑작스러운 방문에 사무실에 있던 김성민 대표와 직원들은 깜짝 놀랐다.브라더스키퍼는 만 18세가 되어 보육원을 나와야 하는 보호종결아동에게 안정적인 일자리와 정서적인 자립을 위한 다양한 프로그램을 제공할 목적으로 2018년 설립된 사회적기업이다. 이 기업은 미세먼지뿐만 아니라 오염된 공기를 산소로 정화하는 벽면녹화를 포함한 조경 서비스를 제공한다.전국 최초, 보호종료아동 자립지원 정착금 1,000만 원 확대이재명 지사가 방문한 시각, 김성민 대표와 직원들은 설을 앞두고 보호종료아동들에게 전달할 명절 선물을 포장하고 있었다. 이 지사도 함께 선물을 포장하면서 직원들과 이런저런 이야기를 나누었다. 이 지사와 김 대표가 같은 경북 안동 출신이라는 이야기부터 브라더스키퍼가 하는 조경 사업, 경기도와의 협업 등에 관한 이야기가 오갔다.             ▲ 이재명 경기도지사가 5일 오후 보호종료아동(보육원 퇴소청소년) 창업 (예비)사회적기업 브라더스키퍼 사무실을 방문해 김성민 대표와 직원들을 격려하고 있다. (사진출처 - 김성민 페이스북)            ⓒ 김성민  무엇보다 이 지사는 '열여덟'이란 아직 어린 나이로 사회에 홀로 서게 될 보호종료아동들의 막막함과 두려움에 깊이 공감했다. 본인 역시 어린 시절 혹독한 가난으로 공장을 전전한 '소년공' 출신이고, 중·고등학교를 검정고시로 마치고 혼자 힘으로 대학에 들어가 사법고시까지 통과했던 과거 기억 때문에 남 일 같지 않았다.준비되지 않은 채로 사회에 나와 자립해야 하는 국내 보육원 퇴소청소년의 수는 연간 2,000~3,000명에 달한다. 보육원 퇴소청소년에게 지급되는 자립정착금은 1인당 300만 원에서 500만 원 사이. 전셋집을 구하기에는 턱없이 부족해 단칸방이나 고시원의 월세를 스스로 충당해야 한다. 경제적 형편이 어려운 이들은 대학을 포기한 채 취업의 길로 나서지만, 이 역시 아르바이트 등 단기성 취업이 대부분이다.지난해 12월 경기도 아동돌봄과 직원들이 보호종료아동을 돕기 위해 브라더스키퍼를 찾아왔다. 가장 시급한 것은 일자리였다. 사회적기업은 취업 취약계층을 의무적으로 고용해야 하는데, 보육원 퇴소청소년들은 퇴소 후 5년 동안만 취약계층으로 인정을 받는다. 5년이라는 시간은 군대를 다녀오거나 대학을 다니면 금세 지나가 버린다. 그래서 브라더스키퍼는 경기도에 청년기본법상 청년이 만 34세까지인 것을 근거로 이 기간까지라도 보육원 퇴소청소년이 취업 취약계층으로 인정받을 수 있도록 해달라고 요청했다.경기도는 지난해 12월 28일 보호종료아동의 자립기반 마련을 위해 현행 취업 취약계층 인정기간을 시설퇴소 후 5년에서 만 34세까지로 연장하는 내용의 '사회적 기업 육성법 시행지침 개정안'을 고용노동부에 건의했다.당시 이재명 지사는 ""시설에서 생활하다 보호 종료(퇴소)하는 아동을 우리 사회가 더 오래 보듬기 위해 노력해야 한다""면서 ""작은 행정조치지만 막 자립의 발을 내디딘 아동에게는 큰 의미가 있는 조치인 만큼 노동부가 경기도의 건의를 적극적으로 받아들이길 희망한다""고 말했다. 경기도는 또 전국 광역자치단체에 협조 공문을 보내서 개정안이 수용될 수 있도록 함께 목소리를 내달라고 제안했다.             ▲ 경기도가 아동복지시설과 가정위탁시설 등에서 보호를 받다가 만 18세가 넘으면 해당 시설을 떠나야 하는 ‘보호종료아동’의 사회적응과 자립을 돕기 위해 올해부터 자립지원 정착금을 기존 500만 원에서 1000만 원으로 확대했다. 정착금 1000만 원 확대는 국내에서 경기도가 처음이다.            ⓒ 경기도  경기도는 더 나아가 보호종료아동의 최소 생활비용 지원을 위해 올해부터 자립지원 정착금을 기존 500만 원에서 1,000만 원으로 증액했다. 정착금 1,000만 원 확대는 경기도가 전국에서 처음이다. 특히 브라더스키퍼의 요청 없이 경기도의 자체 판단에 따라 취한 조치다.""이재명 지사, 수행원 없이 혼자 방문... 깜짝 놀랐다""이재명 지사는 김성민 대표에게 ""(자립지원 정착금을) 2배로 올리기는 했는데, 그것도 너무 적은 것 같다""면서 ""사회적기업에 취업 취약계층으로 인정해주면 도움이 많이 되겠느냐""고 물었다.김 대표는 ""굉장히 도움이 된다. 많은 친구가 아르바이트로 생계를 유지한다""면서 ""취약계층으로 인정을 받으면, 사회적기업은 이 친구들을 의무적으로 고용해야 한다. 그렇게 정규직으로 일하면 시간적으로나 경제적으로나 자기에게 재투자할 기회가 아르바이트보다 훨씬 커진다""고 답했다.이재명 지사는 보육원 퇴소청소년들의 모임이 따로 있는지도 궁금해했다. 김성민 대표에 따르면, 명절이나 되어야 전국에 있는 보육원 퇴소청소년들이 한자리에 모인다고 한다. 김 대표는 ""장애인이나 탈북자 등은 문제가 있으면 연대를 해서 법을 바꿔달라는 등의 요구를 하는데, 보육원 출신이라는 것이 숨기고 감춰야 하는 일이라서 과감하게 드러낼 수 있는 친구들이 부족해 모임도 활성화되지 않았다""고 설명했다.김 대표는 이어 ""아직 사람들이 (보육원 퇴소청소년들에 대해) 모르는 부분도 너무 많고 문제가 발생해도 해결되지 않는 부분이 여전히 존재한다""면서 ""그런 문제를 해결하는 역할을 저희 부라더스키퍼가 하려고 노력하고 있고, 경기도에서 도와주셔서 저희에게는 정말 큰 기회가 됐다""고 이 지사에게 감사 인사를 건넸다.             ▲ 이재명 경기도지사가 5일 오후 보호종료아동(보육원 퇴소청소년) 창업 (예비)사회적기업 브라더스키퍼 사무실을 방문해 김성민 대표와 직원들을 격려하고 있다. (사진출처 - 김성민 페이스북)            ⓒ 김성민  애초 이날 이재명 지사의 부라더스키퍼 방문은 비공개 일정이어서 아는 사람이 거의 없었지만, 김성민 대표가 8일 페이스북에 이 지사의 방문 소식을 담은 글을 게재하면서 외부로 알려졌다. 김 대표는 '말로는 변화를 끌어낼 수 없습니다'라는 제목의 글에서 ""단순히 제도만 개선하는 것이 아니라 수혜자의 입장에서 가장 적절한 지원과 시기에 대해 고민하고 행정절차를 간소화하여 빠르게 추진해 주셔서 (이재명) 지사님의 방문이 반가웠다""고 전했다.김 대표는 이어 또 ""보호종료아동에게는 시간이 무엇보다 중요하다. 누군가에게는 준비하는 시간이 될 수 있지만, 우리 아이들에게는 그 시간조차 허락되지 않는다""면서 ""빠른 제도 개선을 통해 즉각 지원이 절실히 필요하다. 이러한 사정을 깊이 이해해 주시고 지체하지 않으신 덕분에 브라더스키퍼와 보호종료아동들이 큰 힘을 얻는다""고 밝혔다.김성민 대표는 이날 <오마이뉴스>와 전화통화에서 ""이재명 지사가 수행원 없이 혼자 오셨다. 사전에 이 지사가 오시는지 전혀 몰랐기 때문에 깜짝 놀랐다""면서 ""사실 (보육원 퇴소청소년들은) 굉장히 소외된 계층이지 않나. (이재명 지사가) 세밀하게 관심 가져주시고 알아주셔서 저나 저희 직원들에게 위로와 큰 힘이 되었고, 너무나 감사했다""고 말했다.한편 경기도는 '보호종료아동 종합지원 정책'을 마련하고 올해부터 시행에 들어간다. 종합지원 정책은 ▲퇴소 및 보호종료아동 자립지원정착금 증액 ▲자립지원정착금 지급 시 의무교육 지원 ▲보호종료아동 진로교육 및 취업연계 지원 ▲보호종료아동 생활지원 등 총 네 가지다.저작권자(c) 오마이뉴스(시민기자), 무단 전재 및 재배포 금지▶오마이뉴스 '시리즈'에서 연재하세요!▶이재명 경기도지사 추천 《이재명과 기본소득》▶오마이뉴스 취재 후원하기"
"경남전남 외국인 친척 집단 확진자 중 4명 변이로 추가 확인영국 80%·프랑스 20%·독일 10%…지역사회 감염 통해 변이 확산 중7일 오후 인천국제공항 제1여객터미널에서 해외입국자들이 공항을 나서고 있다. 2021.2.7뉴스1 © News1 이재명 기자(서울=뉴스1) 이형진 기자,이영성 기자,김태환 기자 = 신종 코로나바이러스 감염증(코로나19) 변이 바이러스가 전 세계적으로 빠르게 퍼지고 있다. 국내에서도 국내발생 4명, 해외유입 22명 등 26명의 추가 변이 확진자가 늘면서 총 80명의 사례가 발생했다.이중 국내 '경남전남 외국인 친척 집단발생' 관련해 노출이 가능한 대상을 선제검사한 결과 확진자 1명이 확인됐다. 변이 바이러스의 확산에 대한 우려가 점점 커지고 있다.이상원 중앙방역대책본부 역학조사분석단장은 9일 코로나19 정례브리핑에서 ""변이 바이러스가 전 세계적으로 굉장히 빠르게 확산하는 경향을 보이고 있다""며 이같이 말했다.방대본에 따르면 영국 내 코로나19 확진자의 80%이상, 프랑스는 20%, 독일도 10% 이상이 변이 확진자로 검출되는 상황이다. 해당 국가에서는 여행력이 없음에도 지역사회 감염을 통해 변이 바이러스가 퍼지고 있다.국내에서도 변이 바이러스 확산이 커지고 있다. 이날 0시 기준 변이 바이러스 확진자는 영국 발 24명, 남아공 발 1명, 브라질 발 1명 등 26명이 늘었다.이중 영국발 변이 바이러스 사례 중 4명은 국내 발생 사례다. 경남전남 외국인 친적 집단발생 관련 확진자로, 지역별로는 경남 김해 2명, 양산 1명, 부산 동구 1명으로, 친척 1명과 지인 3명이다.방대본은 경남전남 외국인 친척 집단발생 관련 접촉자 관리 상황을 재점검해 검사를 강화하고 있다. 밀접접촉자 52명, 일반접촉자 65명에 대한 검사 결과 추가 확진자는 확인되지 않았다.다만 노출 가능성이 있는 474명에 대한 선제검사에서 추가 확진자가 1명 발생했다. 해당 확진자는 지난 8일 확진됐으며, 무증상인 상태로 확인됐다.박영준 방대본 역학조사팀장은 ""(선행 변이확진자들과) 접촉력이 확인되지는 않았지만, 업무 등을 통해 노출 가능성이 있는 집단 474명에 대해 검사를 실시했다. 그 결과 1명이 확진된 상황""이라며 ""변이 바이러스 분석은 추가로 들어가야 할 상황이고 감염경로 조사도 별도로 진행되고 있다""고 설명했다.이외에도 해외유입 사례 22명 중 16명은 검역단계에서, 6명은 입국 후 자가격리 중 실시한 검사에서 코로나19에 확진됐다.해외유입 22명에 대한 접촉자 조사에서 변이 바이러스 감염이 확인된 사례는 없었으나, 변이 바이러스 확진자와 동일 항공기, 근접 좌석에 탑승한 탑승객 4명이 코로나19에 확진돼 변이 바이러스 여부를 확인 중이다.이날 26명의 추가로 전체 변이 확진자는 영국 발 64명, 남아공 발 10명, 브라질 발 6명 등 총 80명이다.이상원 단장은 ""변이 바이러스의 국내 확산을 막기 위해 입국객 분들의 협조가 절대적으로 필요하다""며 ""자가격리 위반자에 대해 무관용 원칙이 적용될 것이다. 위반 시에는 즉시 수사가 의뢰되고 고발조치 등이 이뤄질 것""이라고 밝혔다.이어 ""변이 바이러스 대응을 위해 증상 모니터링 주기도 하루 1번에서 1일 2회로 확대하고, 격리 준수 여부도 더욱 철저하게 관리할 것""이라며 ""개인의 가벼운 행동이 우리 사회 전체를 큰 위험에 빠트릴수 있다는 점을 항상 염두에 두시고 철저히 준수해달라""고 당부했다.한편, 이 단장은 ""전장유전체 검사는 PCR검사와 달리 유전자 염기서열을 분석하기 때문에 검사보다는 분석의 속성에 가깝다""며 ""월 500건 정도 수행할 수 있는 것으로 판단하고 있다""고 부연했다"
"토요타 ""상반기 부분 변경 모델 출시…하이브리드 주력으로 노력""혼다 ""현장 중심 경영 개편…하이브리드 3000대 판매 목표""© News1 안은나 기자(서울=뉴스1) 이균진 기자 = 2019년 일본 정부의 수출규제로 번진 일본제품 불매운동과 신종 코로나바이러스 감염증(코로나19) 사태 장기화로 지난해 일본차 판매량이 전년의 절반 수준으로 급감했다. 토요타코리아와 혼다코리아 등은 새롭게 선보이는 하이브리드 모델로 반전을 모색한다는 계획이다.9일 한국수입자동차협회(KAIDA)에 따르면, 일본차는 지난해 2만564대를 판매했다. 2019년 3만6661대의 절반 수준이다. 점유율도 2019년 14.98%에서 7.48%로 급감했다. 토요타의 고급차 브랜드인 렉서스는 2016년부터 2019년까지 4년 연속 1만대 이상 판매를 기록했지만 지난해에는 2019년(1만2241대) 판매에 못 미치는 8911대에 그쳤다. 2017년 이후 3년 연속 1만대 이상을 판매한 토요타도 마찬가지다. 토요타는 2018년 1만6774대에서 2019년에는 1만611대로 판매량이 감소했다. 지난해에는 6154대로 2019년의 절반가량 수준에 그쳤다. 혼다는 2017년 1만299대를 판매하며 기대를 모았지만 2018년 7956대, 2019년 8760대를 판매했다. 지난해에는 3056대로 2019년의 절반에도 못 미치는 판매량을 기록했다. 닛산과 인피니티는 수출규제로 인한 한일갈등과 판매부진 등을 이유로 한국시장에서 철수했다.일본차의 부진은 올해도 이어질 것이라는 전망이 나온다. 실제 올해 1월 판매량은 1035대로, 렉서스 443대, 토요타 400대, 혼다는 192대의 판매량을 기록했다. 전체 판매량은 지난해 같은 기간(1320대)보다 낮다.© News1 이재명 기자토요타코리아와 혼다코리아는 하이브리드 모델로 반전의 계기를 마련하겠다는 계획이다. 친환경차 수요가 높아지는 만큼 독자적인 기술로 고객의 마음을 돌리겠다는 것이다. 올해 1월 연료별 신규등록을 보면, 하이브리드는 지난해 1월(1281대)보다 4706대 증가한 총 5987대가 등록된 점도 긍정적이다. 다만 지난 1월 하이브리드 최다 판매 브랜드가 메르세데스-벤츠, 볼보, BMW라는 점은 넘어야 할 산이다. 벤츠는 E 350 4MATIC(802대·1위), E 300 e 4MATIC(344대·2위), CLS 450 4MATIC(320대·3위)이 모두 상위권을 차지했다. 일본차는 렉서스 ES300h(264대·5위)가 유일하다.ES300h의 인기로 하이브리드 강자로 떠오른 렉서스는 올해 상반기 플래그십 세단 LS 부분 변경 모델을 선보일 예정이다. 토요타는 미니밴인 시에나 하이브리드 부분 변경 모델을 내놓을 계획이다. 토요타코리아 관계자는 ""브랜드별로 두 가지 모델이 올해 주력으로 새롭게 나올 예정이다. 기존에 해왔던 것처럼 올해도 하이브리드 모델을 중심으로 고객과 만날 계획""이라며 ""세일즈 많이 하는 브랜드라기보다는 핵심 기술이나 고객 응대 등 환대 철학이 있다. 손님이 우리를 선택할 수 있도록 노력할 것이다""고 설명했다.혼다코리아는 뉴 CR-V 하이브리드와 뉴 어코드 하이브리드를 공개했다. 두 모델을 중심으로 하이브리드 모델에서만 연간 3000대를 판매한다는 목표다. 이를 기반으로 오는 2024년까지 하이브리드차량의 판매 비중을 80%까지 늘리겠다는 계획이다.혼다코리아 관계자는 ""(지난해는) 대외적으로 어려움이 많았던 시기였지만 현장 경영을 위해 노력했던 시기""라며 ""딜러, 고객과의 소통을 강화하기 위해 혼다 마일리지 클럽(로열티 프로그램), 고객만족평가단(미스터리 쇼퍼) 등을 창단했고, 혼다코리아 내부 조직도 현장 중심 경영으로 개편했다""고 말했다. 그는 이어 ""올해는 6000대 판매를 목표로 하고 있다""며 ""하이브리드는 이중 절반인 3000대가 목표""라고 강조했다"
"페르난데즈 주한 EU대사 지난 8일 답신″표현의 자유 방해하지 않을 것이라 확신″[의정부=이데일리 정재훈 기자] ‘대북전단금지법’에 대한 국제사회의 지지를 요청한 이재명 지사의 서한에 주한 유럽연합(EU) 대사도 화답했다.9일 경기도에 따르면 마리아 카스티요 페르난데즈(Maria CASTILLO FERNANDEZ) 주한 EU대사는 지난 8일 이 지사 측에 “대북전단금지법을 설명하는 서한을 보내준 데 감사하다”며 “이번 조치가 표현의 자유를 방해하지 않도록 하실 것이라고 확신한다”는 내용의 답신을 전달했다.카스티요 페르난데즈 대사는 답신에서 “한반도 분단선에 위치한 경기도의 특수한 상황을 이해한다”며 “남북관계 개선을 위해 대한민국 정부가 기울인 노력을 잘 알고 있으며 EU는 이를 전적으로 지지한다”고 밝혔다.이어 “인권과 근본적 자유에 대한 존중은 EU의 핵심 가치”라며 “한반도를 포함해 전 세계적으로 지속 가능한 평화를 구축하는데 있어 인권이 필수적인 요소라고 생각한다”고 강조했다. 또 “경기도와 상호 이익이 되는 분야에서 계속 협력할 수 있기를 바라며 조만간 직접 만나 뵙기를 고대한다”고 덧붙였다.앞서 지난달 29일 이 지사는 ‘대북전단금지법(개정 남북관계발전법)’에 대한 국제사회 일부 우려의 목소리와 미 의회의 청문회 개최 추진 움직임에 대응해 주한 EU대사를 포함한 주요국 대사들, 유엔(UN), 미국 의회 등에 공식 서한을 보냈다.(사진=경기도 제공)이 지사는 서한에서 “대북전단금지법은 도민의 생명과 안전·재산권을 보호하기 위한 최소한의 장치이자 불필요한 군사적 긴장과 대결을 예방하고 경색된 남북관계를 개선할 수 있는 평화적 수단”이라며 국제사회의 이해와 지지를 당부했다.이에 UN 사무총장 대변인실은 이 지사의 서한과 관련, 지난 1일 자유아시아방송(RFA)을 통해 “한국 당국이 한국의 인권 의무를 철저히 준수하면서 이 법을 시행할 것으로 믿는다”는 입장을 밝힌 바 있다.이어 주한 EU대사 역시 한국의 특수성과 자율성을 존중하며 대북전단금지법의 올바른 시행에 대한 신뢰를 밝히면서 도는 해당 법에 대한 국제사회의 지지 여론 확산이 힘을 받게된 것으로 분석하고 있다.도 관계자는 “주한 EU대사가 경기도 접경지의 현실과 남북전단금지법의 입법취지를 이해하고 동법 시행에 대한 신뢰를 표명해 주신데 대해 감사하다”며 “대북전단금지법이 인권을 준수하면서 시행될 수 있도록 소임을 다하겠다”고 밝혔다.정재훈 "
