이,재,명
"고령·영세·거동불편 주민이 이용 대상... 한 사람당 월 2회 이용 가능[이한기 기자]        ▲ 박남춘 인천시장이 11월 2일 도서주민과의 현장 소통을 위해 옹진군 소이작도를 방문하고 있다.            ⓒ 인천시  인천시(시장 박남춘)는 농어촌마을 교통 취약지역인 옹진군 백령면, 대청면, 덕적면, 영흥면 4개 면에서 공공형 택시인 '100원 행복택시'를 운행한다고 2일 밝혔다.이달 중에 현재 진행중인 옹진군 개인택시 이용 운임 현실화를 위한 택시요금 확정안 공고 절차가 마무리되는 대로 운행을 개시할 예정이다.100원 행복택시는 고령·영세·거동불편 주민이 이용 대상이다. 이용자가 개인택시 사업자에게 전화(콜)를 걸어 해당 마을에서 승차 목적지까지 이동한 뒤 군에서 배부한 이용권과 함께 요금 100원을 부담하면 된다.나머지 운행 요금은 개인택시 사업자에게 보조금을 지급해 주민의 경제적 부담을 줄여준다. 한 사람당 이용 횟수는 월 2회이며, 향후 예산 범위 내에서 대상자를 확대할 계획이다.인천시는 100원 행복택시 운행으로 대중교통 이용에 어려움을 겪고 있는 주민의 이동권이 한층 강화될 뿐만 아니라, 인구감소 등으로 어려움을 겪고 있는 지역 택시업계에도 도움이 될 것으로 보고 있다.인천시는 교통 취약지역 주민들에게 지역 맞춤형 교통서비스를 제공하기 위해 지난 2019년부터 강화군과 옹진군에서 농촌형 교통모델 사업을 추진해 소형버스 구입비 및 운영비 등 필요한 비용 전반을 지원하고 있다.농촌형 교통모델 사업은 버스·철도 등 대중교통과 자가용 운전이 어려운 농촌마을 고령·영세 주민들에게 택시와 소형버스를 활용한 대체 교통수단을 제공하는 사업이다.우선, 강화군은 대중교통 취약지역을 운행하는 노선을 주민 수요에 맞게 일부 조정해 10개 읍·면에 13개 노선 9대의 공공형버스를 운영하고 있다. 요금은 기존 군내 버스요금과 같다.지난해 공공형 버스 이용자는 8만5847명이 탑승해 강화군의 주 생활권인 강화읍으로 이동할 때 환승 불편함을 덜고, 이동시간이 절약돼 주 이용객인 고령층 주민들의 큰 호응을 얻고 있다.옹진군의 경우 대중교통수단이 전무한 옹진군 소청도, 대이작도, 소이작도, 승봉도 등 4개 섬지역에 100원 행복버스를 운행해 지난해 섬 주민들 1만5453명이 이용했다. 올해 1월에는 울도에 1대를 추가해 모두 5개 섬지역 주민들의 교통불편을 덜어줬다.김정범 인천시 택시물류과장은 ""농촌형 교통모델은 단순한 교통서비스가 아닌 작은 농촌 마을이 고립되거나 사라지지 않게 유지해 주는 사회적 연결망""이라며 ""앞으로도 대중교통 소외지역 마을 주민의 불편해소와 편리한 교통서비스 제공을 위해 추가 대상마을을 지속적으로 발굴해 확대해나가겠다""고 밝혔다.저작권자(c) 오마이뉴스(시민기자), 무단 전재 및 재배포 금지▶오마이뉴스 '시리즈'에서 연재하세요!▶이재명 경기도지사 추천 《이재명과 기본소득》▶오마이뉴스 취재 후원하기"
"[경향신문] 홍준표 무소속 의원 페이스북 캡처홍준표 무소속 의원이 연사흘 ‘이재명 때리기’를 이어가고 있다.홍 의원은 2일 사회관계망서비스(SNS)에서 7년전 이 지사가 성남시장, 자신이 경남 도시자이던 시절을 거론하며 이 지사를 강도높게 비판했다. 홍 의원은 “2014년 12월 한국프로축구연맹이 성남FC 구단주이던 이재명 성남시장을 징계할 때, 나는 경남FC 구단주 자격으로 연맹을 맹비난하면서 이 시장을 옹호해준 일이 있었는데, 그때 이 시장은 그걸 역이용해서 자신의 징계를 벗어나려고 자신을 도와준 나도 연맹을 비난했으니 같이 징계해 달라고 물괴신 작전을 편 일이 있었다”면서 “그때는 뭐 이런 양아치 같은 짓을 하나 하고 상종 못할 사람이라고 치부했는데, 이번에 자신의 선거법 위반 재판을 하면서 문재인 대통령 아들 문준용군 문제를 물고 늘어지는 것을 보고 비로소 아하 그런 사람이구나 하는 생각을 굳히게 되었다”고 적었다. 홍 의원은 이어 “자신의 이익을 위해서라면 어떤 짓도 할 수 있다는 인성을 극명하게 잘 보여준 두개의 사건은, 이 지사가 민주당 후보가 되는데 앞으로 친문들로부터 환영받지 못하고 큰 어려움을 겪는 사건이 될 것”이라고 했다. 그러면서 “야당이 집권하면 정치보복을 주장할 수 있지만, 자기들이 재집권해서 보복당하면 그마저도 주장할 길이 없다”고 덧붙였다. 이 지사와 더불어민주당 친문 지지층 사이의 해묵은 갈등을 부각하며 이 지사를 공격한 것이다.홍 의원은 지난 1일과 지난달 28일에도 SNS에서 이 지사를 향해 ‘양아치’ 등 원색적인 표현을 동원하며 말폭탄을 쏟아낸 바 있다.심진용 기자"
동영상 뉴스<진행>김태일 앵커<출연자>윤경호 MBN 논설위원소종섭 전 시사저널 편집국장김은미 기자이동석 기자윤지원 기자#MBN #MBN프레스룸  MBN논설위원         ▶ 네이버에서 'MBN뉴스'를 구독하세요!▶ 김주하 앵커 'MBN 종합뉴스' 저녁 7시 20분 진행▶ MBN 무료 고화질 온에어 서비스 GO!< Copyright ⓒ MBN(www.mbn.co.kr) 무단전재 및 재배포 금지 >
"""승리하는 단일화 위해 의원직 내려놔"" ... 사퇴 현실화되면 김의겸이 비례 승계[김성욱 기자]        ▲ 열린민주당 김진애 서울시장 후보            ⓒ 연합뉴스  김진애 열린민주당 서울시장 후보가 2일 국회의원직 사퇴를 전격 선언했다. 현직 국회의원인 김 후보가 선거에 완주하기 위해선 공직 사퇴 시한인 오는 8일까지 의원직을 내려놔야 하는 상황이었다. 8일 전까지 더불어민주당과의 단일화 협상이 이뤄질 것이란 예측과 달리 초강수를 둔 것이다.김 후보는 이날 오전 국회에서 긴급 기자회견을 열고 ""지금의 시대정신은 '국회의원 김진애'보다 '서울시장 김진애'를 원하고 있다""면서 ""승리하는 (여권)단일화를 성사시키기 위해서 저는 제 국회의원직을 내려놓는 것""이라고 밝혔다.김 후보는 ""범민주 여권의 단일화는 정치게임만 하는 범보수 야권의 단일화와 달라야 한다""라며 ""더불어민주당과 열린민주당이 함께 승리하려면 충실한 단일화 방식이 필요하고 그 과정을 서울시민들이 흥미진진하게 여길 수 있어야 한다""라고 했다.이어 ""더불어민주당과 박영선 후보에게 요청드린다""라며 ""김진애의 국회의원직 사퇴 결단이 헛되지 않도록 부디 공정한 단일화 방안으로 합의되는 리더십을 발휘해 달라""라고 촉구했다.김 후보는 ""제가 국회에서 계속 일하기를 바라시는 당원과 국민께 송구스럽다""면서 ""열린공천을 통해 21대 국회에 입성한 후 지난 열 달 동안 뜨겁게 일했다""라고 덧붙였다.한편, 비례대표 의원인 김 후보가 실제 의원직을 사퇴하게 되면 다음 순번인 김의겸 전 청와대 대변인이 열린민주당 비례대표 의원직을 승계하게 된다.다음은 이날 김 후보의 기자회견문 전문.안녕하십니까?열린민주당 서울시장 후보 김진애입니다.저의 국회의원직 사퇴를 밝히기 위해 이 자리에 섰습니다.이제 단일화 국면입니다.범민주여권의 단일화는 정치게임만 하는 범보수야권의 단일화와 달라야 합니다.더불어민주당과 열린민주당이 함께 승리하려면충실한 단일화 방식이 필요하고그 과정을 서울시민들이 흥미진진하게 여길 수 있어야 합니다.서울시민들이 투표하러 꼭 나오고 싶게 만들어야 합니다.승리하는 단일화를 성사시키기 위해서,저는 제 국회의원직을 내려놓는 것입니다.제가 국회에서 계속 일하기를 바라시는 당원과 국민께 송구스럽습니다.열린공천을 통해 21대 국회에 입성한 후 지난 열 달 동안 뜨겁게 일했습니다.법사위에서는 국민 속을 시원하게 풀어준다고 '김진애어컨'이라는 별명을 얻었습니다.국토위에서는 국토부 장관 인사청문회로 시작하여가덕도신공항특별법에 찬성 발언과 표결까지 마무리했습니다.18대 민주당 의원으로서 'MB 4대강사업 저격수'를 할 때와는 다른 보람이었습니다.거대 여당 의원들이 못하는 역할을 담당하면서문재인정부를 대승적으로 지원할 수 있었기 때문입니다.지금의 시대정신은'국회의원 김진애'보다 '서울시장 김진애'를 원하고 있습니다.서울시민들에게 희망을 불러일으키고문재인 정부의 정책을 서울시에 안착시켜서 대선 승리에도 기여할 것입니다.진짜 도시전문가 김진애의 실사구시 역량,정치인 김진애의 흔들림 없는 소신과 믿음 가는 행보,그리고 인간 김진애의 사람 사랑과 삶에 대한 열정으로이 시대에 적합한, 가장 좋은 서울시장이 되겠습니다.저 김진애 후보의 '김진애너지'를 믿어주십시오.김진애너지를 서울시에 가득 충전해 드리고 싶습니다.김진애너지로 서울시민들을 기운내게 해드리고 싶습니다.끝으로 더불어민주당과 박영선 후보에게 요청드립니다.김진애의 국회의원직 사퇴 결단이 헛되지 않도록부디 공정한 단일화 방안으로 합의되는 리더십을 발휘해 주십시오.밋밋하게만 갔다가는 질 수도 있습니다.안전 위주로만 갔다가는 안전하게 패할 수도 있습니다.우리는 기필코 이겨야 합니다.우리는 바르게 이겨야 합니다.20210302김진애열린민주당 서울시장 후보저작권자(c) 오마이뉴스(시민기자), 무단 전재 및 재배포 금지▶오마이뉴스 '시리즈'에서 연재하세요!▶이재명 경기도지사 추천 《이재명과 기본소득》▶오마이뉴스 취재 후원하기"
"이 지사의 성남시장 시절 K리그 명예훼손 및 문준용씨 언급 관련 문제 지적홍준표 무소속 의원이 4일 국회에서 열린 제348회 국회(임시회) 제4차 본회의에서 정치외교통일안보에 관한 대정부질문을 하고 있다.2021. 2. 4 김명국 선임기자 daunso@seoul.co.kr홍준표 무소속 의원이 이재명 경기지사에 대해 ‘양아치’란 비판을 이어나갔다.홍 의원은 2일 자신의 사회관계망서비스(SNS)를 통해 2014년 한국 프로축구 연맹이 이 지사를 징계했던 사건을 언급하며 이 지사가 ‘상종 못 할 사람’이라고 비난했다.이 지사는 성남시장이자 프로축구 성남FC 구단주로 재직하던 2014년 자신의 SNS를 통해 성남이 올해 K리그 클래식에서 오심 피해를 봤다고 주장해 한국프로축구연맹으로부터 ‘경고’의 징계를 받았다.당시 연맹은 이 지사가 SNS에 쓴 글로 K리그 명예를 훼손했다고 판단했고, 이 지사는 상벌위원회에 직접 참석해 “리그가 공정하게 운영돼야 한다는 글을 올린 것이 어떻게 연맹의 명예를 실추시킨 것이냐”고 반박했다.홍 의원은 “한국 프로 축구연맹이 성남 FC 구단주이던 이재명 성남시장을 징계 할때 경남 FC 구단주 자격으로 연맹을 맹비난 하면서 이재명 성남시장을 옹호해 준 일이 있었다”면서 “그런데 그때 이재명 성남시장은 그걸 역이용해서 자신의 징계를 벗어나려고 자신을 도와준 나도 프로 축구 연맹을 비난했으니 같이 징계해 달라고 물귀신 작전을 폈다”고 밝혔다.이재명 경기도지사. 서울신문DB이어 “그때는 뭐 이런 양아치 같은 짓을 하나 하고 상종 못 할 사람이라고 치부했는데 이번에 자신의 선거법 위반 재판을 하면서 문재인 대통령 아들 문준용군 문제를 물고 늘어지는 것을 보고 비로소 아하 그런 사람이구나 하는 생각을 굳히게 되었다”고 털어놓았다.이 지사는 문재인 대통령 아들 문준용씨의 고용정보원 특혜 채용 의혹이 허위라고 확신한다면서 부인 김혜경씨가 트위터로 이러한 사실에 대한 글을 쓰지 않았다고 주장한 바 있다.홍 의원은 “자신의 이익을 위해서라면 어떤 짓도 할수 있다는 인성(人性)을 극명하게 잘 보여준 두개의 사건은 이 지사가 민주당 후보가 되는데 앞으로 친문들로부터 환영을 받지 못하고 큰 어려움을 겪는 사건이 될 것”이라고 내다봤다.그 이유로 야당이 집권하면 정치보복을 주장 할수 있지만 민주당 소속인 이 지사가 재집권해서 보복당하면 그마저도 주장할 길이 없을 것이라고 했다. 이 지사는 일부 친문 세력들 사이에서 제기되는 탈당론에 대해 “탈당은 내 사전에 없다”고 강력하게 반박한 바 있다.지난 28일에도 홍 의원은 자신의 페이스북을 통해 “지난번 지방선거 때 위장평화 거짓 선동에 가려졌지만 형수에게 한 쌍욕, 어느 여배우와의 무상 연애는 양아치 같은 행동이었다”고 이 지사를 저격했다.윤창수 기자 "
"이재명 지지 광주본부에 이어 전남본부 13일 출범김두관 11일 광주시의회서 토론회, 2박3일 일정[광주=뉴시스] 류형근 기자 = 이재명 경기도지사가 '인공지능 헬스케어 플랫폼 구축 결성식' 참석을 위해 29일 오후 광주 서구 광주시청을 방문해 환영나온 어린이와 기념사진을 찍고 있다. 2021.01.29."
“문준용 물어 늘어진 사람…야당엔 정치보복 주장이라도 하지”이재명 경기지사(왼쪽)와 홍준표 무소속 의원. 뉴시스홍준표 무소속 의원이 대선 지지율 1위를 달리고 있는 이재명 경기지사를 연일 때리고 있다. 이번엔 이 지사와 친문 사이의 분열을 기대하는 주장을 내놓았다.홍 의원은 2일 페이스북에 글을 올려 이 지사를 향해 “이런 양아치 같은 짓을 하나 하고 상종 못할 사람이라고 치부했다”며 “자신의 선거법 위반 재판을 하면서 문재인 대통령 아들 문준용 군 문제를 물고 늘어지는 것을 보면서 비로소 그런 사람이구나 하는 생각을 굳혔다”고 말했다.홍 의원이 양아치 같은 짓이라고 지칭한 사건은 2014년 한국프로축구연맹이 당시 성남시장으로 성남FC 구단주까지 맡고 있던 이 지사를 징계했던 일이다. 이때 경남지사였던 홍 의원도 경남FC 구단주 자격으로 이 지사를 옹호했다.홍 의원은 “연맹을 맹비난하면서 이 지사를 옹호해준 일이 있었다”며 “그런데 이 지사는 이를 역이용해서 자신의 징계를 벗으려고 나도 같이 징계해달라고 물귀신 작전을 편 일이 있었다”고 비난했다.그는 “자신의 이익을 위해서라면 어떤 짓을 할 수 있다는 인성을 극명하게 잘 보여주는 두 개의 사건”이라며 “이 지사가 (더불어)민주당 후보가 되는데 앞으로 친문들로부터 환영을 받지 못하고 큰 어려움을 겪는 사건이 될 것”이라고 강조했다.홍 의원은 친문들을 향해서 이 지사가 대선에서 이기면 정치보복을 걱정해야 한다고도 주장했다.그는 “야당이 집권하면 정치보복을 주장할 수 있지만 자기들이 재집권해서 보복당하면 그마저도 주장할 길이 없다”고 경고했다.홍준표 의원 페이스북 캡처김이현 기자 
"바닥 난 재정 채우기 고심英 법인세 인상 공식화美 초부유층과세안 발의국내서도 증세론 기지개이재명 목적세 언급與 사회연대특별세 법안 등 발의[아시아경제 박병희 기자, 전진영 기자, 구채은 기자]  코로나19 위기 대처에 막대한 돈을 풀던 각국 정부가 이제 텅빈 곳간을 채울 방법을 고민하기 시작했다. 국가부채를 줄이기 위해 잇따라 증세론을 꺼내들고 있는 것이다. 한국 정치권도 이미 증세가 화두로 떠오른 상태다. 결국 국민들에게 ‘코로나 청구서’를 내밀겠다는 것이다.영국 이어 미국도 ‘코로나 증세’ 움직임1일(현지시간) 블룸버그 통신에 따르면 엘리자베스 워런 미국 민주당 상원의원(사진)은 초부유층과세법안(Ultra Millionaire Tax Act)을 발의했다. 법안은 순자산 5000억달러가 넘는 자산가에게 매년 2%, 10억달러가 넘는 자산가에게 매년 3%의 재산세를 부과한다는 내용을 담고 있다. 블룸버그는 미국 상위 부자 100명이 세금으로 780억달러를 더 내야 한다고 전했다. 지난해 이들의 자산은 5980억달러 늘었고 이 중 13%를 세금으로 내는 셈이다.블룸버그는 조 바이든 대통령과 집권 민주당이 기업과 고소득층에 대한 증세를 추진하겠다는 입장이지만 소득이 아닌 재산에 세금을 부과하는 것에는 지지하지 않는다며 법안 통과 여부가 불확실하다고 전했다. 뉴욕타임스는 올해 9월이면 ""우리는 99%다""를 외친 월가 점령 시위 10주년이 된다며 경제적 불평등까지 목표로 내건 초부유층과세법안의 통과 여부가 주목된다고 전했다. 주정부에서는 소득세 인상 움직임이 본격화하고 있다. 뉴욕주는 연 100만달러 이상 고소득자에게 특별소득세를 향후 3~5년간 한시적으로 부과하는 방안을 추진 중이며 워싱턴주 의회는 최근 2만5000달러 이상 자본 소득에 7%의 세금을 걷는 방안을 통과시켰다.영국은 오는 3일 예산안을 공개하면서 법인세 인상 계획을 발표할 예정이다. 리시 수낙 재무장관은 현재 19%인 법인세율을 올 가을부터 20%로 인상하고 장기적으로 23%까지 인상하는 방안을 공개한다. 현재 집권 정당인 보수당이 전통적으로 감세를 강조해왔다는 점에서 이번 법인세 인상은 눈길을 끈다. 보수당은 2010년 집권한 뒤 당시 28%였던 법인세율을 꾸준히 인하해 2017년 이후 19%를 유지해왔다.국내서도 고개 드는 증세론 [이미지출처=연합뉴스]국내에서 가장 적극적으로 증세론을 제기하고 있는 사람은 유력 차기 대권주자인 이재명 경기도지사다. 대표적 ‘증세론자’인 이 지사는 기본소득을 지급하기 위해 일반기본소득목적세와 데이터세·로봇세·환경세·토지세 등을 포함한 특별기본소득목적세를 걷는 방안을 언급하고 있다. 이 지사는 최근 페이스북에서 ""기본소득으로 공평하게 지급되는 기본소득목적세를 징수하면 90% 이상의 가구가 내는 세금보다 받는 기본소득이 많아 일반적 증세보다 국민 동의가 용이하다""고 언급했다.구체적 증세 방식에 대해서는 여당에서도 여러 아이디어가 나오고 있다. 이상민 민주당 의원은 ‘사회연대특별세’를 이달 초 발의할 예정이다. 세후 소득 1억원 이상인 개인 57만명과 상위 100대 기업을 대상으로 코로나19 극복을 위한 목적세를 약 3년간 한시적으로 추가 부과하는 내용이다. 장경태 민주당 의원도 청년 일자리 창출을 위해 내국법인 및 국내원천소득이 있는 외국법인에 대해 10년간 한시적으로 청년세를 부과하는 ‘청년 금융 사다리법’을 발의했다. 국회 기획재정위원장인 윤후덕 민주당 의원은 지난달 16일 전체회의에서 ""지금쯤이면 재정당국에서도 증세 방안을 공론화해야 한다""며 ""화끈하게 지원하고 화끈하게 조세로 회복하는 체제가 정직한 접근""이라며 증세 필요성을 언급했다.다만 여당 안팎에서는 증세론에 대해 ""당론으로 확정되지 않은 안""이라며 확대 해석을 경계하는 분위기다. 4월7일 서울시장 등 굵직한 보궐선거를 앞둔 상황과도 무관하지 않다. 특히 ‘신복지 체제’를 핵심 공약으로 내세운 이낙연 민주당 대표가 증세에 부정적 입장이다. 이 대표는 지난달 본지와 가진 인터뷰에서 ""조세 법정주의라는 점에서 이론상 불가능하지 않느냐""면서 ""법률이 개정돼야 증세든 감세든 할 수 있는 것""이라는 원론적인 입장을 보였다.박병희 기자"
"엄천강의 아침 풍경[최상두 기자]지리산둘레길 4구간 엄천강변 길 금계에서 동강으로 걸으면 엄천강이 함께한다.함양군 마천면에서 휴천면으로 흐르는 강줄기는 거칠고 힘차서 엄천강엔 많은 돌개구멍이 형성되어 있다.              ▲ 지리산둘레길 엄천강 돌개구멍헤아릴수 없는 엄천강의 돌개구멍            ⓒ otter papa                ▲ 엄천강의 아침 반영하늘이 물속에 들었다.            ⓒ 최상두                ▲ 지리산둘레길 엄천강 아침 말고 고운 엄천강의 시린 물            ⓒ otter papa                ▲ 지리산둘레길 엄천강 반영지리산둘레길 경치            ⓒ otter papa  저작권자(c) 오마이뉴스(시민기자), 무단 전재 및 재배포 금지덧붙이는 글 | 이 기사는 <서부경남신문>에도 실립니다. ▶오마이뉴스 '시리즈'에서 연재하세요!▶이재명 경기도지사 추천 《이재명과 기본소득》▶오마이뉴스 취재 후원하기"
(서울=뉴스1) 이재명 기자 = 2일 오후 서울 노원구 육군사관학교에서 열린 제77기 졸업 및 임관식에서 졸업 생도가 가족들의 영상평지를 바라보며 눈시울이 붉어져 있다. 2021.3.2뉴스
"2일 오전 청와대 국무회의[김윤상 기자]        ▲  [오마이TV] 문재인 대통령 ""어떤 백신이든 정부가 안전성 책임진다""             ⓒ 김윤상          문재인 대통령은 2일 오전 청와대에서 국무회의를 주재했다. 이 영상은 전체 회의 중 문재인 대통령의 모두발언을 담고 있다.(화면 제공 : KTV 국민방송  영상 편집 : 김으뜸 PD)저작권자(c) 오마이뉴스(시민기자), 무단 전재 및 재배포 금지▶오마이뉴스 '시리즈'에서 연재하세요!▶이재명 경기도지사 추천 《이재명과 기본소득》▶오마이뉴스 취재 후원하기"
