이,재,명
"택배기사 하씨, 300만 원 없어 합의도 불발... 법원 ""침입 정황 없어, 가벼운 판결 선고""[강연주 기자]""피해자가 300만 원을 주면 합의해 준다고 했었어요. 하지만 당장 그 큰 돈을 마련할 여력이 되질 않았고, 결국 재판까지 오게 됐어요. 이 사건으로 다니던 택배회사는 그만두게 됐어요.""9일 오후, 택배노동자 하아무개씨가 잔뜩 상기된 얼굴로 법정에 섰다. 혐의는 '건조물 침입'. 잠겨있지 않은 미용실 뒷문을 이용해 택배 물품을 배달하고 나왔는데 이 일이 화근이 돼 재판까지 오른 사건이었다.이날 하씨의 재판을 심리한 서울중앙지법 형사15부(안재천 판사)의 판단은 '선고유예'였다. 하씨의 범행이 경미하다고 보고 50만 원의 벌금형을 유예하기로 한 것이다. 재판부는 ""피고인이 기타 다른 목적으로 이 사건 미용실에 침입했다고 볼 정황이 없다""고 판시했다.하씨는 벌금형을 피했지만 직을 잃게 됐다. 이 사건이 계기가 돼 다니던 택배 회사를 그만두게 됐기 때문이다. 현재 그는 다른 일을 구하고자 자격증을 준비하고 있다. 재판 직후 하씨는 ""법이 택배 물건을 두기 위해서 들어간 것 자체를 죄라고 하는데 제가 뭘 어떻게 할 수 있겠나. 전에 받았던 벌금형보다 올라간 게 아니라 다행일 뿐""이라며 씁쓸히 웃었다.합의금 300만 원... 하씨 ""여력이 안 됐다""             ▲ 한 택배노동자가 잠겨있지 않은 미용실 뒷문을 이용해 택배 물품을 배달하고 나왔다가 '건조물 침입' 혐의로 재판을 받았다. 재판부는 ""피고인이 기타 다른 목적으로 이 사건 미용실에 침입했다고 볼 정황이 없다""고 판시했다.            ⓒ envatoelements  하씨가 직업까지 잃어야 했던 그날의 사건은 무엇일까. 당시 하씨의 배송지는 서울 강남구 역삼동에 위치한 미용실이었다. 해당 미용실은 공동현관 비밀번호를 입력해야 들어갈 수 있는 건물 1층에 위치해 있었다.문제는 해당 미용실을 운영하는 피해자에게 공동현관 비밀번호를 묻고자 연락을 시도했음에도 통화가 닿지 않았던 점이다. 그렇게 공동현관 앞에서 서성이던 중, 하씨는 미용실 뒷문이 잠겨 있지 않은 것을 확인하게 된다. 하씨는 이 뒷문을 이용해 미용실 내부에 들어가 배송 물품을 두고 나오게 된다.피해자와의 통화는 배송이 이뤄진 후에야 닿았다. 이때 피해자는 전화로 하씨에게 공동현관 비밀번호를 알려줬다. 하씨는 다시 뒷문을 이용해 물건을 가지고 나온 후 공동현관문을 열고 들어가 물품을 미용실 앞문에 두고 나왔다. 비밀번호를 알고 난 후 배송물품을 제 위치에 놓고 나온 셈이다.몇 시간 후 하씨는 경찰 조사를 받게 됐다.피해자에게 어떠한 얘기도 없이 열려있는 미용실 뒷문을 이용해 배달을 했다는 이유 등으로 피해자가 하씨를 경찰에 신고했다. 하씨에 따르면, 해당 사건이 검찰에 송치된 후, 피해자는 하씨에게 합의금 300만 원을 요구하면서 '합의금을 주면 검찰에 말해 형을 낮춰주겠다'고 말했다 한다.하지만 하씨는 당장 300만 원을 마련할 여력이 없었다. 결국 하씨는 약식기소가 됐고, 지난해(2020년) 10월 벌금 20만 원의 약식명령을 받았다. 검사는 하씨에게 내려진 벌금형이 너무 낮다며 정식재판을 청구했고, 그 결과 하씨는 이날 재판을 포함해 총 두 번의 법적 판단을 받게 됐다.'선고 유예'의 이유이날 재판부는 하씨 행동의 위법성을 일부 인정하면서도 하씨에게 범행의 고의가 없다고 봤다. 먼저 재판부는 피해자와 전화가 연결된 순간까지도 후문을 이용해 배송한 사실을 알리지 않았던 점은 문제가 있다고 봤다.또한, 하씨가 공동현관 비밀번호를 고지받은 직후 다시 뒷문으로 들어가 배송지를 변경한 행동 자체에 스스로가 미필적으로나마 위법성을 인식하고 있었다고 봤다. 비밀번호를 알고 난 후, 마치 처음부터 공동현관을 거쳐 미용실 정문 앞에 물품을 배송한 것처럼 정정했기 때문이다.다만 재판부는 하씨의 행동에 배달 외의 목적으로 미용실을 침입했다고 볼 정황이 없다고 판단했다. 재판부는 ""당시 피고인(하씨)은 이미 피해자에게 전화 연락을 시도한 상태였고, 미용실 내부에 배송물품을 두고 나와서 이 사건 미용실 내부에 진입한 게 피고인이었음을 누구라도 쉽게 알 수 있었던 상황""이라며 ""범행 경위와 범행 시각 등을 고려해도 피고인이 위법성 인식이 다소 미약한 상태에서 이 사건 범행을 한 것으로 보인다""고 밝혔다.이밖에도 피해자로부터 용서를 받지 못했으나 사과 의사를 재차 표시한 점, 피해자가 요구한 보상금 300만 원을 마련하지 못해 합의에 이르지 못한 점도하씨의 정상으로 고려됐다.재판부는 이러한 점을 종합해 ""(하씨에게 벌금 20만 원 선고한) 약식명령보다 더 가벼운 판결을 선고한다""면서 선고 유예 판결을 내렸다.판결 직후 취재진과 만난 하씨는 ""원래 검사가 청구한 금액이 50만 원이었다. 이것에 대한 선고유예가 나온 거라 따로 불복할 생각은 없다""고 밝혔다. 피해자와의 추가 연락에 대해서는 앞서 300만 원의 합의금에 대한 문자를 주고 받은 것 외에는 닿은 바가 없다고 했다.그는 이 사건 발생 후 택배노동자 업무를 그만두게 됐다고 했다. 하씨는 ""저희 택배노동자들은 대부분 개인사업자다. 회사는 이런 우리에게 일만 줄 뿐, 아무것도 책임져주지 않는다""라며 ""물건을 잃어버려도, 고객이 주소를 잘못 적어줘서 배송을 잘못해도 모든 게 택배노동자의 잘못이 되는 그런 상황이다""라고 덧붙였다.저작권자(c) 오마이뉴스(시민기자), 무단 전재 및 재배포 금지▶오마이뉴스 '시리즈'에서 연재하세요!▶이재명 경기도지사 추천 《이재명과 기본소득》▶오마이뉴스 취재 후원하기"
"용혜인 기본소득당 의원이 지난해 10월19일 오전 서울 여의도 국회에서 기자회견에 참석하고 있다. 뉴스1           초선 용혜인 기본소득당 의원이 임종석 전 청와대 비서실장을 향해 직격타를 날렸다. 용 의원은 “임 전 실장의 공정과 정의는 무엇인가”라며 “정치는 ‘형님·동생’하는 친소관계에서 이뤄지는 일이 아닌, 국민과 나라의 미래를 그리는 일이어야 한다”고 했다.용 의원은 9일 자신의 소셜네트워크서비스(SNS)에 “대권 주자들의 기본소득에 대한 논평들이 연일 쏟아져 나오면서 기본소득이 다시 뜨거운 이슈로 등장하고 있다”며 글을 올렸다.      임 전 실장은 앞서 자신의 SNS를 통해 이재명 경기지사의 기본소득 지급 주장을 언급하면서 “여전히 기본소득이라는 아이디어가 지금 우리 현실에서 공정하고 정의롭냐는 문제의식을 떨칠 수가 없다”고 했다.      이와 관련해 용 의원은 “기본소득은 공동의 부에 대한 사회 구성원들의 권리”라며 “공정과 정의에 대한 이야기일 수밖에 없다”고 강조했다.      이어 “기본소득은 한 사회가 자연으로부터, 혹은 이전 세대로부터 물려받은 공통의 재산, 공통부에 대해 배당받을 권리”라며 “기본소득은 키 작은 사람들에게 발 받침대를 놓아주는 것이 아닌 담장을 허물자고 얘기하는 것”이라고 짚었다.      용 의원은 기본소득과 관련해서 ▶월간 생계비 지급 ▶월 50만원은 생계비에 터무니없이 부족 ▶스위스 국민 투표 등 임 전 실장이 SNS에 밝힌 내용에 대해 조목조목 반박하기도 했다.      아울러 정치인의 태도와 관련해 “정치는 형님·동생 하는 친소 관계에서 이뤄지는 일이 아닌, 국민과 나라의 미래를 그리는 일이어야 한다”며 “태도에 대한 이야기가 합리적 대화를 막는 언어가 되지 않기를 바란다”고 지적했다.      나운채 기자"
"[파업 참가기] 국민건강보험 고객센터 상담원이 파업하는 이유[장현경 기자]""고객님, 차후 설문 조사 시 매우 만족 5점 부탁드립니다.""국민건강보험 고객센터는 3년 연속 '공공기관 고객 만족도 우수기관', 8년 연속 '서비스품질 지수 우수기관(KSQI)', 7년 연속 '한국 고객센터 품질지수 우수 컨텍센터(KS-CQI)'에 선정됐다. 우수 고객센터라는 타이틀은 꼬리 칸에서 열심히 일한 하청 상담 노동자들의 땀과 눈물, 헌신과 희생 덕에 유지될 수 있었다.3개월에 한 번 만족도 조사 기간이 오면 상담사들은 더욱 힘들어진다. 만족도 조사 점수가 도급사 평가 기준에서 높은 비중을 차지하다 보니 공단에 잘 보이기 위해 전국 11개 도급업체는 경쟁적으로 상담사를 몰아붙인다.""제 상담에 매우 만족하셨는지 모르겠습니다. (고객 반응 몇 초 기다리기) 추후 만족도 조사 시 매우 만족, 5점 부탁드립니다""라는 종료 인사를 강제하고, 고객이 만족했다고 대답하면 가점을 준다.운이 좋아 '친절하시네요'라는 답변을 들으면 만 원씩 주는 프로모션을 진행하기도 하고, 친절을 많이 받은 순서대로 명품을 주는 프로모션을 진행하기도 했다. 말 그대로샤넬 립스틱, 에르메스 향수 등을 총 19명한테 지급하는 프로모션이었다.책상 앞에 붙은 옐로카드             ▲ 1월 27일 오전 서울 중구 민주노총 대회의실에서 열린 '공공운수노조 국민건강보험고객센터지부 총파업투쟁 선포 기자회견'에서 한 상담노동자가 눈물을 흘리고 있다.            ⓒ 연합뉴스  건강보험에 전화해본 가입자들은 알겠지만 상담원과 연결이 되면 제일 먼저 하는 말이 '겨우 연결됐다', '로또 당첨됐다' 할 정도로 대기시간이 길다.전화를 받다 보면 전산화면에 고객이 몇 분 대기했는지가 나오는데 7~8분 대기는 기본이고 10분 이상 대기하는 경우도 빈번하다. 장시간 대기하다가 겨우 연결된 고객을 2분 30초 만에 만족시키는 게 과연 가능한 일인지 의문이 든다.쓸데없는 멘트로 대기 시간을 늘어나게 할 것이 아니라 간단하고 명료하고 정확하게 상담해서 전화 연결이 빨리 되게 하는 게 '만족'일 것이다. 그렇지만 콜센터 전문 인력만 키우는 회사는 아직도 1990년대 방식으로 고객센터를 운영한다.건강보험은 통신사, 카드사처럼 본인이 사용한 금액만 납부하면 되는 게 아니라 누구나 예외 없이 납부하는 사회보험료이기 때문에 제도불만, 부과불만, 징수불만 등 항의 민원이 많다. 상담사도 사람인지라 불만 민원 전화에 '5점 매우 만족' 부탁드린다고는 도저히 입이 떨어지지 않는다.만족도 인사를 누락하면 다음 날 책상에 옐로카드가 부착되어 있다. 옐로카드를 받았는데도 인사를 누락하면 '친절'이라고 적힌 완장을 차고 근무하게 한다. 또한 출근시간 엘리베이터 앞에서 엘리베이터 문이 열릴 때마다 '친절하겠습니다'라고 외치며 인사를 하게 했다. 당시를 회상하면 동료들은 수치심과 모욕감을 느낀다고 했다.얼마 전 ""건보공단 고객센터 업무를 맡은 상담사들은 우리가 시간과 비용을 들여 키운 회사의 자산""이라는 민간위탁 업체 관계자의 인터뷰 기사를 보고 우리는 실소를 금할 수 없었다. 그들은 2년이 지나면 수고했다는 인사도 없이 뒤도 안 돌아 보고 떠나가지만, 상담사는 그 자리에 남아 다음 2년 동안 우리를 핍박할 업체는 어디일까를 생각한다.10년을 일해도 2년마다 한 번씩 회사가 바뀌니 본인들 회사에는 신입이라 최저임금밖에 줄 수 없다고 하고, 용역비 사용 내역을 공개해 달라 하니 기업 비밀이라고 하는 그들은 우리가 '소중한 자산'이라고 한다. 사람장사하며 중간착취에만 급급하니 상담노동자를 회사의 가족이 아닌 자산으로 보는 게 당연한 논리인 것 같기도 하다.일터로 돌아가고 싶습니다             ▲ 1일 강원 원주시 국민건강보험공단 앞에서 건보 고객센터 노조 조합원들이 파업에 돌입하면서 임금인상 등 처우개선과 직영화를 요구하고 있다. 전국 국민건강보험공단 고객센터 11곳의 조합원은 이날부터 동시에 파업에 돌입했다. 공단은 민간위탁 방식으로 고객센터를 운영하고 있으며, 고객센터 근로자는 공단 협력업체 직원이다.            ⓒ 연합뉴스  우리의 생애 첫 파업이 이제 2주째로 접어든다. 우리 상담 노동자들은 무엇보다 사회의 시선과 비판적 여론에 상처받고 괴로워하고 있다. 정상적인 고용관계가 아니라는 게 뻔히 보이는 데 아무 목소리도 내지 않고 침묵하는 것이 과연 공정한 사회인 걸까? 2년마다 바뀌는 사기업 정규직임을 알고, 최저임금인 걸 알고 입사했으면 10년이 지나도, 20년이 지나도 순응하며 사는 사회가 올바른 걸까.우리가 요구하는 건 공단 정규직과 동일한 대우가 아니다. 부당한 노동환경에 대한 변화를 요구한다. '고객센터 상담사가 어려운 경쟁을 뚫고 입사한 정규직 직원과 동일한 대우를 바라느냐', '시험 쳐서 들어오면 될 것이지 떼쓴다고 될 일이냐'라며 몰상식하고 파렴치한 사람으로 취급당하며 15년 동안 묵묵히 일해온 삶까지 폄하 당하고 있다.2년짜리 민간위탁 직원이 아닌 15년 동안 같은 자리에서 공단업무를 '상시·지속적'으로 해온 우리를 공단이 더는 외면하지 말고 진짜 사장이 되어 ""직접고용""해 달라는 것이다.오늘도 전국에 흩어진 고객센터 상담사들은 원주 건강보험공단 본부 앞에 모여 '시키면 시키는 대로 당하지 않을 것'이며 '기계 취급이 아닌 인간으로대해 달라'고 외치고 있다. 최저임금을 받는 생계형 노동자인 우리가 무노동 무임금 파업을 결정하고 차가운 겨울 길바닥에 앉아 있다. '오죽했으면'이라는 따뜻한 시선과 사회적 공감대를 기대하는 게 정말 과한 욕심이고 요구인지 묻고 싶다.우리는 첫인사만 함께하는 건강보험 상담사가 아닌 진정 함께하는 건강보험 상담사가 되어 하루빨리 우리의 일터로 돌아가길 원하고 있다.저작권자(c) 오마이뉴스(시민기자), 무단 전재 및 재배포 금지▶오마이뉴스 '시리즈'에서 연재하세요!▶이재명 경기도지사 추천 《이재명과 기본소득》▶오마이뉴스 취재 후원하기"
"명분과 의지만으로 정책 추진안 돼…타당성 현실성 구체성결여되면 위험해질 수 있어복지정책은 불가역적 성격한번 맛 들이면 끊기 힘들어남미의 전철을 밟을 것인가빚을 내고 그 빚을 갚기 위해빚을 낸다면 미래세대의부담이자 국가 재앙 될 수도갈수록 태산이다. 여권에서 당근을 내놓자, 야권은 소스까지 곁들였다. 선별복지든 보편복지든 좋다. 코로나로 생존위기에 몰린 서민을 위하고 침체된 경제를 살려야 한다는 명분도 있다. 정부와 정치권의 책임이자 존재 이유이기도 하다. 한데 타당성과 현실성, 구체성이 결여된 명분은 위험하다. 국가정책이라면 더 그렇다. 선물이란 가슴 따스하게 하지만 여야 정치권에서 내놓고 있는 각종 정책은 되레 가슴을 답답하게 만든다.이낙연 더불어민주당 대표는 얼마 전 ‘국민생활기준 2030’이라는 신복지정책을 제시했다. 핵심은 18세까지 아동수당을 주고, 아파 쉬는 국민에게 ‘상병수당’을 지급하겠다는 것이다. 홍남기 부총리 겸 기획재정부 장관이 “재정은 화수분이 아니다”라고 치받았다. 안일환 기획재정부 제2차관도 ‘악어입’을 언급하며 재정적자를 우려했다. “오죽했으면 여당 대표의 말에 반기를 들었겠느냐”고 역성드는 사람이 꽤 있다. 하지만 ‘소심한 반항’으로 보는 시각도 적지 않다. 당랑거철(螳螂拒轍)이라고 폄훼하는 목소리도 들린다. 사마귀가 수레를 막는 것처럼 무모하다는 것이다. 정부 곳간지기로서 고민을 이해 못할 바 아니지만 전적으로 홍 부총리의 자업자득이다. 기본소득제와 보편복지를 골자로 한 이재명 경기도지사의 정책에 대한 논란은 더 뜨겁다. 여권 내에서도 찬반이 교차한다. 의도는 좋으나 무책임하다는 견해가 있는 반면 새로운 복지 패러다임이라는 평가도 존재한다. 엇갈린 평가의 이면에는 인간적 호오(好惡)에 기인하는 측면도 있다. 최종적으로 어떤 평가를 받을지는 이 지사 몫이다.더 한심한 것은 여당이 가덕도신공항을 내놓자 야당은 해저터널까지 더했다는 점이다. 예비타당성조사 면제는 물론 사업비 산정도 하지 않았는데 특별법부터 만들어 대못을 박을 태세다. 이유에 대해선 굳이 말하지 않아도 국민들은 다 안다. 정책 자체의 옳고 그름은 전문가 영역이니 거론 않겠다. 텃밭 만들 때도 이렇게 하진 않는다. 분명한 것은 보궐선거든 대선이든 각 후보는 경쟁적으로 장밋빛 복지정책을 쏟아낼 것이 뻔하다. 지난 총선에서 그 위력을 확인한 바이다. 목숨이 경각인데 이것저것 따지다간 죽음에 이를 수 있다는 주장도 틀린 건 아니다. 최소한의 국민생명권을 지켜야 한다는 당위 역시 옳다. 그러나 준비 없는 선의 또는 당위론에 강요된 정책은 좋은 결과를 담보하지 못한다. 비정규직 대책이 오히려 비정규직을 양산했던 것이나 전세계약갱신청구권 부작용 사례가 말해준다. 복지정책은 불가역적 성격을 지닌다. 한번 맛 들이면 끊기 힘들다. 베네수엘라를 비롯해 일부 남미 국가 사례는 많은 점을 시사한다.다시 우리나라로 돌아와 보자. 정치권이 제시하는 정책 자체를 비난할 생각은 없다. 방향도 맞고, 당위론에선 옳다. 긴급할 때 재정의 역할이 중요하다는 주장도 일리 있다. 다만 빚을 내고 그 빚을 갚기 위해 또 빚을 내야 한다면 빚이 눈덩이처럼 커지는 건 불문가지다. 마냥 박수만 칠 수 없는 이유다. 2000년대 초반 카드대란 사태가 기억에 선명하다. 카드빚 갚기 위해 이 카드 저 카드로 돌려막다가 수백만명이 신용불량자로 전락했고, 경제·사회적으로 큰 혼란을 겪지 않았던가. 단순하게 말하면 외환위기도 이 지점에서 잉태됐다.나라 살림과 집안 살림에 근본적인 차이는 없다. 버는 만큼 쓰는 게 기본이다. 물론 빚도 낸다. 여기까지는 정부나 개인이나 비슷하다. 집안 살림은 버는 사람과 쓰는 사람, 갚는 사람이 대체로 같다. 반면 나라 살림은 버는 사람(국민), 쓰는 사람(정부), 갚는 사람이 다르다. 미래세대 짐으로 남기도 한다. 이 때문에 무책임과 모럴해저드가 생긴다. 그 누구도 코로나를 예상하지 못했던 것처럼 앞으로 이와 유사한 사태가 벌어지지 않는다고 장담할 수 있는가. 그땐 어찌할 것인가?등 따습고 배부른 걸 누가 마다하겠는가. 비상상황에선 비상한 대책이 필요한 것도 인정한다. 관건은 재원이다. 올해 본예산은 558조원이다. 이 중 93조원 넘는 돈이 빚, 즉 적자 국채다. 여기에 3차례 재난지원금으로 31조원 이상이 풀렸는데 4차 재난지원금을 준비 중이다. 확정된 것은 아니지만 20조원 이상이 될 것이라고 한다. 국가채무는 950조원을 넘었다. 그래서 하는 제안인데 불요불급한 사업은 미루고, 빚을 내기 전에 대규모 세출 조정부터 하자. 그래도 부족하면 증세를 검토하는 게 옳다. 내년에 있을 대선에서 내 한 표의 기준임을 미리 밝혀둔다.편집인"
"[문체부장관 인사청문회] ""무용 전공자 아내, 미국 오디션 탈락... 편법비자 아니었다""[곽우신 기자]        ▲ 황희 문화체육관광부 장관 후보자가 9일 국회 문화체육관광위원회에서 열린 인사청문회에 참석해 마스크를 만지고 있다.            ⓒ 공동취재사진  ""딸은 알링턴에서 차상위계층 아이들이 다니는 공립학교에 무료로 다녔다.""황희 문화체육관광부 장관 후보자가 9일 오후 인사청문회에서 본인 자녀의 조기 유학 의혹에 대해 적극 해명했다. 오전부터 이어진 생활비 논란의 연장선상이었다(관련 기사:황희, '한달 생활비 60만원' 논란에 ""실제는 300만원"" 해명).황희 후보자의 배우자와 딸은 2011년부터 2016년까지 미국에서 유학 생활을 했다. 당시 황 후보자의 수입에 비해 과도한 액수가 송금됐다는 지적이 나오며 유학 자금을 어디서 어떻게 마련했는지를 두고 공방이 계속 오갔다. 특히 황 후보자의 배우자는 학생비자인 F1 비자를 발급 받았는데, 자녀의 조기 유학비용을 절약하기 위해 일부러 편법을 활용했다는 의혹도 제기됐다.황 후보자는 ""와이프는 한국예술종합학교에서 학사·석사를 취득했다. 아마 예술사 전문사일 것""이라며 ""무용을 전공하기 때문에 F1 비자를 받고 뉴욕대학교 티쉬스쿨과 보스턴 스미스 칼리지에 오디션을 보러 갔다""라고 해명했다. 그는 ""그런데 잘 안 됐다. 갔다가 오디션에서 탈락했다""라고 설명했다. 유학비용 절약 목적이 아니라 실제로 배우자의 학업을 위해 학생비자를 받았던 것이라는 취지였다.유학비용에 대해 황희 후보자는 ""당시 국회의원도 아니어서 개인적으로 상당히 어렵고 힘든 시기였다""라며 ""최소한 월 250만~350만 원 정도는 배우자와 딸에게 보내주겠다고 약속했다""라고 말했다. 조달에 대해서도 ""당시 한 1억4000만 원정도 되는 전셋집이 있었다. 거기에서 제가 한 7000만 원, 와이프가 7000만 원 이렇게 해서 비용을 나눴다""라고 설명했다. 또한 ""배우자의 친언니가 바로 (보스턴의) 앞집에 살았다. 뉴욕에 제 여동생도 살고 있었다""라며 ""그래서 이런저런 도움도 많이 받았다""라고 해명했다. 또한 자녀와 관련해서도 ""아이를 학교에 보내기 위해서 (미국에) 간 것은 절대 아니다""라고 강조했다. 그는 ""보스턴 인근 알링턴에 차상위 계층 아이들이 다니는 공립학교가 있다""라며 ""거기에 무료로 다닐 수 있다고 해서 다닌 것""이라고 설명했다. 이어 ""아마 아이를 위해서 유학을 보냈으면, 그 학교를 보내지 않지 않았을까 그리고 그다음에 굳이 한국에 들어오지 않지 않았을까 이렇게 조심스럽게 말씀드린다""라고 덧붙였다.황 후보자는 이후 도종환 위원장이해당 학교의 이름을 묻자, 미국 알링턴에 자리한 톰프슨 초등학교(Thompson Elementary School)였다고 답했다.황 후보자의 딸은 귀국 후 자율형사립고등학교에 다니다 외국인학교로 진학했다. 해당 학교가 한해 수천만 원의 학비가 소요되는 학교인 게 드러나 황 후보자 역시 비판을 받고 있다(관련 기사:황희 딸 학교의 설립 취지는? 또 다른 '내로남불').저작권자(c) 오마이뉴스(시민기자), 무단 전재 및 재배포 금지▶오마이뉴스 '시리즈'에서 연재하세요!▶이재명 경기도지사 추천 《이재명과 기본소득》▶오마이뉴스 취재 후원하기"
