이,재,명
"국민의힘 나경원 서울시장 보궐선거 경선후보가 25일 서울 영등포구 여의도 희망22 사무실에서 유승민 전 의원을 만나고 있다. 연합뉴스유승민 전 미래통합당 의원이 2일 정부와 이재명 경기도지사에 대한 작심 비판을 쏟아냈다. 유 전 의원은 특히 문재인 대통령과 이재명 경기지사를 향해 각각 '돈 쓰는 데 귀신', '돈 먹는 공룡'이라고 했다.유 전 의원은 ""선거가 가까워지자 문재인 대통령과 더불어민주당 대선후보들의 악성 포퓰리즘이 기승을 부리고 있다""며 ""이들의 공통점은 돈 쓰는 데는 귀신이라는 것""이라고 했다.이어 ""대통령과 민주당은 예비타당성조사와 입지의 적정성조사도 생략한 채 28조원이 든다는 가덕도신공항특별법을 통과시켰다""며 ""앞으로 대구와 광주 등에서 도심의 기존 공항은 김해공항처럼 그대로 남겨두고 외곽에 새 공항을 전액 국비로 건설해달라고 요구하면 정부가 할 말이 없을 것이다. 선거에 정신이 팔려 국책사업의 원칙을 무너뜨린 대가를 톡톡히 치르게 될 것""이라고 날을 세웠다.또 ""이재명 지사의 기본시리즈는 돈 먹는 공룡""이라며 ""현재의 복지제도만으로도 앞으로 엄청난 돈이 필요한데, 기존의 복지를 그대로 하면서 기본소득을 얹어주려면 그 돈은 하늘에서 떨어지는가""라고 말했다.그는 기본주택론에 대해 ""지금 저소득층에게 인간답게 살 공공임대를 공급하는 것도 돈이 부족한데, 중산층까지 30년간 저렴한 임대료로 살 기본주택을 공급한다니 그 엄청난 손실을 무슨 돈으로 감당하겠는가""라고 지적했다.그러면서 ""자신들도 재정적자와 국가부채가 심하다고 생각했는지 말로는 증세를 얘기하지만, 선거를 앞두고 그들이 증세를 할 가능성은 제로""라며 ""또 증세에는 반드시 국민적 합의가 먼저 이루어져야 하고, 더구나 지금처럼 경제가 위기상황일 때는 증세가 옳은 선택이 아니다""라고 주장했다.유 전 의원은 ""나라살림을 책임진 정부가 나라야 망하든 말든 돈 쓰는 데는 귀신이고 돈 버는 데는 등신이라면, 그 나라의 앞날은 파탄 뿐""이라고 질타했다.이어 ""국민은 성장의 가치를 알고 있다""며 ""저성장, 저출산, 양극화라는 삼중의 문제를 극복하는 것은 우리 시대의 과제다. 그 해결의 출발점은 바로 경제성장""이라고 강조했다.또 ""경제성장부터 일으켜서 일자리와 소득을 만든 다음에 저출산과 양극화를 해소하는 게 올바른 순서다. 이 중요한 일을 다음 대통령과 정부가 해내야만 한다""며 ""국민의 건전한 상식이 살아있기 때문에 새로운 보수정치는 국민만 믿고 경제성장을 위한 개혁의 길로 용감하게 나아가야 한다""고 부연했다.마지막으로 유 전 의원은 ""우리가 그 정답을 알고 있지만 역대 어느 정부도 제대로 하지 못한 노동개혁, 규제개혁, 교육개혁을 단행할 리더십이 필요하다""며 ""이것만이 민주당과 엉터리 진보세력의 악성 포퓰리즘에 대항하는 정공법임을 분명히 인식하자""고 강조했다.장성혁 기자"
"양산 부산대병원 '영남권역 예방접종센터 모의훈련' 참관[윤성효 기자]        ▲ 2일 양산부산대병원에서 진행된 ‘코로나19 영남권역 예방접종센터 모의훈련’.            ⓒ 경남도청               ▲ 2일 양산부산대병원에서 진행된 ‘코로나19 영남권역 예방접종센터 모의훈련’.            ⓒ 경남도청  김경수 경남지사는 지사 '코로나19 영남권역 예방접종센터 모의훈련'을 참관하면서 ""코로나19 극복의 마지막 고비""라며 ""준비 철저히 돼 있어 안심하고, 백신 접종에 적극 참여를 부탁드린다""고 했다.김 지사는 2일 오후 코로나19 영남권역 예방접종센터가 설치된 양산부산대학교병원을 방문해 김대성 양산부산대학교병원장으로부터 준비상황 전반에 대해 설명을 듣고 백신 접종 구역, 보관 관리, 이동 동선, 시설물 배치 등을 점검했다.이어 진행된 모의훈련에는 김 지사를 비롯해 영남권역 5개 시도와 시군 예방접종 담당자 등 50여 명이 참여했다.훈련은 백신 접종 준비 단계부터 시작됐다. 먼저, 백신 준비 상태를 점검한 후 초저온 냉동고 백신 보관과 해동, 희석 등 접종 준비과정을 점검했다.다음으로 접종 대상자 확인과 예진표 작성, 예진, 접종과 접종 후 이상반응 관찰이 이어졌다. 마지막으로 이상 반응이 발생하는 경우를 대비한 처치까지 실제와 유사한 상황을 가정해 실시됐다.경남도는 이번 모의훈련 결과를 바탕으로 개선방안 등을 마련해 3월부터 순차적으로 지역접종센터를 설치, 운영할 방침이다.김 지사는 모의훈련 점검 후 ""백신 접종이 코로나 극복의 마지막 고비""라며 ""오늘 돌아보니 백신의 보관, 접종과정에 대한 관리까지 철저하게 준비가 돼 있어 안심이 된다""고 말했다.김 지사는 ""도민들께서 백신 접종 시기가 되면 적극적으로 참여해주셔서 코로나가 빨리 종식될 수 있도록 협조해주시기를 부탁드린다""며 당부의 말을 전했다.양산부산대학교병원은 지난 1월 29일 코로나19 영남권역 예방접종센터로 지정됐다. 그동안 화이자 백신을 보관할 수 있는 초저온냉동고를 설치하고 의사 4명을 포함한 총 29명의 접종인력을 확보하는 등 접종센터 설치와 운영을 위한 준비를 차질 없이 진행해왔다.경남도는 2월 26일부터 시작된 요양병원·요양시설의 입원·입소자와 종사자에 이어, 3~6일 사이 추가 백신이 배송되면 고위험 의료기관인 상급·종합병원·병원급 의료기관 보건의료인에 대한 접종도 시작된다.             ▲ 2일 양산부산대병원에서 진행된 ‘코로나19 영남권역 예방접종센터 모의훈련’.            ⓒ 경남도청               ▲ 2일 양산부산대병원에서 진행된 ‘코로나19 영남권역 예방접종센터 모의훈련’.            ⓒ 경남도청               ▲ 2일 양산부산대병원에서 진행된 ‘코로나19 영남권역 예방접종센터 모의훈련’.            ⓒ 경남도청  저작권자(c) 오마이뉴스(시민기자), 무단 전재 및 재배포 금지▶오마이뉴스 '시리즈'에서 연재하세요!▶이재명 경기도지사 추천 《이재명과 기본소득》▶오마이뉴스 취재 후원하기"
"이재명 경기도지사(왼쪽 네 번째)는 2일 오후 경기도청 상황실에서 개인형이동수단의 안전한 이용환경 조성을 위한 관계기관·PM공유업체 업무협약을 체결하고 참석자들과 기념촬영했다.'개인형 이동수단(PM)'의 안전이용 환경조성과 올바른 이용문화 확산을 위한 경기도 차원의 민관 협력체계가 만들어졌다.이재명 지사는 2일 오후 경기도청 상황실에서 이재정 경기도 교육감, 곽상욱 경기도시장군수협의회장, 김원준 경기도남부경찰청장, 우종수 경기도북부경찰청장, 이주민 도로교통공단 이사장, PM공유사업자 13개사와 이 같은 내용의 '개인형이동수단의 안전한 이용환경 조성을 위한 관계기관·PM공유업체 업무협약'을 체결했다.이번 협약은 전동 킥보드 등 PM의 이용활성화를 도모하고 안전·편리한 이용환경을 조성하고자 지난해 12월 발표한 '안전하고 편리한 개인형 이동수단 이용환경 조성을 위한 경기도 추진전략'을 체계적으로 추진하기 위한 후속조치의 일환이다.협약기관들은 안전이용 문화의 체계적 정착·확산과 신교통수단으로서의 PM이 연착륙되도록 다양한 방안을 마련해 추진하기로 합의했다.우선 도는 '편의·안전을 고려한 PM주행도로 조성 및 안전이용지침 마련 및 배포' '시범지구 선정 및 전용 주차장 조성지원' '주차장 표준디자인 및 실시설계 가이드라인 제작·보급' '안전홍보 콘텐츠 제작·보급 및 교육' 등 전체적인 컨트롤타워 역할을 수행한다.각 시군은 'PM 이용 자전거도로 조성' '안전시설 정비' 'PM 전용주차장 설치 및 관리' 등을 담당하고, 도 교육청은 학생 대상 안전교육 실시와 안전 홍보자료 보급에 적극 협력하기로 했다.남·북부경찰청은 위법행위에 대한 계도 및 단속에 주력하고, 도로교통공단은 PM운행현황 및 안전사고 관련 연구결과를 유관기관과 공유하는 것은 물론, 관련 교육자료를 개발·보급하는데 힘쓰게 된다.공유사업자들은 강화된 도로교통법을 시행하는 5월 전까지 원동기면허 이상 운전면허 소지자에 한해서만 PM을 대여하기로 약속했다. 아울러 이용자 보호 요건 갖춘 보험 가입, 가이드라인에 따른 구역 내 기기 반납 유도, 공유PM플랫폼에 안전홍보영상 및 전용주차장 위치 표출을 통한 안전이용 문화 확산 등에도 협력한다.향후 도는 협약기관들이 참여하는 'PM안전협의회'를 구성·운영해 협약에서 정한 사업들이 계획대록 추진되도록 힘쓸 방침이다.이재명 지사는 이날 “그간 전통적 의미로 자동차가 수송의 중심수단이었다면 이제는 기술혁명에 맞춰 PM이 대세가 될 것으로 전망된다”며 “도심 교통난 해결과 사람들의 삶을 조금 더 쾌적하게 만드는 수단이 될 것”이라고 말했다.김정희기자 "
"[신소영의 사소하지 않은 수다] 의사면허 취소에 관한 의료법 개정안 처리 과정을 보며[신소영 기자]한 30년 전쯤(너무 오래된 일이지만, 기억은 뚜렸하다), 몸이 너무 아파서 병원에 갔을 때였다. 평소 다니던 곳은 아니었지만, 밤새 열이 너무 심하게 나서 가까운 병원을 찾은 터였다. 의사선생님께 말했더니 뒤를 돌아보라고 했다. 옆구리 쪽을 살짝 툭툭 치는데도 아팠다. 그제야 감기가 아니라는 생각이 들었다.그런데 그때였다. 옷을 내리려는데 갑자기 등을 쓰다듬는 의사의 손길이 느껴졌다. 순간 소름이 돋았다. 진료와는 아무런 상관이 없는 행위였기 때문이다. 너무나 갑작스럽게 일어난 일이었던 데다가, 내가 당황한 틈에 ""신우신염이네요""라고 진단하며 자세히 설명을 이어가서 상황은 그렇게 유야무야되었다. 그 의사는 속으로 '자연스러웠어'라고 했으려나.내가 민감하게 느낀 건가. 아픈 와중에도 그렇게 스스로 상황을 합리화했고, 내 병명은 알았으니 그것으로 됐다면서 무마했다. 그러나 희롱당한 것 같은 불쾌하고 수치스러운 감정은 지워지지 않았고(지금까지도!) 다시는 그 병원에 가지 않았다.불쾌했던 진료의 기억들            ⓒ elements.envato  한동안 잊고 지내다가 10년 전쯤, 하지정맥 때문에 외과에 방문했을 때였다(이때의 기억도 아직 뚜렸하다). 당시로부터 20년 전, 그날의 기억이 떠오르는 일을 또 겪었다.의사는 하지정맥을 검사한다고 자기 앞에 놓인 높은 의자에 올라가라고 했다. 그리고는 하지정맥이 있는 곳을 체크하더니, 됐다고 말함과 동시에 내 오금 안쪽을 스윽 만졌다. 순간, 20여년 전 느꼈던 당혹스러움과 불쾌함이 고스란히 소환되었다.그러고는 아무 일 없다는 듯이 진단하고 수술 이야기를 하는 의사를 보며, 혼란스러웠다. 어떻게든 대응 하고 싶었지만, 진료시 일어난 일이기도 하고 너무 기습적으로 당하다 보면 몸도 머리도 멈춰버린다. 뒤늦게 내가 한 대응이라고는, 병원 측에 담당 의사를 바꿔달라고 한 것뿐이었다.여기까지 읽고 내가 너무 민감한 거 아니냐고 물을지 모르겠다. 그러나 수많은 병원을 다니고 촉진을 받으면서 내 몸을 진료를 위해 만지는 것과 아닌 마음으로 만지는 건 분명하게 구분이 가능하다.의사에게서 받은 이 두 번의 불쾌한 경험은 트라우마처럼 남았다. 몸을 쓰다듬는 행위도 이렇게 끔찍한데 더한 일을 겪은 사람들은 어떨까. 거기까지 생각이 미치면 아찔하다. 물론 이런 의사보다 좋은 의사들을 훨씬 더 많이 만난다. 그럼에도 나에게 이런 트라우마를 남긴 두 의사를 소환한 이유는, 요즘 화두가 되고 있는 의료법 개정 때문이다.과잉처벌 우려로 본회의에 오르지 못한 의료법 개정안             ▲ 23일 오후 서울 용산구 의사협회 임시회관 앞.의협은 금고 이상의 형을 받은 의사의 면허를 취소하는 내용의 의료법 개정안이 국회 보건복지위원회를 통과한 다음 날인 지난 20일 성명을 내고 개정안이 법사위를 통과할 경우 총파업을 하겠다고 밝혔다.             ⓒ 연합뉴스   지난달 19일 국회 보건복지위원회를 통과한 의료법 개정안은 '범죄를 저지르고 금고형 이상의 선고를 받으면 의사면허를 취소하는 법안'인데, 이를 의사협회가 반대하고 있다고 한다.언론보도에 따르면 이 개정안은 '실형을 선고받으면 출소 뒤 5년간, 집행유예인 경우에는 유예기간 종료 뒤 2년간 의사면허를 취소하는 것'이 주요 내용이다.내가 주목한 부분은 성범죄 부분이다.23일 경찰청 발표를 보면,2015년~2019년까지 강간 및 강제추행 혐의로 입건된 의사 수가 매년 세 자릿수로, 의사 성범죄가 계속 증가하는 추세다. 구체적으로 2015년 102명, 2016년 118명, 2017년 121명, 2018년 136명, 2019년 136명이라고 밝혔다. 5년간 613건으로 변호사의 15배라고 한다. 상황이 이런데도 의사협회는강력범죄 금고 이상의 형에도 '의사 면허 취소와 재발급을 의사들이 자체적으로 결정하겠다'는 것이다.결국 의료법 개정은 야당에서 과잉처벌이 우려된다는 이유로 반대, 국회 본회의에 오르지 못했다. 의료행위와 무관한 범죄까지 면허 취소 사유로 삼는 것은 과도하다는 것이다. 민주당 측은 과감한 진료행위를 위해서 의료행위가 수반되는 업무상 과실 치상, 치사는 면호 취소 사유에서 제외했다고 반박했지만, 합의점을 찾는데 실패했다.3월 임시국회에서 본격적인 논의가 이루어질 예정이라고 하는데, 양당 모두 진짜 의지가 있는지 궁금하다.성범죄 의사가 생명을 다룰 자격 있을까             ▲ tvN 슬기로운 의사생활 중 한 장면.             ⓒ tvN  의사는 생명을 다루는 전문직으로 직업 윤리가 더더욱 필요한 직종이다. <슬기로운 의사생활>이라는 드라마에 나오는 의사들을 보면서 많은 사람들이 '판타지'라고 여긴 것은 현실에선 그렇게 친절하고 인간적인 의사를 접하기가 쉽지 않았기때문일 거다.그 정도까지 바라는 건 아니다. 다만, 몸이 아파서 찾아간 환자를 대상으로 성범죄를 저지르는 건 그 일을 할 자격이 없다는 말을 하려는 거다. 피해자 입장에서는 평생마음의 병까지 생기게 하는 일이므로.한편에선 안 그런 의사들도 많은데 잠재적 범죄자 취급을 하냐는 말도 들린다. 자기 집단 구성원에게 불리한 법안이 나올 때마다 듣는 말이다. 나는 오히려 그들에게 묻고 싶다. 그런 논리라면 지금 우리나라의 모든 법이 국민 모두를 잠재적 범죄자로 취급해서 나온 법안인지 말이다.죄를 지은 만큼 벌을 받는 게 왜 잠재적 범죄자 취급을 하는 것인지 이해할 수가 없다. 애초에 벌 받을 일을 하지 않으면 면허를 박탈당할 일도 없는 건데 말이다. 오히려 법은 환자 입장에서는 예방적 기능을 수행할 수 있고, 의사 입장에서는 법을 잘 준수하는 의사들의 보호막이 될 수 있다.그래도 난 좋은 의사가 더 많다고 믿고 싶다. 서른 살 때 뇌수막염에 걸려서 40도 고열로 정신마저 오락가락할 때, 나를 안심시키고 격려하면서 치료해 주었던 신경외과 의사 선생님은 지금까지 고맙다. 우리 엄마의 수다를 얹은 증상 넋두리를 다정하게 잘 들어주는 동네 내과 선생님도 고맙다. 그래서 한편으론 궁금하다. 그분들도 이 법안을 반대할까.저작권자(c) 오마이뉴스(시민기자), 무단 전재 및 재배포 금지덧붙이는 글 | 이 글은 개인 브런치에도 실릴 예정입니다. ▶오마이뉴스 '시리즈'에서 연재하세요!▶이재명 경기도지사 추천 《이재명과 기본소득》▶오마이뉴스 취재 후원하기"
(서울=뉴스1) 이재명 기자 = 2일 오후 서울 노원구 육군사관학교에서 열린 제77기 졸업 및 임관식에서 졸업 생도들이 기뻐하고 있다. 2021.3.2뉴스
"[현장] 특조위와 환경부의 진실공방 속 환경부 역할 촉구하는 피해자들[강홍구 기자]        ▲ 2일 김태종씨의 서운함이 담긴 한 마디가, 정부 서울청사에 울려퍼졌다. 그는 이마트에서 구입한 가습기살균제 때문에 유가족이 되었다. 배우자 고 박영숙씨는 2020년 여름 운명을 달리했다.             ⓒ 강홍구  ""한정애 (환경부) 장관님! 혹시 장관으로 가시려고, 진상규명 기능을 뺀 건 아닙니까?""김태종씨의 서운함이 담긴 한 마디가, 정부 서울청사에 울려퍼졌다.그는 이마트에서 구입한 가습기살균제 때문에 유가족이 되었다. 배우자 고 박영숙씨는 힘겨웠던 투병생활을 마치고, 2020년 여름 운명을 달리했다.2일 서울시 중구에 위치한 정부 서울청사 앞에서, 가습기살균제 피해자들이 기자회견을 열었다. 이들은 참사의 진상규명에 소극적인 환경부를 비판했다. 가습기살균제 기업책임배상추진회 소속 피해자들과, 시민사회단체들의 연대체인 가습기넷이 함께 참여했다.""한정애 장관이 가습기살균제 참사에 진정성이 있다면 기업들을 독촉하고 중재를 통해, 피해자들에 대한 적극적인 책임을 다할 수 있도록 해주십시오.""그는 재차 호소했다. 이들이 환경부를 성토하고 나선 배경에는, 주무부처임에도 참사의 초기부터 소극적인 대처를 했다는 대목에 있었다.""기업이 책임지도록 해달라""             ▲ 2일 서울시 중구에 위치한 정부 서울청사 앞에서, 가습기살균제 피해자들이 기자회견을 열었다. 이들은 참사의 진상규명에 소극적인 환경부를 비판했다.            ⓒ 강홍구               ▲ 2일 서울시 중구에 위치한 정부 서울청사 앞에서, 가습기살균제 피해자들이 기자회견을 열었다. 이들은 참사의 진상규명에 소극적인 환경부를 비판했다.            ⓒ 강홍구  불미스러운 일도 있었다. 지난 2017년부터 환경부의 가습기 살균제 대응 TF의 피해구제 대책반에서 근무했던 최아무개 서기관은, 애경으로부터 뇌물을 받고 환경부의 정보를 제공해 실형을 선고 받았다. 또한 환경부는 2016~2017년경 피해구제법에 따른 기업부담금을 산정하며 일부 기업들을 누락해, 감사원의 지적을 받기도 했다.2020년 말, 환경부가 국회에 제출한 '사회적 참사의 진상규명 및 안전사회 건설 등을 위한 특별법' 일부개정 법률안 검토의견이라는 문건에 힘입어, 여야의 협상과정에서 특조위 진상규명 파트가 빠져버렸기 때문이기도 하다.이 과정에서 당시 여당의 정책위원장이던 한정애 장관이 상황을 방관한건 아닌지, 좀 더 적극적인 역할을 했어야 하는 것은 아니었는지를 묻는 아쉬움의 토로이기도 했다.한정애 장관은 지난 1월 20일 인사청문회 당시, ""가습기살균제와 같이 이미 피해가 발생한 경우, 피해자 관점의 전향적 지원과 피해구제를 통해 피해자의 마음을 다독이겠다""라고 포부를 밝힌 바 있다.피해자들은 ""국회도 책임이 있지만, 이러한 의견을 제시한 환경부의 책임도 크다""라고 말했다. ""환경부로부터 피해를 인정받은 이들 중, 그동안 실질적인 배상이 이뤄진 피해자들은 650명에 불과하기 때문""이라고 했다.""나머지 3500명 가량의 피해자들은 지금도 자신의 부담으로 치료를 받고 있다""며, 배상문제를 해결하지 않고, 일상으로 돌아갈 수 있겠냐고 반문했다. 아직도 책임을 회피하는 기업들이 행동에 나서도록, 좀 더 적극적으로 나서달라는 호소였다.특히 지난 2월 25일 문호승 특조위원장은 공개적으로 환경부를 비판했다. 그는 환경부가 자료를 투명하게 공개할 의무와 책임을 다하지 않았다고 말했다. 환경부는 다음날 이를 즉각 부인했다. 특조위 측 요청이 온 4건의 자료요청에 대해 협조했다는 것이었다. 하지만 특조위는 2일, 재차 환경부가 8건의 자료제출을 거부하고 있다고 반박했다. 가습기살균제 사건의 두 주무부처 간의, 진실공방이 장기화 되는 양상이다.환경산업기술원이 운영하는 피해구제 포털에 따르면, 2월 28일 기준으로 가습기살균제 피해구제 신청자는 7315명이고 1635명이 사망했다. 정부의 지원대상자는 4168명이다.저작권자(c) 오마이뉴스(시민기자), 무단 전재 및 재배포 금지▶오마이뉴스 '시리즈'에서 연재하세요!▶이재명 경기도지사 추천 《이재명과 기본소득》▶오마이뉴스 취재 후원하기"
