이,재,명
"[경향신문] “아직은 정말 누가 될 지 모른다”.내년 차기 대선을 1년 정도 앞둔 현재, 여론조사상 여권의 대선주자 경쟁 구도는 의외로 확연한 상황이다. 이재명 경기도지사가 2~3위 후보인 이낙연 더불어민주당 대표와 정세균 국무총리를 멀찍이 오차범위 밖으로 밀어낸 상황이기 때문이다. 하지만 민주당 의원들 사이에서는 “아직 모를 일”이라고 입을 모은다. 여론조사에서 흔히 말하는 ‘후보들의 지지 추세’까지도 명확해보이지만, 전문가들은 아직 모른다고만 한다. 왜일까? 1년 동안 ‘경천동지’할 이슈가 발생할 것을 예감하는 것일까? 무엇보다 여당 내부에서는 이 3명 외에도 ‘13룡’에 달하는 후보군의 상승세를 예측하는 시선이 나오고 있다. 내년 대선은 정치권조차도 예상치 못한 ‘대선판’이 펼쳐지는 것 아니냐는 분석이 난무하기 시작한 이유다.이재명 경기도지사(왼쪽부터)와 이낙연 더불어민주당 대표, 정세균 국무총리 경향신문 자료사진■이재명·이낙연·정세균 ‘삼국지’의 본격화이재명 지사, 이낙연 대표, 정세균 총리 등 세 사람의 경쟁구도는 지난 1년 사이에 큰 역전이 이뤄진 상황이다. 내내 대선 주자 1위를 기록하던 이 대표가 이 지사에게 1위 자리를 내준 이후 야권 후보로 분류되는 윤석열 검찰총장에게까지 밀리면서 3위로 내려앉은 터다. 연초 ‘사면론 역풍’까지 맞은 이 대표는 의외로 3위권을 벗어나지 못하면서 고전을 면치 못하는 분위기다, 그 사이에서 이 지사는 ‘복지’를 이슈로 내걸면서 특유의 저돌적인 정치를 정책에 연결시키며 민심의 주목을 받고 있다. 아직 지지율은 미미하지만 코로나19 방역 사령탑인 정 총리의 상승세도 무섭다.세 사람의 ‘삼국지’는 내년 대선 준비의 해인 올해 들어서 본격적으로 불이 붙은 형국이다. ‘발화점’은 재난지원금 보편지급 등을 포함하는 ‘기본소득’에서 시작됐다. 이 지사가 자신의 지론이기도 한 기본소득을 지난해 코로나19 정국의 시작부터 주창하고 나서면서 여권 내부 논쟁이 불거졌지만 대선 준비의 해인 올해초에서야 대선주자들 간의 설전에 불이 붙었다.이 지사가 경기도민을 대상으로 한 재난지원금 보편 지급에 기름을 부으면서 전국민 재난지원금의 추가 지급 논란이 시작되자 재정당국이 반발했고, 여기에 이 대표와 정 총리가 참전하면서 격화된 모습이다.이 지사가 연일 사회관계망서비스(SNS) 글을 통해 여론전에 나서면서 호응을 얻은 반면, 이 대표는 전직 대통령 사면론으로 역풍을 맞으면서 하락을 자초했다. 정 총리는 뒤늦게 두 사람 사이를 비집고 들어가 코로나19 위기 극복 리더십을 발휘하고 있지만 아직 파급력은 그리 크게 미치지 못하고 있는 분위기다.세 사람의 경쟁 구도를 가를 첫 번째 분수령은 오는 4월 7일이 될 것으로 보인다. 서울·부산 시장 등 재·보궐선거의 결과가 나오는 날이다. 선거와 직접적인 연관이 없는 이 지사와 정 총리와 달리 당대표인 이 대표의 운명이 갈음될 수 있는 판이기 때문이다.서울·부산 시장 중 ‘2승’을 할 경우 이 대표의 위상은 반전을 꾀할 수 있게 되겠지만 ‘2패’로 끝날 경우 그의 대선 가도는 먹구름이 끼는 날씨가 불가피해질 것으로 보인다. 서울과 부산 중 서울에서 패배할 경우에도 향후 대선 행보가 쉽지 않을 것으로 관측된다. 한 여론조사 전문가는 12일 통화에서 “부산보다 전국 규모에서 인구가 많은 서울시장 보선에서 패배할 경우 그 결과가 ‘대선 바로미터’로 받아들여질 수 있다”고 분석했다.두 번째 ‘분수령’은 차기 당대표 선거다. 이 대표가 당헌당규상 사직기한인 다음달 8일 사퇴하면 그 공석을 채우기 위한 여당 대표 선거에 돌입하게 된다. 우원식·송영길·홍영표 의원 등이 이미 출마를 준비 중이다. 이들 중에 어떤 사람이 되느냐 여부도 관건이 될 수 있다. 진보진영 전체를 안으려는 우 의원을 제외하곤 송·홍 의원 등은 당내 주류인 ‘친문(재인)계’에 호소하고 있는 터다. 결과에 따라 친문 성향의 후보가 당대표에 오를 경우 올해 후반기부터 진행될 당 대선 후보 경선 과정에서 영향을 미칠 수밖에 없다는 관측이 나온다.■‘13룡’은 언제 나오나?문제는 이들 세 사람의 경쟁구도에도 불이 붙었지만 모두의 시각이 이들에게만 집중된 것은 아니라는 데 있다. 여권에서는 이들의 ‘삼국지’ 외에도 ‘13룡’이 뛰어드는 ‘열국지’가 될 수 있다는 예상이 커지고 있다.13룡의 주인공으로는 ‘이재명·이낙연·정세균’을 제외하고 ‘김경수·김두관·김부겸·박용진·이광재·이인영·임종석·양승조·최문순·추미애’ 등이 꼽힌다.이재명·이낙연·정세균으로 대표되는 세 사람의 경쟁구도에 피로감을 느낀 여론이 새롭게 여권의 후보군에 시선을 주기 시작했다는 분석이다.지지층을 중심으로 가장 먼저 소환을 받고 있는 것은 김경수 경남도지사와 추미애 전 법무부 장관 등이다.김 지사의 경우 지난해 11월 이른바 ‘드루킹 사건’으로 유죄 판결을 받았지만 친문계 지지층의 강한 지지를 받는 인사로 분류된다. 대법원 확정 판결 여부가 관건이지만 그의 대선행 가능성은 살아있다.추 전 장관의 경우 문재인 정부 검찰개혁의 최일선에서 뛰었다는 평가를 받으면서 강성 지지층의 지지를 받는다. 하지만 대중적인 확장성보다는 지지층에게만 몰두하면서 ‘편향된 지지’만 받는다는 지적이 크다. 동부구치고 집단감염 사태를 제대로 관리해내지 못했다는 비판도 받았다.임종석 전 대통령비서실장의 경우 ‘86그룹’을 대표하는 정치인으로 끊임 없이 대선 주자로 거론되는 인사다. 최근에는 ‘잠행’ 끝에 잇따라 SNS 글을 올리면서 이재명 지사를 직격하고 나서기도 했다. 그러나 2030세대를 중심으로 86그룹에 대한 비판 대상의 중심에 서 있는 인물이기도 하다. 민주당의 한 관계자는 “임 전 실장 역시 이제는 과거의 인물로 인식될 수밖에 없는 상황”이라고 말했다. 박원순 전 서울시장 성추행 사건 이후 우상호 서울시장 후보의 박 전 시장 옹호 등 86그룹 특유의 집단적인 정치 문화를 비판하는 여론도 거센 터다.이광재 의원 역시 ‘원조 친노(무현)’ 그룹의 지지를 받지만 86그룹으로서 대중적인 지지를 받기에는 한계가 크다는 지적이 많다. 김부겸 전 의원은 지난해 8·29 전당대회 출마가 ‘패착’이었다는 비판을 받는다. 당 안팎의 신뢰가 큰 김 전 의원이 섣불리 나섰다는 것이다. 하지만 김 전 의원을 두고선 대선행을 비롯해 정 총리에 이은 차기 국무총리설도 나온다.의외로 여당 내에서도 선뜻 대선주자로 생각지 않았던 김두관·박용진·이인영·양승조·최문순 등 주요 인사들의 이름도 솔솔 거론된다.이들 중에서는 박용진 의원이 일찌감치 대선 출마 의사를 내비치고 ‘전국 투어’를 다니고 있다. 진보 정당 출신으로 보수를 아우르는 합리적인 정치를 주창하면서다. 이인영 통일부 장관의 경우 86그룹의 수장격이라는 한계에도 불구하고 대북 관계에서 성과를 낼 경우 대선 주자로서 부각될 가능성이 살아 있다는 평가를 받는다.무엇보다 민주당에서는 결국 올해 말에서야 윤곽이 드러나지 않겠냐는 예상이 나온다. 문재인 대통령의 임기가 1년 밖에 남지 않았지만 유례 없이 50%에 육박하는 대통령 지지율이 유지되고 있는 만큼 다음 정권도 민주당이 재집권할 수 있지 않겠냐는 자신감이 크다. 당 관계자는 “현재로서는 누구나 다 ‘잠룡’인 상태”라며 “코로나19 상황도 변수가 될 수 있지만 올해 연말쯤에는 13룡의 경쟁구도가 2~3명으로 좁혀지지 않겠냐”고 말했다.박홍두 기자"
"OBS경인TV ‘뉴스 코멘터리 막전막후’서 입장 밝혀이재명 경기도지사가 지난 11일 오후 11시부터 방송된 OBS경인TV 시사토크쇼 ‘뉴스코멘터리 막전막후’에서 여런 현안에 대한 입장을 밝혔다.© 뉴스1(경기=뉴스1) 송용환 기자 = 이재명 경기도지사가 최근 논란이 된 더불어민주당 탈당과 관련해 “16년간 민주당원이다. 왜 탈당하나”라며 입장을 분명히 했다.이 지사는 지난 11일 오후 11시부터 방송된 OBS경인TV 시사토크쇼 ‘뉴스코멘터리 막전막후’에서 이같이 밝혔다.MC를 맡은 박지훈 변호사는 이 지사에게 “오늘 당 색깔 넥타이 하셨다. 일부 언론에서 탈당한다고 하는데”라고 물었다.이 지사는 “소망 사항을 그렇게 말한 것이다.(웃음) 제가 왜 탈당하나”라며 “합당하고 이런 게 있기는 하지만 저는 탈당한 일 한 번도 없다. 지난 2005년부터 16년 정도 됐다. 제가 왜 탈당하나”라고 반문했다.이어 “제가 탈당했으면 하는 사람들이 있다. 왜냐하면 저 인간 좀 나갔으면 좋겠다. 그런데 그런 분들은 극히 소수”라며 “민주당 지지자 또는 문재인 대통령을 지지자가 압도적으로 저를 응원하는데 왜 나가나. 나갔으면 하는 소망 사항을 그렇게 쓴 것”이라고 탈당은 없음을 분명히 했다.이 지사는 앞서 지난 9일 자신의 SNS를 통해서도 탈당에 대한 입장을 밝히기도 했다.이 지사는 “돈에 종속되지 않고 행복한 일 하며 사람답게 살 수 있도록 최소한의 삶을 보장하는 ‘기본소득’, 돈이 생명의 가치를 흔들지 못하도록 최저한의 금융소비자 권리를 보장하는 ‘기본대출’, 집 때문에 더 이상 불안하지 않도록 주거권을 보장하는 ‘기본주택’. 민주당 외에 어느 정당에서 실현 가능하겠느냐”고 했다.이어 “여러 이유로 저의 탈당을 바라는 분이 계신 것 잘 안다. 오해가 있다면 진심을 다해 풀도록 노력하겠다”고 덧붙였다"
"당정이 '4차 재난지원금' 추경 조기 편성에는 합의했지만 여전히 지급 방식과 규모에는 뜻을 모으지 못했다. 사진은 지난 1월 20일 고위당정협의회에 참석하는 이낙연 더불어민주당 대표와 김태년 원내대표, 홍남기 경제부총리 겸 기획재정부 장관, 김상조 청와대 정책실장. 남윤호 기자'재난지원금 선별·보편' 논쟁에 국민 피로감 쌓여[더팩트ㅣ박숙현 기자] 2021년 2월. 코로나19 확진자 수가 400명대 안팎을 유지하며 3차 대유행이 조금씩 진정될 무렵이다. 여당이 '4차 재난지원금'을 지급하겠다고 공식화했다. 나라 곳간을 책임지는 기획재정부는 곧바로 난색을 보였다. 여당 내부에선 소극적 관료주의를 지적하며 홍남기 경제부총리 사퇴 목소리가 나왔다. 당정이 비공개로 만났고, 그 결과 어쨌든 '4차 재난지원금'을 지급하기로 했다.지난 1차, 2차, 3차 때와 판박이다. 당시에도 당정이 지급 규모와 시기 등을 두고 기싸움을 했다. 당정은 1차 재난지원금 때 야당의 주장을 받아들여 '보편 지급'을 결정했다. 2~3차는 선별 지급 방식에 뜻을 모아왔다. 지난달까지만 해도 4차 재난지원금을 주더라도 선별 지급하는 쪽에 무게가 실려 있었다.그래서 여의도 외곽에서 나오는 유력 대권주자의 강력한 '보편지급' 목소리에도 제동을 걸었다. 이재명 경기지사가 전 도민 대상 '제2차 경기도 재난기본소득 지급'을 주장하자 이 대표는 지난달 19일 방송에 출연해 ""지금 거리두기 중인데, 소비하라고 말하는 것이 마치 왼쪽 깜빡이를 켜고 오른쪽으로 가는 것과 비슷할 수가 있다""고 했다.앞서 민주당 김종민 최고위원도 ""방역당국과 조율되지 않은 성급한 정책은 자칫 국가방역망에 혼선을 줄 수 있다""며 이 지사를 저격했다. 전 도민 재난지원금을 지급하면 소비하려는 이들이 늘면서 사회적 거리두기 등 정부 방역 방침에도 방해될 수 있다는 취지였다. 민주당 지도부는 경기도에 직접 당 공식 입장을 전하기도 했지만, 이 지사는 지난달 28일 당초 계획한 대로 '설 명절 전 지급'을 강행하겠다고 밝혔다. 그러면서 ""지금이 3차 대유행의 저점에 해당한다는 것이 경기도의 판단""이라고 했다.반복되는 당정 갈등은 코로나19에 지친 국민에 피로감을 더 안길 뿐이다. 지난 1월 12일 더불어민주당 중앙당사 앞에서 요식업에 대한 방역수칙 규제완화 등을 촉구하는 집회를 열고 현수막을 들고 있는 의식있는 자영업자 모임 요식업 비상대책 위원회 회원들. 이선화 기자그런데 이 대표가 지난 2일 국회 본회의 교섭단체 대표연설에서 ""4차 재난지원금을 준비하겠다""면서 ""맞춤형 지원과 전 국민 지원을 함께 협의하겠다""는 파격 제안을 했다. 이 대표는 전 국민 지원에 대해 ""경기 진작을 위해서""라고 밝혔다. 이 대표의 '맞춤형+전 국민' 지원 방식의 목적이 이 지사의 그것과 다르지 않아 보인다. 또 ""코로나 추이를 살피며 지급 시기를 결정하겠다""는 전제도 무색할 만큼 여당은 '보편 지급'을 강하게 밀어붙이는 모양새다.그러나 코로나19 상황이 달라진 것도 아니다. 이 대표가 이 지사를 향해 '왼쪽 깜빡이'라며 비판했던 지난달 19일 0시 기준 국내 발생 신규 확진자 수는 351명이었다. 이 대표 교섭단체 대표연설 전날인 1일 0시 기준 확진자 수는 285명이다. 이달 초 200명대를 유지하다 9일 다시 400명대로 진입한 상황이다. 확진자 추이가 크게 달라지지 않았는데도 재난지원금 지원 방식에 대한 여당 기준이 오락가락한 점이 가장 큰 문제다.4차 재난지원금은 자영업자와 소상공인, 취약계층 등 더 어려움을 호소하는 쪽에 더 많이 지원해야 하지 않을까 싶다. 이달 말부터 백신접종이 시작된다고 하지만 코로나 사태가 언제 끝날지 모를 일이다. 또 전문가들은 우리나라 국가채무 증가 속도가 가팔라 국채 발행을 통한 대규모 지원금 지급은 국가 신용도 하락으로 이어져 중장기적으로 재정위기가 발생하고 소득 불평등을 가져올 수 있다고 경고한다.코로나19 집중 피해 계층에 지원금을 선별 지급하는 방식이 보편지급보다 효과가 크다는 민간연구기관 분석도 나온다. 10일 전국경제인연합회 산하 연구기관인 한국경제연구원은 취약계층을 집중 지원하는 게 소득 보전과 경기 부양 효과가 더 크다는 조사 결과를 제시했다. 아울러 선별 지급 방식의 문제점으로 거론되는 대상 선별에 따른 시간과 행정적 소모도 지난 재난지원금 지급을 거치며 상당히 줄어들었을 것으로 보인다.당정은 4차 재난지원금 지급을 위한 추경 편성을 속도감 있게 진행하는 데 뜻을 모았다. 갈등은 봉합되는 듯 보이지만, 불씨는 남아있다. 이 대표는 10일 기자들과 만나 ""재난지원금 지급 방식, 규모, 시기는 설 연휴가 지난 뒤 빠른 속도로 협의할 것""이라고 했다. 같은 날 홍 부총리는 ""자영업자와 소상공인 등 피해계층의 고통에 대해 정부도 엄중히 인식하고 있다""며 여전히 선별 지원 필요성을 강조하는 발언을 했다.재난지원금 논쟁은 설 연휴가 지나면 다시 치열해질 것이다. 왁자지껄해야 할 명절 대목에도 자영업자, 소상공인은 한숨 쉬고 있는데 당정 갈등이 재연되는 것은 참으로 민망한 일이다. 이들에게 한마디만 던지고 싶다. ""재난지원금 지급, 한두 번 하는 게 아니잖아요?"""
"광주를 방문 중인 이재명 경기지사가 29일 오후 광주시청 입구에서 환영객 사이에 서 있는 어린이와 인사하고 있다. 이 지사는 인공지능헬스케어 플랫폼 구축 결성식에 참석하고자 광주시청을 찾았다. 연합뉴스더불어민주당 이재명 경기자사의 여론조사 결과가 '맑음' 상태로 연일 계속되자 이 지사와 가까운 민주당 의원들의 행보도 더 신중해지고 있다.12일 더불어민주당 관계자는 본지와의 전화 인터뷰에서 ""최근 당내 대권 경쟁 구도가 이재명 지사의 '1강 체제'로 굳어지고 있다""며 ""이로인해 다른 경쟁자들의 견제가 심해지고 있는 상황""이라고 했다.그러면서 ""집중견제를 받을 것 으로 보이므로 친이재명계가 로우키 대응을 나설 것""이라고 말했다.이 지사와 친분이 두터운 의원들의 모습에서 이같은 당내분위기가 감지되기 시작했다.이 지사를 향한 당 안팎의 비판에 적극적으로 대응하던 일부의원들이 최근에는 비교적 자제하는 모습을 보이고 있는 것.특히 재선 김영진 의원의 경우 당 원내총괄수석부대표를 맡고 있다는 점에서 이재명 경기지사와 관련한 공개발언을 더욱 자제하고 있는 것으로 알려졌다.또 지난해 5원 더불어민주당 경선에 도전했던 4선 정성호 의원 역시 올해 원내대표 경선에 재도전을 하지 않을 것으로 보인다. 지금 상황에서 원내대표에 도전 하는 것 자체가 이 지사에게 도움이 되지 않을 것이라는 것이다.한편 이재명 지사는 지난 9일 일각에서 불거진 더불어민주당 탈당설에 대해 ""내 사전에 탈당은 없다""며 다시금 선을 그었다.이 지사는 이날 오후 자신의 페이스북에 글을 올려 ""민주당이 없으면 이재명도 없고, 이재명의 염원도 없다""고 했다.장성혁 기자"
"기본소득 51조, 보편·선별 재난지원 등 30조, 손실보상 98조잠룡 요구 모두 들어주면 올해 국가채무 1135조원 돌파한다1980년 日과 같은 일반정부 부채비율…증가세 전망도 비슷“이자상환 부담…결국 국가 신용도에도 악영향 미칠 수밖에”[헤럴드경제=홍태화 기자] 코로나19 이후 최근 대선 잠룡 중심으로 쏟아진 재정지원책 규모가 최대 180조원에 이를 수 있는 것으로 나타났다. 일본식 재정중독이 시작되는 것이 아니냐는 우려가 나온다. 1980년대부터 늘어온 일본 일반정부 부채는 1990년대 버블붕괴 이후 천문학적으로 증가했다.이낙연 더불어민주당 대표·이재명 경기도지사·정세균 국무총리 등 잠룡이 제시한 재정지원책에 들어가는 소요재원은 최대 179조8000억원에 이를 것으로 추정된다. 해당 재원을 모두 국채로 충당하면 올해 국가채무는 1135조8000억원에 달하게 된다.12일 기획재정부에 따르면 올해 본예산 편성액을 기준으로 연말 국가채무는 956조원에 달할 전망이다. 애초 정부안보다 2조2000억원이 늘어난 558조원 규모 예산안을 처리했다.이 대표가 내놓은 전국민·선별 동시 재난지원금 등을 추가하면 30조원 가량이 더 소요된다. 예비비는 3차 재난지원금으로 이미 대부분 소진했기 때문에 국채를 중심으로 한 추가경정예산 편성이 불가피하다. 이런 경우엔 국가채무가 986조원을 기록한다.전국민·선별지원을 동시에 하게 되면 단순계산으로도 23조6000억원이 필요하다. 1차 전국민 재난지원금과 3차 맞춤형 재난지원금은 각각 14조3000억원과 9조3000억원이 소요됐다. 여기에 ‘신(新)복지제도’ 구상까지 밝히면서 아동수당 지급 대상을 만 18세까지 확대하겠다고 발표했다. 6조원 가량의 추가 부담 가능성이 생겼다.이 지사가 꺼낸 전국민에게 기본소득 연 100만원을 보장하는 방안이 현실화되면 51조원이 추가로 필요하다. 단기 목표로 밝힌 1인당 25만원 연 2회 지급(4인 가구 연간 200만원)하려면 26조원을 준비해야 하고, 이를 축소 1인당 25만원씩 분기별 지급(4인 가구 연간 400만원)으로 늘리면 25조원을 추가로 마련해야 한다.그는 국채 발행이 아닌 조세감면 축소와 증세로 이를 충당하겠다는 입장이지만, 국채 발행이 전무할지는 장담하기 어렵다. 천문학적 재원이 소요되기 때문이다. 해당 재원이 국채발행으로 충당된다고 가정하면 올해 국가채무는 1007조원에 달한다.정 총리는 손실보상법을 들고 나왔다. 정부가 시행한 사회적 거리두기 방침에 따라 집합금지 혹은 집합제한을 당한 업종 손실을 보상해주겠다는 것이다.손실측정이 어려워 필요재원 추산은 제각각이나 최대 추산으로는 4개월 기준 98조8000억원이 소요된다. 집합금지업종은 손실매출의 70%, 그외 업종은 50~60% 내에서 보상해주는 방안이다. 사실상 국채발행이 불가피하다. 이 경우 국가채무는 1054조8000억원으로 치솟는다.나라빚 증가세는 1980·1990년대 일본과 비슷하다. 지난해 ‘국내총생산(GDP)’ 대비 ‘일반정부 부채(D2)’ 비율은 1980년 일본과 같다. 국제통화기금(IMF)에 따르면 1980년 일본 GDP 대비 일반정부 부채비율은 48.81%였다. 지난해 국내 해당 지표는 48.41%였다. 이후 증가 추이도 비슷하게 전개된다. 5년 뒤인 1985년 일본은 69.68%를 기록했고, 2025년 우리나라는 64.96%를 기록할 것으로 전망됐다.증가세가 시작된 이후 일본 일반정부 부채는 매우 가파르게 늘어났다. 일반정부 부채비율은 1996년 100%, 2009년 200%를 넘겼고, IMF는 2025년 263.99%를 기록할 것으로 전망했다. 45년만에 5배가 넘게 급증한 것이다.일본도 이를 조절하려 갖은 방법을 동원했지만, 이미 급증세를 탄 재정적자를 막을 수 없었다. 긴축재정 정책을 펼치기만 하면 나타나는 경기침체를 정부와 정권 입장에서 버틸 재간이 없었던 것이다.1990년대 들어 나라빚이 급격하게 늘어나자 일본은 1996년 소비세율을 3%에서 5%로 인상해 세입을 늘렸다. 증세에 나선 것이다. 그러나 일시적인 개선에 머물렀다. 긴축정책 실시되자 경기가 냉각됐고 1998년 일본 조세수입은 1996년보다 후퇴했다. 2001년엔 국채 발행액을 연 30조엔 이하로 조절하겠다고 발표했지만, 1년 만에 포기했다.복지지출을 중심으로 늘어난 세출이 문제로 지적된다. 일본 연금제도는 버블붕괴 전에 기획됐다. 경기침체를 예상하고 짠 모델이 아니었다. 여기에 급격한 고령화사회 진입이 겹쳤다. 정부 예산이 복지지출을 막기위해 매년 들어가기 시작했다.홍기용 인천대 교수는 “일본은 노령화가 시작됐고, 복지혜택 세출은 늘어났는데 세입은 늘지 못했다”며 “지출증가와 수입증가가 따라오면 괜찮은데 재정건전성 때문에 긴축재정을 하면 세입이 늘 수가 없는 아이러니에 빠졌다”고 설명했다. 이어 “연금은 이미 약속했고, 줄일 수가 없었다”며 “여기에 모든 부를 고도성장기를 겪은 노인이 들고 있으면서 경제가 정체됐다”고 덧붙였다.국내 상황도 비슷하게 전개되고 있다. 고령화는 이미 시작됐다. 2020년 합계 출산율은 0.9명 미만, 연간 출생아수는 27만 명대로 역대 최저치를 기록할 것으로 추산된다.여기에 코로나19 이후 정치권을 중심으로 재정지원책이 경쟁적으로 쏟아지고 있다. 기본소득, 보편·선별 재난지원, 손실보상법 등 각종 지원책을 합치면 최대 180조원 가량이 소요될 수 있다. 지난해 명목 GDP가 1919조원 이었다는 점을 감안하면, GDP 대비 9%에 달하는 재원이 필요하다.김소영 서울대 교수는 “정치권 요구를 모두 들어준다면 국가채무는 올해 말 국내총생산(GDP) 대비 50% 후반대가 될 것”이라며 “국가채무는 불가역성이 있어 향후에 줄일 수 없는데, 이정도로 급증시키면 이자율이 올라가 이자상환 부담이 점차 올라가고 결국 국가 신용도에도 영향을 미칠 수밖에 없다”고 설명했다."
