이,재,명
"범야권 대선주자 1위로 부상한 윤석열 총장…검찰 출신 인사의 정치 도전, 대표 사례는 '홍준표-안대희' 모델[아시아경제 류정민 기자] 편집자주2022년 대선을 1년 1개월 앞둔 상황에서 ‘차기 대선주자’ 지지율 1~3위는 이재명 경기도지사, 윤석열 검찰총장, 이낙연 더불어민주당 대표이다. 이들은 각각 경기도지사 출신, 검사 출신, 국무총리 출신이라는 이력을 갖고 있다. 흥미로운 점은 1987년 직선제 도입 이후 역대 대통령 중 경기도지사나 검사, 국무총리 출신은 단 한 명도 없다는 점이다. 이재명 지사, 윤석열 총장, 이낙연 대표의 경력을 둘러싼 ‘대선 징크스’를 3회에 걸쳐 진단해본다.①'대선 점집' 단골손님 경기지사, 기묘한 '청와대 궁합'② ‘국민검사’도 건너기 어려웠던 정치라는 망망대해③ 대선 트랙 앞에만 서면 작아지는 ‘행정의 달인들’[이미지출처=연합뉴스]‘정치인 홍준표’는 검사 출신 정치인 중에서 가장 화려한 이력의 소유자다. 한나라당 대표와 자유한국당 대표를 역임했으며 민선 경남도지사를 두 번이나 지냈다. 가장 최근 대선인 2017년 대선에서 여당 후보로 나선 인물이다. 정치인 홍준표의 이력을 설명할 때 검사와 정치인 중 어느 쪽에 무게를 둬야하는지는 생각해볼 대목이다. 그가 국회의원에 당선돼 원내 입성한 시기는 1996년으로 25년 전의 일이기 때문이다. 정치인 홍준표의 위상은 정치인으로서의 업적을 토대로 만들어졌다. 범야권 대선주자 지지율 1위를 질주하는 윤석열 검찰총장이 주목할 부분이다. 윤석열 총장은 본인 의지와 무관하게 범야권의 대선주자로 분류되고 있다. 정치 참여에 대한 의사를 밝힌 적도 없는데 대중은 그를 원하고 있다는 얘기다. 정치인 홍준표와 윤석열 총장의 공통점은 검사 시절에 대중적 인지도를 확장했다는 점이다. '홍준표 모델'을 '윤석열 모델'로 바로 적용하기 어려운 것은 정치적 예열 과정에 차이가 있기 때문이다. 정치인 홍준표는 충분한 준비기간을 거쳐서 대선에 도전했는데 윤석열 총장이 2022년 대선 도전을 선택한다면 충분한 시간을 확보하기 어렵다. 검사 출신 인사 가운데 대중적 관심도만 놓고 본다면 윤석열 총장 못지않게 시선을 끌었던 인물은 있다. 대검 중앙수사부장을 지낸 안대희 전 대법관이다. 2004년 불법대선자금 수사를 진두지휘하면서 '국민 검사' 칭호를 받은 인물이다. 당시 현직 대통령의 핵심 측근을 구속수사할 정도로 강단을 보였다.   서울고검장을 역임한 그는 대법관까지 오르면서 법조인 이력의 정점을 찍었다. 정치권의 러브콜도 이어졌다. 오랜 기다림 끝에 정치 참여를 선언하자 대선 판도를 흔들 인물의 등장이라는 평가까지 나왔다. 하지만 검사 안대희가 이룬 업적과 정치인 안대희에 대한 평가는 같을 수 없다. 정치는 망망대해를 항해하는 작업이다. 선장의 지위에 오르기까지 수많은 준비 과정이 필요하다. 국민검사의 정치 도전은 아쉬움만 남겼다. 안대희 전 대법관은 2016년 제20대 총선에서 서울 마포구갑 지역구에 새누리당 후보로 출마했지만 33.2%라는 저조한 득표율로 낙선했다. 정치인 안대희로서는 처음이자 마지막 공직선거 경험이었다.정치인 안대희도 기대를 받은 인물이지만 윤석열 총장이 받고 있는 기대와는 차이가 있다. 정치인 안대희는 대선의 다크호스 정도로 평가받았다. 윤석열 총장은 본인 의지와 무관하게 범야권의 대안으로 평가받고 있다. 인생의 대부분을 검사로 살아온 그에게 정치는 쉽지 않은 도전이다. 정치 참여는 본인 의지가 중요하지만 시대가 자리를 만들어 내기도 한다. 만약 윤석열 총장이 '큰 꿈'을 꾸고 있다면 2022년은 놓칠 수 없는 기회이다. 훗날을 도모할 경우 그에게 언제 다시 기회가 찾아올지 모른다. 정치인 홍준표는 1996년 국회의원이 된 이후 20년 가까이 흐른 2017년에 대선 후보 자리에 올랐다. 환갑이 지난 윤석열 총장의 나이를 고려할 때 '홍준표 모델'를 기다리기는 어렵다. 범야권이 처해 있는 환경도 그에게는 기회 요인이다. 제1야당인 국민의힘 쪽에서는 뚜렷한 대선후보가 부상하지 않는 상황이다. 여론조사에 포함된 정치인들의 지지율도 3~5% 정도가 그나마 높은 수준이다. 현재 무소속으로 있는 정치인 홍준표나 국민의당 대표인 정치인 안철수의 지지율이 국민의힘 정치인들의 지지도를 웃돌고 있다. 대선 후보군으로 분류되는 범야권 인사들이 4월 서울시장 보궐선거에 뛰어든 것도 변수 요인이다. 시간이 지나갈수록 윤석열 총장의 정치적 몸값은 커질 수 있다. 문제는 검찰총장 2년 임기를 채운 뒤 7월에 물러날 경우 차기 대선은 8개월을 남겨놓게 된다는 점이다. 대선후보 선출 과정을 고려하면 남은 기간은 더 짧아진다. 윤석열 총장이 정치 도전을 선택한다면 준비 과정은 만만치 않을 것을 보인다. 검사라는 옷을 벗어 던지는 순간 지금과는 차원이 다른 정치적 공격이 뒤따를 수도 있다. 1987년 이후 대선 역사를 되짚어보면 변호사 출신 대통령은 탄생했지만 검사 출신 대통령은 없었다. 가장 최근인 2017년 대선에서 정치인 홍준표가 도전장을 냈지만 당선권과는 거리가 멀었다. 검사 출신 인사 누구도 넘어서지 못했던 청와대의 문턱, 윤석열 총장은 그곳을 넘는 최초의 사례가 될까. 아니면 정치와는 담을 쌓고 법조인의 길을 계속 걸어가게  될까. 오는 7월 이후 윤석열 총장의 행보가 궁금해지는 대목이다.류정민 기자"
"이재명 ""정치, 보람되지만 칼날 위 걸으며 홀로 된 기분""이재명 경기도지사가 내달 1일부터 모든 도민에게 10만원씩의 재난소득을 지급하는 안을 밝히고 있다.[사진 제공 = 연합 뉴스]여권 '잠룡'으로 꼽히는 이재명 경기도지사가 민족 명절인 설을 맞아 가족에 대한 그리움과 감사한 마음을 표현했다.이 지사는 12일 자신의 사회관계망서비스(SNS)에 '어머니 첫 설 제사도 못 지내니'라는 제목의 글을 올려 ""정치라는 일이 보람되고 영광스러운 일입니다만 때로 칼날 위를 걸으며 세상에 홀로 된 기분일 때가 많다""고 밝혔다.그는 ""그럴 때면 어머니가 생각난다""며 ""가진 것 없고 앞길 막막하던 시절 천둥벌거숭이인 저를 믿고 지지해 주신 유일한 분이셨으니까""라고 강조했다.이어 ""그저께는 어머님이 꿈에 나타나셨다. 성묘도 못가고 설 제사도 못지내는 죄스러운 마음 때문이겠지요""라면서 ""이번 3월 첫 기제사라도 코로나상황이 개선되어 참례할 수 있으면 좋겠다""고 말했다.이 지사는 다른 가족에 대해서도 언급했다. 그는 ""저보다 먼저 세상을 떠난 우리 여동생은 참으로 착한 노동자였다""며 ""열심히 선거운동을 했던 여동생은 자기가 직장을 바꾸면 동네 사람들이 성남시장 당선된 오빠 덕 봤다는 의심을 받는다며 그만두겠다고 벼르던 요구르트 배달 일을 수년간 계속했다""고 전했다.이어 ""제가 시장에 재선된 뒤에야 청소미화원으로 전직하더니 얼마 안돼 새벽에 건물 화장실 청소를 하던중 뇌출혈로 세상을 떠나고 말았다""며 ""힘들게 살던 또 다른 가족은 어렵사리 구한 새 직장이 성남시 지원을 받는 곳이라 오해를 살까 싶어 억지로 퇴직시키기도 했다. 시장인 저 때문에 덕 보기는커녕 왜 피해를 입느냐는 항변에 할 말이 없었다""고 했다.그러면서 ""도대체 제가 뭐라고 얼마나 많은 이들에 빚지며 여기까지 왔는지, 산다는 게 참 그렇다""며 ""백번 고맙다고 말하고 싶은데 그러지 못해 서글프다""고 말했다.이 지사는 ""제사 명절 핑계로 모여 적당히 얼굴 보고 이해하며 용서받고 사랑 나눌 기회조차 갖지 못하니 안타깝다""며 ""애증의 우리 셋째형님께도 그렇다""고 덧붙였다. 그가 언급한 셋째 형님은 '친형 강제 입원' 논란 당사자인 고(故) 이재선씨다.[사진 제공 = 이재명 경기도지사 페이스북 일부 캡처]그는 끝으로 ""화전민이 버리고 떠난 소개집 안방 개다리소반에 둥글게 모여앉아 보리밥에 없는 찬이나마 시끌벅적 저녁 먹던 풍경이 아련하다""며 ""지나고 나니 부모님 그늘 아래 온 가족이 함께 했던 그때가 가난하고 힘들어도 행복했던 것 같다. 여러분도 사랑하는 가족들과 함께, 다시 못 올 오늘의 행복을 많이 찾아 누리시기 바란다""고 말했다.[맹성규 매경닷컴 기자"
"OBS경인TV 출연해 경기도정 성과에 대한 입장 밝혀이재명 경기도지사가 11일 오후 11시부터 1시간 동안 방송된 OBS경인TV 시사토크쇼 ‘뉴스코멘터리 막전막후’에 출연, 각종 현안에 대한 입장을 밝혔다.© 뉴스1(경기=뉴스1) 송용환 기자 = 차지 대선주자 지지율 1위를 달리고 있는 이재명 경기도지사가 첫 번째 성과로 국민 다수가 기본소득에 동의하고 있다는 점을 꼽았다.이 지사는 11일 오후 11시부터 1시간 동안 방송된 OBS경인TV 시사토크쇼 ‘뉴스코멘터리 막전막후’에서 이같이 밝혔다.이날 프로그램은 이 지사가 단독출연 한 가운데 두 명의 MC와 대담하는 방식으로 진행됐다.두 MC 중 한 명인 박지훈 변호사는 “(차기 대선 지지율)부동의 1위를 하고 있다. 이 지사는  내가 아닌 공무원들이 잘했기 때문에 그렇게 됐다 말씀해주셨다. 그동안 많은 성과가 있었는데 첫 번째로 꼽을 수 있는 성과가 무엇인지”를 물었다.그동안 지지율 1위를 기록할 때마다 이 지사는 “경기도정에 집중한 것에 대해 좋은 평가를 해준 것 같다”는 입장을 밝힌 바 있다. 이날 방송에서 이 지사는 박 변호사 질문에 ‘기본소득제’를 1순위로 꼽았다.이 지사는 “코로나19가 우리가 앞으로 맞닥뜨리게 될 디지털 세계, 소위 4차 산업혁명 시대를 급격하게 앞당기고 있는데 그 때에 대한 대안이 없다”며 “기껏 과거의 정책 확장판을 내서 때워 보려고 하는데 마치 댐이 무너진 것처럼 전혀 다른 상황이라 그건 사실 대안이 못된다”고 진단했다.이어 “결국 기본소득이나 근본적인 대책을 세워야 하는데 제일 큰 성과라면 5년 전 성남시장때는 미친 사람, 진짜 포퓰리스트 이렇게 평가받았던 기본소득에 대해서 국민들 다수가 동의하고 있다는 게 제일 큰 성과 같다”며 “우리가 맞닥뜨릴 아주 불안하고, 어떻게 변할지 모르는 그 세계에 새로운 가능성을 열었다고 생각한다”고 확신했다.도의 경우 청년기본소득(만24세 청년에 분기별 25만원씩 지급)을 시행 중이고, 농민기본소득(농민 1인당 월 5만원씩 지급)을 추진 중이다.지난해와 올해는 코로나19로 인한 경기침체와 도민들의 경제적 어려움 해결을 위해 '재난기본소득'(전체 도민 1인당 10만원씩 지급)을 지급했다"
"""어머니 첫 설 제사도 못 지내니···용서받고 사랑 나눌 기회조차 갖지 못해 안타까워""[서울경제] 이재명 경기도지사는 12일 “정치라는 일이 보람되고 영광스러운 일입니다만 때로 칼날 위를 걸으며 세상에 홀로 된 기분일 때가 많다”고 말했다. 이 지사는 이날 페이스북에 ‘어머니 첫 설 제사도 못 지내니···’이란 제목의 글을 통해 “가까이 소중한 것들을 놓치고 있던 것은 없었나 돌아보고 소파에 이리저리 뒤척이는 사이 그리운 사람들도, 기억 저편에 아득히 사라졌던 장면들도 떠오른다”며 이렇게 밝혔다.이 지사는 “작년 한식과 추석에 부모님 산소에 인사를 못간데 이어 이번 설에는 어머님 사후 첫 설 제사에도 참례 못했다”며 “집안 제사를 맡고 계신 둘째 형님 가족이 4명이라 방역지침 때문에 갈 수가 없었다”고 했다.이어 “부모님 산소에 혼자라도 가고 싶었지만, 고향방문 자제하라는데 명색이 공직자인 제가 부모님 만나겠다고 고향방문 할 수는 없는 노릇 아니겠습니까”라고 했다.이 지사는 “코로나 때문이니 이해해 주시겠지만, 지난해 3월 어머님 돌아가시고 대법원 선고 후 한 번 밖에 뵈러 못 간 것이 영 마음에 걸린다”며 “가진 것 없고 앞길 막막하던 시절 천둥벌거숭이인 저를 믿고 지지해 주신 유일한 분”이라고 말했다. 그는 “열심히 선거운동을 했던 여동생은 자기가 직장을 바꾸면 동네 사람들이 성남시장 당선된 오빠 덕 봤다는 의심을 받는다며 그만두겠다고 벼르던 요구르트 배달 일을 수년간 계속했다”며 “힘들게 살던 또 다른 가족은 어렵사리 구한 새 직장이 성남시 지원을 받는 곳이라 오해를 살까 싶어 억지로 퇴직시키기도 했다”고 했다. 그러면서 이 지사는 “도대체 제가 뭐라고 얼마나 많은 이들에 빚지며 여기까지 왔는지, 산다는 게 참 그렇다. 백번 고맙다고 말하고 싶은데 그러지 못해 서글프다. 제사 명절 핑계로 모여 적당히 얼굴 보고 이해하며 용서받고 사랑 나눌 기회조차 갖지 못하니 안타깝다”며 “애증의 우리 셋째 형님께도 그렇다”고 덧붙였다. 이 지사가 언급한 셋째 형님은 ‘친형 강제 입원’ 논란 당사자인 재선(2017년 사망)씨다.이 지사는 “화전민이 버리고 떠난 소개집 안방 개다리소반에 둥글게 모여앉아 보리밥에 없는 찬이나마 시끌벅적 저녁 먹던 풍경이 아련하다”며 “여러분도 사랑하는 가족들과 함께 다시 못 올 오늘의 행복을 많이 찾아 누리시기 바란다”고 했다.<다음은 이 지사 SNS전문>어머니 첫 설 제사도 못 지내니···눈코 뜰 새 없는 일상을 보내며 한껏 긴장했던 몸이 차분히 가라앉습니다. 가까이 소중한 것들을 놓치고 있던 것은 없었나 돌아보고 소파에 이리저리 뒤척이는 사이 그리운 사람들도, 기억 저편에 아득히 사라졌던 장면들도 떠오릅니다.매년 형제 조카들과 함께 한식과 추석을 맞아 경북 안동 청량산 언저리 고향을 찾아 선대 산소에 풀을 베고 성묘하는 게 큰 낙이었습니다. 고생하시던 부모님 숨결이 이곳 저곳 남아 있고, 철부지 동무들과 천방지축 뛰놀던 추억이 살아 있고, 부모님이 함께 영원히 잠들어 쉬고 계시는 곳이지요.그런데 작년 한식과 추석에 부모님 산소에 인사를 못간데 이어 이번 설에는 어머님 사후 첫 설 제사에도 참례 못했습니다. 집안 제사를 맡고 계신 둘째 형님 가족이 4명이라 방역지침 때문에 갈 수가 없었습니다.부모님 산소에 혼자라도 가고 싶었지만 고향방문 자제하라는데 명색이 공직자인 제가 부모님 만나겠다고 고향방문 할 수는 없는 노릇 아니겠습니까.코로나 때문이니 이해해 주시겠지만 지난 3월 어머님 돌아가시고 대법원 선고 후 한 번 밖에 뵈러 못간 것이 영 마음에 걸립니다. 저만이 아니라 정부방침과 모두의 안전 때문에 많은 분들이 그리 하고 계시겠지요.그저께는 어머님이 꿈에 나타나셨습니다. 성묘도 못가고 설 제사도 못지내는 죄스러운 마음 때문이겠지요.이번 3월 첫 기제사라도 코로나상황이 개선되어 참례할 수 있으면 좋겠습니다.정치라는 일이 보람되고 영광스러운 일입니다만 때로 칼날 위를 걸으며 세상에 홀로 된 기분일 때가 많습니다. 그럴 때면 어머니가 생각납니다. 가진 것 없고 앞길 막막하던 시절 천둥벌거숭이인 저를 믿고 지지해 주신 유일한 분이셨으니까요.저보다 먼저 세상을 떠난 우리 여동생은 참으로 착한 노동자였습니다. 열심히 선거운동을 했던 여동생은 자기가 직장을 바꾸면 동네 사람들이 성남시장 당선된 오빠 덕 봤다는 의심을 받는다며 그만두겠다고 벼르던 요구르트 배달 일을 수년간 계속했습니다.제가 시장에 재선된 뒤에야 청소미화원으로 전직하더니 얼마 안돼 새벽에 건물 화장실 청소를 하던중 뇌출혈로 세상을 떠나고 말았습니다.힘들게 살던 또 다른 가족은 어렵사리 구한 새 직장이 성남시 지원을 받는 곳이라 오해를 살까 싶어 억지로 퇴직시키기도 했습니다. 시장인 저 때문에 덕 보기는커녕 왜 피해를 입느냐는 항변에 할 말이 없었습니다. 도대체 제가 뭐라고 얼마나 많은 이들에 빚지며 여기까지 왔는지, 산다는 게 참 그렇습니다. 백번 고맙다고 말하고 싶은데 그러지 못해 서글픕니다. 제사 명절 핑계로 모여 적당히 얼굴 보고 이해하며 용서받고 사랑 나눌 기회조차 갖지 못하니 안타깝습니다. 애증의 우리 셋째형님께도 그렇습니다.남은 형제들과 전화로나마 안부를 전한 오늘, 밤공기가 제법 달큰합니다. 아마도 봄이 오나 봅니다. 부모님이 누워계신 고향 청량산 일대에도 철부지들 간식이던 진달래가 곧 지천으로 흐드러지게 피겠지요.화전민이 버리고 떠난 소개집 안방 개다리소반에 둥글게 모여앉아 보리밥에 없는 찬이나마 시끌벅적 저녁 먹던 풍경이 아련합니다. 지나고 나니 부모님 그늘 아래 온 가족이 함께 했던 그때가 가난하고 힘들어도 행복했던 것 같습니다. 여러분도 사랑하는 가족들과 함께, 다시 못 올 오늘의 행복을 많이 찾아 누리시기 바랍니다윤종열 기자"
