윤,석,열
"이낙연·이재명·윤석열  [연합뉴스]    이재명 경기도지사가 차기 대선주자 지지도에서 이낙연 더불어민주당 대표와 윤석열 검찰총장을 모두 두 배 이상 격차로 앞선다는 여론조사 결과가 나왔다.입소스는 SBS 의뢰로 지난 6∼9일 전국 만 18세 이상 1002명을 대상으로 차기 대선주자 중 누구를 지지하는지 조사했다. 13일 이 여론조사 결과에 따르면 이 지사가 28.6%를 기록했다. 이 대표는 13.7%, 윤 총장은 13.5%로 각각 집계됐다. 이 지사는 특히 40대(42.2%), 진보성향(41.7%)에서 높은 지지를 받았다. 더불어민주당 지지층에서도 42.8%의 지지를 얻어 이 대표(27.9%)에 앞섰다. 이 대표는 광주·전라 지역에서만 36.5%로 이 지사(30.0%)를 앞섰다.바람직한 차기 대선 결과에 관한 질문에는 여당의 정권 재창출이 45.5%, 야당으로의 정권교체가 46.0%로 팽팽했다.정당 지지율은 더불어민주당이 38.5%, 국민의힘이 20.8%였다. 이어 국민의당 6.1%, 정의당 5.3%, 열린민주당 4.5% 순이었다.이 조사의 오차범위는 95% 신뢰수준에 ±3.1%포인트다. 자세한 내용은 중앙선거여론조사심의위원회 홈페이지를 참조하면 된다. 김광태기자"
"입소스 조사···차기 대선, 여당 45.5% 야당 46.0%광주·전라에서는 이낙연 대표가 이재명 지사 앞서홍준표 5%대...유승민·정세균·추미애 모두 1%대이재명 경기도지사. 연합뉴스[서울경제] 차기 대선주자 지지도에서 이재명 경기도지사가 여전히 독주 채비를 갖췄다는 여론조사 결과가 나왔다. 더불어민주당 이낙연 대표와 윤석열 검찰총장과 함께 공고한 1강 2중 구도를 형성한 모양새다.입소스가 SBS 의뢰로 지난 6∼9일 전국 만 18세 이상 1,002명을 대상으로 차기 대권 관련 여론조사를 실시한 결과 응답자의 28.6%는 이 지사를 지지한다고 밝혔다. 이 대표와 윤 총장은 각각 13.7%, 13.5%를 기록했다. 이들의 뒤는 홍준표 무소속 의원(5.3%)이 이었다. 국민의힘 유승민 전 의원, 정세균 국무총리, 추미애 전 법무부 장관은 모두 1%대 지지율을 기록했다.이낙연 민주당 대표. 연합뉴스이 지사는 특히 40대(42.2%)와 진보성향(41.7%)에서 높은 지지를 받았다. 더불어민주당 지지층에서도 42.8%의 지지를 얻어 이 대표(27.9%)에 앞섰다. 다만 광주·전라 지역에서는 이 대표가 36.5%로 이 지사(30.0%)보다 많은 지지를 얻었다.바람직한 차기 대선 결과에 관한 질문에는 여당의 정권 재창출이 45.5%, 야당으로의 정권교체가 46.0%를 기록했다. 정당 지지율은 더불어민주당 38.5%, 국민의힘 20.8%였다. 이어 국민의당 6.1%, 정의당 5.3%, 열린민주당 4.5% 순이었다.이 조사의 오차범위는 95% 신뢰수준에 ±3.1%포인트다. 자세한 내용은 중앙선거여론조사심의위원회 홈페이지를 참조하면 된다.윤석열 검찰총장. 연합뉴스윤경환 기자"
